app_id,unified_app_id,app_name,app_category,worldwide_release,initial_release,app_size,app_lang,multihoming,paid,in_app_purchases,app_version,app_version_date,release_note
1444383602,1000600000669647,Goodnotes 6,Productivity,2019-01-15,2019-01-15,496.74,15,1,0,1,5.6.23,2020-11-13,Fixed rare crashes when using highlighter. Previously in 5.6.22: added require hold to snap option to the shapes tool. Disable the option to let lines snap to other lines again automatically without having to hold down tapping undo after drawing a filled shape will remove the line first instead of the filling added support for resizing circles in a fixed ratio fixed glitches when erasing small ellipses fixed recurring sync error alerts fixed an issue that caused text boxes to be duplicated after modifying it with dismissed keyboard added some more stability improvements
1444383602,1000600000669647,Goodnotes 6,Productivity,2019-01-15,2019-01-15,496.74,15,1,0,1,5.6.22,2020-11-11,This update adds some more improvements to the shape recognition as well as other bug fixes: added require hold to snap option to the shapes tool. Disable the option to let lines snap to other lines again automatically without having to hold down tapping undo after drawing a filled shape will remove the line first instead of the filling added support for resizing circles in a fixed ratio fixed glitches when erasing small ellipses fixed recurring sync error alerts fixed an issue that caused text boxes to be duplicated after modifying it with dismissed keyboard added some more stability improvements
1444383602,1000600000669647,Goodnotes 6,Productivity,2019-01-15,2019-01-15,496.74,15,1,0,1,5.6.21,2020-11-06,This update fixes two issues that can sometime cause crash: editing a file while auto backup is uploading that file indexing PDF or handwritten notes Previous release notes This update includes performance improvements and bug fixes: Fixed app cannot launch and hang in white screen for some users Fixed handwriting disappears after using lasso tool in some case Fixed add page button becomes unresponsive in some cases Fixed recurring sync error alerts
1444383602,1000600000669647,Goodnotes 6,Productivity,2019-01-15,2019-01-15,496.74,15,1,0,1,5.6.19,2020-11-05,This update fixes two issues that can sometime cause crash: editing a file while auto backup is uploading that file indexing PDF or handwritten notes Previous release notes This update includes performance improvements and bug fixes: Fixed app cannot launch and hang in white screen for some users Fixed handwriting disappears after using lasso tool in some case Fixed add page button becomes unresponsive in some cases Fixed recurring sync error alerts
1444383602,1000600000669647,Goodnotes 6,Productivity,2019-01-15,2019-01-15,496.74,15,1,0,1,5.6.18,2020-11-04,This update includes performance improvements and bug fixes: Fixed app cannot launch and hang in white screen for some users. Fixed handwriting disappears after using lasso tool in some cases. Fixed add page button becomes unresponsive in some cases. Fixed recurring sync error alerts.
1444383602,1000600000669647,Goodnotes 6,Productivity,2019-01-15,2019-01-15,496.74,15,1,0,1,5.6.16,2020-11-02,This update adds more options for personalizing the pen tool. Tap and hold the pen tool icon in the toolbar to configure the following options: the tip sharpness the degree of pressure sensitivity Other bug fixes and improvements: fixed occasional writing lag fixed a bug where undo wasn t working after searching in a document fixed incorrect sync error alerts improved the stability of the app
1444383602,1000600000669647,Goodnotes 6,Productivity,2019-01-15,2019-01-15,496.74,15,1,0,1,5.6.15,2020-10-25,Fix sync optimization error if user switches between versions in some rare cases. Previous release notes: reduced writing lag when writing quickly improved the toolbar layout for split screen rotation and full screen fixed a bug where the app was not responsive after using a pinch gesture improved scrolling behavior many smaller stability improvements and fixes
1444383602,1000600000669647,Goodnotes 6,Productivity,2019-01-15,2019-01-15,496.74,15,1,0,1,5.6.12,2020-10-22,reduced writing lag when writing quickly improved the toolbar layout for split screen rotation and full screen fixed a bug where the app was not responsive after using a pinch gesture improved scrolling behavior many smaller stability improvements and fixes
1444383602,1000600000669647,Goodnotes 6,Productivity,2019-01-15,2019-01-15,496.74,15,1,0,1,5.6.9,2020-10-08,Bug fixes and enhancements
1444383602,1000600000669647,Goodnotes 6,Productivity,2019-01-15,2019-01-15,496.74,15,1,0,1,5.6.7,2020-10-07,This version addresses crash on launch issues for iOS 12.4.8
1444383602,1000600000669647,Goodnotes 6,Productivity,2019-01-15,2019-01-15,496.74,15,1,0,1,5.6.5,2020-10-05,This release contains some bug fixes performance improvements and addressed some crash on launch issues for iOS 12
1444383602,1000600000669647,Goodnotes 6,Productivity,2019-01-15,2019-01-15,496.74,15,1,0,1,5.6.3,2020-10-02,This update fixes an issue with indexing new documents and notes for searching. Previous release notes: Study With Flash Cards GoodNotes lets you create flash cards that you can study with the Spaced Repetition learning technique. To create a flash card add a new page using the Flash Card paper template Flash card paper is currently only available in the size GoodNotes Standard Size and can be found in the Essentials template group all the way on the right side Add the question on the top half and the answer on the bottom half. Tip: Use images text and handwriting to create great looking and information rich flash cards. To study all flash cards in a document the flash card deck tap on the ... menu and then on Study Flash Cards Tap on the screen to reveal the answer and then choose how easy it was to remember the answer. GoodNotes will suggest your next study date based on your learning progress and the selected difficulty of the cards. The more you study the more accurate these suggestions will become. E.g.: You will see hard cards more often and sooner than easy cards. You can reset your entire learning progress for the current deck in the settings in the flash card studying screen. Note that this is not reversible and the entire progress for this deck is lost as if you would have never studied it before. Other fixes improvements added a dialogue for when there are incompatible sync versions installed that isn t blocking you from using GoodNotes Fixed crashes related to the new shape and text features Fixed the multi selection gesture for the library and page
1444383602,1000600000669647,Goodnotes 6,Productivity,2019-01-15,2019-01-15,496.74,15,1,0,1,5.6.2,2020-09-30,This build includes several bug fixes and performance improvements as well as a new experimental feature: Flash Cards. Study With Flash Cards GoodNotes lets you create flash cards that you can study with the Spaced Repetition learning technique. To create a flash card add a new page using the Flash Card paper template Flash card paper is currently only available in the size GoodNotes Standard Size and can be found in the Essentials template group all the way on the right side Add the question on the top half and the answer on the bottom half. Tip: Use images text and handwriting to create great looking and information rich flash cards. To study all flash cards in a document the flash card deck tap on the ... menu and then on Study Flash Cards Tap on the screen to reveal the answer and then choose how easy it was to remember the answer. GoodNotes will suggest your next study date based on your learning progress and the selected difficulty of the cards. The more you study the more accurate these suggestions will become. E.g.: You will see hard cards more often and sooner than easy cards. You can reset your entire learning progress for the current deck in the settings in the flash card studying screen. Note that this is not reversible and the entire progress for this deck is lost as if you would have never studied it before. Other fixes improvements added a dialogue for when there are incompatible sync versions installed that isn t blocking you from using GoodNotes Fixed crashes related to the new shape and text features Fixed the multi selection gesture for the library and page
1444383602,1000600000669647,Goodnotes 6,Productivity,2019-01-15,2019-01-15,496.74,15,1,0,1,5.6.0,2020-09-24,We re excited to introduce improved shape drawing and updates to the text tool: Draw and hold with the pen and highlighter support for curves subsequent shape editing faster text style selection text box drop shadow and more. Here s what s new: Draw and hold Draw a stroke with the pen or highlighter tool and hold down with your finger or stylus at the end of the stroke to convert it to a perfect shape or line Continue holding down and drag your finger stylus across the screen to resize or rotate the shape This adds back the ability to draw shapes with the highlighter that many of you missed from GoodNotes 4 Select shapes Tap on a shape using your finger or the shapes tool to select it You can now edit it using the points on the lines To resize or rotate a shape use the lasso tool Draw curves We re introducing curves as a new shape in this update You can change the slope of a curve when editing it More options for shape drawing You can disable Draw and Hold in the pen tool options. Tap on the pen tool icon in the toolbar twice to access them Strokes you draw can snap to other stroke endpoints which allows you to create perfect shapes with multiple strokes. If the shape is closed it can be selected and edited as a whole instead of only selecting the single lines New selected state for text boxes Tapping on a text box once will select it so that you can make edits to the text box as a whole without bringing up the keyboard right away You can move selected text boxes or change the style easily Double tap on a text box to start typing New toolbar layout and styles The text tool receives an improved contextual area so that the style options are easier to access A new drop shadow option has been added to the text box style options We updated the FontAPI so that custom system fonts are now visible in GoodNotes 5 on iOS 14
1444383602,1000600000669647,Goodnotes 6,Productivity,2019-01-15,2019-01-15,496.74,15,1,0,1,5.5.8,2020-09-16,This version includes changes that require updating GoodNotes on all your devices. Minor adjustments to look and feel of document tabs Minor improvements related to iCloud sync Other minor bug fixes
1444383602,1000600000669647,Goodnotes 6,Productivity,2019-01-15,2019-01-15,496.74,15,1,0,1,5.5.7,2020-09-11,This version fixes a bug where unexpected sync loop of certain documents might happen if GoodNotes is opened on multiple devices.
1444383602,1000600000669647,Goodnotes 6,Productivity,2019-01-15,2019-01-15,496.74,15,1,0,1,5.5.6,2020-09-09,Bug fixes and performance improvements
1444383602,1000600000669647,Goodnotes 6,Productivity,2019-01-15,2019-01-15,496.74,15,1,0,1,5.5.5,2020-09-02,Bugfixes and performance improvements
1444383602,1000600000669647,Goodnotes 6,Productivity,2019-01-15,2019-01-15,496.74,15,1,0,1,5.5.4,2020-09-01,Bugfixes and performance improvements.
1444383602,1000600000669647,Goodnotes 6,Productivity,2019-01-15,2019-01-15,496.74,15,1,0,1,5.5.3,2020-08-28,This version fixes freeze and writing lag issues during sync INTRODUCING SHARED DOCUMENTS Finding new ways to work together with other people is now more important than ever. This update adds the ability to share documents with other GoodNotes users and edit them together. How to share a document 1. Open a document in GoodNotes and tap on the Share icon 2. Tap on Collaborate and enable Link Sharing 3. Copy the link to your clipboard or send it directly to other people so that they can open it on their iOS iPadOS devices and accept the shared document You can find more information on all new features and instructions on how to use them on goodnotes.com shared documents What you can use shared documents for Shared documents are incredibly versatile. Here s some inspiration what you could use them for: Ask someone else to leave comments an annotations on a PDF document you drafted Share notes with your classmates to check if you understood everything from your last lecture correctly Collect signatures or feedback on a document from a group of people Make your meeting notes available to your entire team immediately Share grocery shopping lists calendars journals and more with your family members Read and annotate a book together Correct someone s homework Brainstorm with your team Play Tic Tac Toe or Battleships with friends Plan a home renovation project and even share it with your interior designer to get their feedback Changes to shared documents sync via iCloud and take around 15 30 seconds to show up on other devices. Currently anyone with the link can open and edit a shared document in GoodNotes. We recommend sharing documents with trusted people only. Happy sharing! OTHER RELEASE NOTES added a page number indicator when scrolling. This can be disabled in Menu Settings Document Editing fixed a crash that happened occasionally when exporting documents fixed some minor design issues
1444383602,1000600000669647,Goodnotes 6,Productivity,2019-01-15,2019-01-15,496.74,15,1,0,1,5.5.1,2020-08-27,This version fixes a bug where sync indicator cloud icon keeps showing with down arrow after successful sync. INTRODUCING SHARED DOCUMENTS Finding new ways to work together with other people is now more important than ever. This update adds the ability to share documents with other GoodNotes users and edit them together. How to share a document 1. Open a document in GoodNotes and tap on the Share icon 2. Tap on Collaborate and enable Link Sharing 3. Copy the link to your clipboard or send it directly to other people so that they can open it on their iOS iPadOS devices and accept the shared document You can find more information on all new features and instructions on how to use them on goodnotes.com shared documents What you can use shared documents for Shared documents are incredibly versatile. Here s some inspiration what you could use them for: Ask someone else to leave comments an annotations on a PDF document you drafted Share notes with your classmates to check if you understood everything from your last lecture correctly Collect signatures or feedback on a document from a group of people Make your meeting notes available to your entire team immediately Share grocery shopping lists calendars journals and more with your family members Read and annotate a book together Correct someone s homework Brainstorm with your team Play Tic Tac Toe or Battleships with friends Plan a home renovation project and even share it with your interior designer to get their feedback Changes to shared documents sync via iCloud and take around 15 30 seconds to show up on other devices. Currently anyone with the link can open and edit a shared document in GoodNotes. We recommend sharing documents with trusted people only. Happy sharing! OTHER RELEASE NOTES added a page number indicator when scrolling. This can be disabled in Menu Settings Document Editing fixed a crash that happened occasionally when exporting documents fixed some minor design issues
1444383602,1000600000669647,Goodnotes 6,Productivity,2019-01-15,2019-01-15,496.74,15,1,0,1,5.5.0,2020-08-26,INTRODUCING SHARED DOCUMENTS Finding new ways to work together with other people is now more important than ever. This update adds the ability to share documents with other GoodNotes users and edit them together. How to share a document 1. Open a document in GoodNotes and tap on the Share icon 2. Tap on Collaborate and enable Link Sharing 3. Copy the link to your clipboard or send it directly to other people so that they can open it on their iOS iPadOS devices and accept the shared document You can find more information on all new features and instructions on how to use them on goodnotes.com shared documents What you can use shared documents for Shared documents are incredibly versatile. Here s some inspiration what you could use them for: Ask someone else to leave comments an annotations on a PDF document you drafted Share notes with your classmates to check if you understood everything from your last lecture correctly Collect signatures or feedback on a document from a group of people Make your meeting notes available to your entire team immediately Share grocery shopping lists calendars journals and more with your family members Read and annotate a book together Correct someone s homework Brainstorm with your team Play Tic Tac Toe or Battleships with friends Plan a home renovation project and even share it with your interior designer to get their feedback Changes to shared documents sync via iCloud and take around 15 30 seconds to show up on other devices. Currently anyone with the link can open and edit a shared document in GoodNotes. We recommend sharing documents with trusted people only. Happy sharing! OTHER RELEASE NOTES added a page number indicator when scrolling. This can be disabled in Menu Settings Document Editing fixed a crash that happened occasionally when exporting documents fixed some minor design issues
1444383602,1000600000669647,Goodnotes 6,Productivity,2019-01-15,2019-01-15,496.74,15,1,0,1,5.4.43,2020-08-19,fixed an issue that caused app freeze improved performance when opening larger documents
1444383602,1000600000669647,Goodnotes 6,Productivity,2019-01-15,2019-01-15,496.74,15,1,0,1,5.4.42,2020-08-18,improved stability of the app by fixing a couple of known crashes improved performance when importing multiple files at the same time
1444383602,1000600000669647,Goodnotes 6,Productivity,2019-01-15,2019-01-15,496.74,15,1,0,1,5.4.41,2020-08-12,fixed a bug where dragging and dropping a GoodNotes document into GoodNotes would create a couple of folders instead optimized the size of GoodNotes documents with a lot of copied and pasted pages. Tip: In case you have documents that seem to be overly large export and reimport them as GoodNotes documents. This should reduce the file size. optimized vertical scrolling performance for large documents fixed a couple of crashes
1444383602,1000600000669647,Goodnotes 6,Productivity,2019-01-15,2019-01-15,496.74,15,1,0,1,5.4.40,2020-08-11,fixed a bug where dragging and dropping a GoodNotes document into GoodNotes would create a couple of folders instead optimized the size of GoodNotes documents with a lot of copied and pasted pages. Tip: In case you have documents that seem to be overly large export and reimport them as GoodNotes documents. This should reduce the file size. optimized vertical scrolling performance for large documents fixed a couple of crashes
1444383602,1000600000669647,Goodnotes 6,Productivity,2019-01-15,2019-01-15,496.74,15,1,0,1,5.4.38,2020-08-04,This update includes some under the hood improvements to prepare GoodNotes for an upcoming new feature. Stay tuned!
1444383602,1000600000669647,Goodnotes 6,Productivity,2019-01-15,2019-01-15,496.74,15,1,0,1,5.4.36,2020-07-21,fixed a bug that prevented users to enable disable additional export options under certain conditions updated some confusing messages when opening documents in GoodNotes via the browser share extension further improved highlighter on dark paper fixed a bug that caused the app to crash for some users when requesting files from Dropbox improved the alert that shows up when the version is outdated so that sync may not work properly tip: The App Store sometimes doesn t show the update right away. You will need to search for GoodNotes and visit our product page to update
1444383602,1000600000669647,Goodnotes 6,Productivity,2019-01-15,2019-01-15,496.74,15,1,0,1,5.4.35,2020-07-14,Fixed a bug that causes text boxes to be not resizable.
1444383602,1000600000669647,Goodnotes 6,Productivity,2019-01-15,2019-01-15,496.74,15,1,0,1,5.4.34,2020-07-13,Fixed cache files not being deleted in some situations. Improved overall stability when opening many documents.
1444383602,1000600000669647,Goodnotes 6,Productivity,2019-01-15,2019-01-15,496.74,15,1,0,1,5.4.32,2020-07-09,Improved the position of new pages when adding them via the Add Page button in vertical scrolling direction Fixed a problem where the auto backup feature would sometimes require more device storage than necessary
1444383602,1000600000669647,Goodnotes 6,Productivity,2019-01-15,2019-01-15,496.74,15,1,0,1,5.4.31,2020-07-06,fixed a crash affecting a lot of users Release notes of 5.4.30 improved the visibility of the highlighter on dark paper fixed the bug that caused text boxes to become non editable after pasting text from websites fixed a bug that affected resizing text boxes after duplicating them included some minor visual changes and improvements
1444383602,1000600000669647,Goodnotes 6,Productivity,2019-01-15,2019-01-15,496.74,15,1,0,1,5.4.30,2020-07-02,improved the visibility of the highlighter on dark paper fixed the bug that caused text boxes to become non editable after pasting text from websites fixed a bug that affected resizing text boxes after duplicating them included some minor visual changes and improvements
1444383602,1000600000669647,Goodnotes 6,Productivity,2019-01-15,2019-01-15,496.74,15,1,0,1,5.4.29,2020-06-17,Fine tuned trackpad mouse usage for moving objects on the page and using the resizing and rotating controls
1444383602,1000600000669647,Goodnotes 6,Productivity,2019-01-15,2019-01-15,496.74,15,1,0,1,5.4.28,2020-06-11,Fixed glitches when changing text box styles.
1444383602,1000600000669647,Goodnotes 6,Productivity,2019-01-15,2019-01-15,496.74,15,1,0,1,5.4.27,2020-06-09,option to export documents or pages as zip archive when choosing Image as export file type Fixed some bugs with the text tool replaced the dark Cornell portrait paper in A4 that had some misalignments further improved the stability of the app by fixing some bugs that cause GoodNotes to crash Fixed an error that was preventing some users from syncing made some optimizations to reduce the storage size required by GoodNotes
1444383602,1000600000669647,Goodnotes 6,Productivity,2019-01-15,2019-01-15,496.74,15,1,0,1,5.4.26,2020-05-28,Better support of new iPadOS pointer in document edit view Enable images file type in import dialog Other bug fixes and improvements
1444383602,1000600000669647,Goodnotes 6,Productivity,2019-01-15,2019-01-15,496.74,15,1,0,1,5.4.24,2020-05-25,Add trackpad scroll support Fix app freeze related to Copy and Paste Fix potential crashes related to trashing documents with multiple selection Other bug fixes and enhancements
1444383602,1000600000669647,Goodnotes 6,Productivity,2019-01-15,2019-01-15,496.74,15,1,0,1,5.4.23,2020-05-14,Sort by Type: in addition to sorting your library by name or date you can now sort it by type to separate folders and documents better. Improved rectangle recognition from shape tool Fixed some crashes and minor bugs
1444383602,1000600000669647,Goodnotes 6,Productivity,2019-01-15,2019-01-15,496.74,15,1,0,1,5.4.22,2020-05-05,Minor changes and improvements
1444383602,1000600000669647,Goodnotes 6,Productivity,2019-01-15,2019-01-15,496.74,15,1,0,1,5.4.21,2020-04-29,further improvements to the ink algorithm that should fix a problem where some pen strokes are shortened from time to time
1444383602,1000600000669647,Goodnotes 6,Productivity,2019-01-15,2019-01-15,496.74,15,1,0,1,5.4.20,2020-04-22,fixed a problem where highlighter strokes would look darker when closing and reopening the app fixed a problem where some options in the settings were not showing up on the iPad Pro 2020
1444383602,1000600000669647,Goodnotes 6,Productivity,2019-01-15,2019-01-15,496.74,15,1,0,1,5.4.19,2020-04-17,fixed some inconsistency with the ink algorithm introduced in the previous version fixed writing lag after opening the ... menu multiple times when GoodNotes is open in split view
1444383602,1000600000669647,Goodnotes 6,Productivity,2019-01-15,2019-01-15,496.74,15,1,0,1,5.4.18,2020-04-16,fixed a bug where the pen strokes would move when erasing them sometimes improved the shapes tool to fix some minor issues when drawing rectangles fixed a bug where renaming a document when importing it would not be saved remaining a document now starts with a capital letter further improved the ink algorithm and fixed a problem that was causing strokes to be shorter than intended added some visual improvements when switching between lightmode and darkmode
1444383602,1000600000669647,Goodnotes 6,Productivity,2019-01-15,2019-01-15,496.74,15,1,0,1,5.4.17,2020-04-10,Stability improvements.
1444383602,1000600000669647,Goodnotes 6,Productivity,2019-01-15,2019-01-15,496.74,15,1,0,1,5.4.16,2020-04-09,Show thumbnail when importing GoodNotes documents via Open In... Fix occasional crashes from auto backup. Fix rendering glitches with the updated ink algorithm.
1444383602,1000600000669647,Goodnotes 6,Productivity,2019-01-15,2019-01-15,496.74,15,1,0,1,5.4.15,2020-04-06,Fixed low disk space warning show more often than it should Fixed an issue where imported files from a zip archive would not be named correctly Ink and palm rejection improvements Stability improvements and other bug fixes
1444383602,1000600000669647,Goodnotes 6,Productivity,2019-01-15,2019-01-15,496.74,15,1,0,1,5.4.13,2020-03-30,Fixed occasional writing lag. Fixed coloring with highlighter may turn into a line when Draw in Straight Line is enabled. Fixed wrong text box size when pasting text. Improved pull to add page handling in vertical scrolling. Support tapping on the status bar to scroll up in editing mode. Improved general stability.
