app_id,unified_app_id,app_name,app_category,worldwide_release,initial_release,app_size,app_lang,multihoming,paid,in_app_purchases,app_version,app_version_date,release_note,dummy_1,dummy_2,dummy_3,dummy_4,dummy_5,dummy_6,dummy_7,dummy_8
546983235,0,Voice Record Pro,Utilities,2012-09-13,2012-09-13,92.12,1,0,0,1,1.6,2013-08-24,Added ability to take notes while recording Added option to remove vrp prefix from exported files. Added support for importing media from cloud sources like Google Drive DropBox and SkyDrive. Added support of multiple file selection to delete play or change category. As of version 1.6 a small meta file will be send with every export allowing all data including photo notes category etc to be restored on import. Some bugs fixed,0,0,0,0,0,0,0,0
546983235,0,Voice Record Pro,Utilities,2012-09-13,2012-09-13,92.12,1,0,0,1,1.5,2013-07-14,Fixed a bug related to re arrangement of tasks Added photo support to records photo will also be used when exporting to Facebook and Photo Albums. Added text based notes to records. You can now check the recording levels before starting a new record. A new system added for sending large files by email. Now you have the option to send the file as a link. It will be uploaded to VRP servers and link to that file will be sent by email. Links are password protected. Added support of sending movie clip of the record by email. Added support of sending media to FTP servers. Added file name and photo to WiFi download web page. Option to change extension of exported files from MP4 to M4A Fixed a problem causing a small click at the beginning of MP3 converted files. Now screen will go to lock mode by default. To prevent this on some older devices use the option in settings section.,0,0,0,0,0,0,0,0
546983235,0,Voice Record Pro,Utilities,2012-09-13,2012-09-13,92.12,1,0,0,1,1.4,2013-04-16,Fixed a bug related to DropBox upload Instant recording option Better support of operations on low free space situations,0,0,0,0,0,0,0,0
546983235,0,Voice Record Pro,Utilities,2012-09-13,2012-09-13,92.12,1,0,0,1,1.3,2013-03-03,Added support of pause function while recording Added support of sending to other devices via Bluetooth Added support of send records to SoundCloud Added support of custom categories and organizing records into those categories Added support of change the file name Added support of appending records together Added support of reordering tasks Added support of importing records from other apps Fixed a bug related to missing sound track of video when posted to Facebook Improvement in video creation process for Photo Album and Facebook,0,0,0,0,0,0,0,0
546983235,0,Voice Record Pro,Utilities,2012-09-13,2012-09-13,92.12,1,0,0,1,1.2,2013-01-20,Fixed a bug related to DropBox Fixed a bug related to WiFi interface Added pause function Added seek to different positions in playing record Added trim function Added instant play to iPad version Added MP3 convert Added duplicate function,0,0,0,0,0,0,0,0
546983235,0,Voice Record Pro,Utilities,2012-09-13,2012-09-13,92.12,1,0,0,1,1.1,2012-10-10,Added support of post to Facebook Added support of export to other installed apps on your device Fixed a bug related to Dropbox Export Fixed a bug related to Google Drive Export Improvement in interface Added support of iOS6 Added support of iPhone 5 display Minor bugs fixed,0,0,0,0,0,0,0,0
546983235,0,Voice Record Pro,Utilities,2012-09-13,2012-09-13,92.12,1,0,0,1,1.0,2012-09-13,,0,0,0,0,0,0,0,0
