app_id,unified_app_id,app_name,app_category,worldwide_release,initial_release,app_size,app_lang,multihoming,paid,in_app_purchases,app_version,app_version_date,release_note,dummy_1,dummy_2,dummy_3,dummy_4,dummy_5,dummy_6,dummy_7,dummy_8
431050674,1000600000837022,KaraFun Karaoke Singing,Music,2011-08-08,2011-08-08,74.73,6,1,0,1,3.2.3,2016-02-01,What s new 2016 s got a lot going musically and to get you ready for a year of singing we re always making improvements and fixing the minor bugs. Happy Singing!,0,0,0,0,0,0,0,0
431050674,1000600000837022,KaraFun Karaoke Singing,Music,2011-08-08,2011-08-08,74.73,6,1,0,1,3.2.2,2016-01-13,This version includes : Interface improvements Setting preferences are now saved to the iPhone iPad even if a different user logs in Bug fixes,0,0,0,0,0,0,0,0
431050674,1000600000837022,KaraFun Karaoke Singing,Music,2011-08-08,2011-08-08,74.73,6,1,0,1,3.2.1,2015-12-28,The version includes: Fixed bug that blocked subscribers from unlocking certain features Fixed key change bug Fixed bug when saving songs offline The KaraFun team apologizes for any inconvenience and frustration caused! We wish you Happy Holidays and lots of singing!,0,0,0,0,0,0,0,0
431050674,1000600000837022,KaraFun Karaoke Singing,Music,2011-08-08,2011-08-08,74.73,6,1,0,1,3.2.0,2015-12-18,This version includes: In app purchase of 7 days Party Pass New background videos New miniature player: movable resizable with updated controls New player pages: suggestions unreachable 3D Touch Quick Actions available only on 6s and 6s Plus Offline sync tracking Parental control explicit lyrics feature On click default settings when songs are played Overall interface improvements Minor bug fixes KaraFun requires iOS 8 or later Happy Singing!,0,0,0,0,0,0,0,0
431050674,1000600000837022,KaraFun Karaoke Singing,Music,2011-08-08,2011-08-08,74.73,6,1,0,1,3.1.0,2015-09-16,This version includes: Custom default vocals 10 20 ... Pitch change to 6 Cross device signup General optimization and UI improvements Bug and crash fixes,0,0,0,0,0,0,0,0
431050674,1000600000837022,KaraFun Karaoke Singing,Music,2011-08-08,2011-08-08,74.73,6,1,0,1,3.0.4,2015-07-17,Minor improvements,0,0,0,0,0,0,0,0
431050674,1000600000837022,KaraFun Karaoke Singing,Music,2011-08-08,2011-08-08,74.73,6,1,0,1,3.0.3,2015-07-10,This version brings many improvements including: Improved management of the queue Full catalog synchronization for KaraFun Pro. Tempo Management Added icons indicating that a song has been played paused Minor interface improvements Overall improved app performance,0,0,0,0,0,0,0,0
431050674,1000600000837022,KaraFun Karaoke Singing,Music,2011-08-08,2011-08-08,74.73,6,1,0,1,3.0.2,2015-06-23,Start songs in pause mode available in the settings Play or Pause your karaoke directly from the queue Pro feature: add your very own logo during your karaoke Minor interface improvements Fix the karaoke latency at the end of certain songs Bug fix lyrics cut off Improvement of overall app performance Minor bugfixes,0,0,0,0,0,0,0,0
431050674,1000600000837022,KaraFun Karaoke Singing,Music,2011-08-08,2011-08-08,74.73,6,1,0,1,3.0.1,2015-06-02,Searching a song is now more efficient! Add or remove a track to your favorites while it is playing Fixed a bug while using airplay: the text is no longer verticale Fixed song fast forward Fixed various crashes Minor fixes Put the next tracks you want to sing in the queue Minimize the karaoke to navigate in the app without stopping the song you re currently playing Enjoy a brand new interface easier and more handy Choose the tracks you want to synchronize offline from anywhere in the app See the lyrics directly from the app Save your preferences volume pitch for each song automatically,0,0,0,0,0,0,0,0
431050674,1000600000837022,KaraFun Karaoke Singing,Music,2011-08-08,2011-08-08,74.73,6,1,0,1,3.0.0,2015-05-11,Put the next tracks you want to sing in the queue Minimize the karaoke to navigate in the app without stopping the song you re currently playing Enjoy a brand new interface easier and more handy Choose the tracks you want to synchronize offline from anywhere in the app See the lyrics directly from the app Save your preferences volume pitch for each song automatically,0,0,0,0,0,0,0,0
431050674,1000600000837022,KaraFun Karaoke Singing,Music,2011-08-08,2011-08-08,74.73,6,1,0,1,2.0.12,2014-12-17,Fix authentification critical bug Minor bugfixes for iOS 8,0,0,0,0,0,0,0,0
431050674,1000600000837022,KaraFun Karaoke Singing,Music,2011-08-08,2011-08-08,74.73,6,1,0,1,2.0.11,2014-11-04,Minor bugfixes for iOS 8,0,0,0,0,0,0,0,0
431050674,1000600000837022,KaraFun Karaoke Singing,Music,2011-08-08,2011-08-08,74.73,6,1,0,1,2.0.10,2014-10-07,Fixes compatibility with iOS 8,0,0,0,0,0,0,0,0
431050674,1000600000837022,KaraFun Karaoke Singing,Music,2011-08-08,2011-08-08,74.73,6,1,0,1,2.0.9,2014-06-17,Fixed a problem with offline playlists.,0,0,0,0,0,0,0,0
431050674,1000600000837022,KaraFun Karaoke Singing,Music,2011-08-08,2011-08-08,74.73,6,1,0,1,2.0.8,2014-05-23,Fixed a minor bug.,0,0,0,0,0,0,0,0
431050674,1000600000837022,KaraFun Karaoke Singing,Music,2011-08-08,2011-08-08,74.73,6,1,0,1,2.0.7,2014-05-07,Reset your password from the app Minor bugfix,0,0,0,0,0,0,0,0
431050674,1000600000837022,KaraFun Karaoke Singing,Music,2011-08-08,2011-08-08,74.73,6,1,0,1,2.0.6,2014-03-11,Brand new login screen Added swipe left right on iPad when playing a karaoke to hide or show the sidebar Now displays pitch control only on compatible devices,0,0,0,0,0,0,0,0
431050674,1000600000837022,KaraFun Karaoke Singing,Music,2011-08-08,2011-08-08,74.73,6,1,0,1,2.0.5,2014-02-18,Swipe to add a karaoke to your favorites Added Free Section for Non Subscribers Minor Bugfixes,0,0,0,0,0,0,0,0
431050674,1000600000837022,KaraFun Karaoke Singing,Music,2011-08-08,2011-08-08,74.73,6,1,0,1,2.0.4,2014-01-29,New : Signup right from the app Minor bugfix,0,0,0,0,0,0,0,0
431050674,1000600000837022,KaraFun Karaoke Singing,Music,2011-08-08,2011-08-08,74.73,6,1,0,1,2.0.3,2014-01-23,General Bugfix New controls interface for iPad iPhone Swipe to remove favorites New tabs on iPad Featured History Latest added,0,0,0,0,0,0,0,0
431050674,1000600000837022,KaraFun Karaoke Singing,Music,2011-08-08,2011-08-08,74.73,6,1,0,1,2.0.2,2013-12-24,bugfixes and design improvements,0,0,0,0,0,0,0,0
431050674,1000600000837022,KaraFun Karaoke Singing,Music,2011-08-08,2011-08-08,74.73,6,1,0,1,2.0.1,2013-12-08,Minor bugfixes,0,0,0,0,0,0,0,0
431050674,1000600000837022,KaraFun Karaoke Singing,Music,2011-08-08,2011-08-08,74.73,6,1,0,1,2.0,2013-11-28,New : revamped interface more simple and user friendly New : keep your favorite tracks offline New : change the volume of the lead vocals and the pitch New : keep the tracks you love in your favorites Improved performance and stability,0,0,0,0,0,0,0,0
431050674,1000600000837022,KaraFun Karaoke Singing,Music,2011-08-08,2011-08-08,74.73,6,1,0,1,1.1.6,2013-01-29,Bug fixing,0,0,0,0,0,0,0,0
431050674,1000600000837022,KaraFun Karaoke Singing,Music,2011-08-08,2011-08-08,74.73,6,1,0,1,1.1.5,2013-01-04,Bug fix,0,0,0,0,0,0,0,0
431050674,1000600000837022,KaraFun Karaoke Singing,Music,2011-08-08,2011-08-08,74.73,6,1,0,1,1.1.4,2012-12-11,performances improvement,0,0,0,0,0,0,0,0
431050674,1000600000837022,KaraFun Karaoke Singing,Music,2011-08-08,2011-08-08,74.73,6,1,0,1,1.1.3,2012-11-21,Bug fixes iPhone 5 compatibility,0,0,0,0,0,0,0,0
431050674,1000600000837022,KaraFun Karaoke Singing,Music,2011-08-08,2011-08-08,74.73,6,1,0,1,1.1.2,2012-09-30,Compatible with iOS6 Improved performance Bug fixes Now available in Spanish,0,0,0,0,0,0,0,0
431050674,1000600000837022,KaraFun Karaoke Singing,Music,2011-08-08,2011-08-08,74.73,6,1,0,1,1.1.1,2012-01-12,Compatible with iOS6 Improved performance Bug fixes Now available in Spanish,0,0,0,0,0,0,0,0
431050674,1000600000837022,KaraFun Karaoke Singing,Music,2011-08-08,2011-08-08,74.73,6,1,0,1,1.1.0,2011-11-08,On Screen Projection Plug your device to any video projector or TV and turn your iPhone iPad iPod into the smallest yet powerful karaoke machine ever. Available only on iPhone 4 4S iPod Touch and iPad,0,0,0,0,0,0,0,0
431050674,1000600000837022,KaraFun Karaoke Singing,Music,2011-08-08,2011-08-08,74.73,6,1,0,1,1.0,2011-08-08,,0,0,0,0,0,0,0,0
