app_id,unified_app_id,app_name,app_category,worldwide_release,initial_release,app_size,app_lang,multihoming,paid,in_app_purchases,app_version,app_version_date,release_note,dummy_1,dummy_2,dummy_3,dummy_4,dummy_5,dummy_6,dummy_7,dummy_8
1472334093,0,Transcribe Recorder Memo,Productivity,2019-09-26,2019-09-26,9.57,9,0,0,1,1.3.2,2022-09-17,Fixed some rare cases of purchase failure.,0,0,0,0,0,0,0,0
1472334093,0,Transcribe Recorder Memo,Productivity,2019-09-26,2019-09-26,9.57,9,0,0,1,1.3.1,2022-01-30,New editor allows the user to know the time of the phrase. Fix transcription crash for some languages.,0,0,0,0,0,0,0,0
1472334093,0,Transcribe Recorder Memo,Productivity,2019-09-26,2019-09-26,9.57,9,0,0,1,1.3.0,2022-01-16,New editor allows the user to know the time of the phrase. Fix transcription crash for some languages.,0,0,0,0,0,0,0,0
1472334093,0,Transcribe Recorder Memo,Productivity,2019-09-26,2019-09-26,9.57,9,0,0,1,1.2.7,2020-03-25,Fix transcribe failure issue,0,1,0,0,0,0,0,0
1472334093,0,Transcribe Recorder Memo,Productivity,2019-09-26,2019-09-26,9.57,9,0,0,1,1.2.5,2019-12-02,Support customize keywords to improve the transcription accuracy. Use minutes to replace credit points to make it more clear for user to understand the price rate.,0,0,0,0,0,0,0,0
1472334093,0,Transcribe Recorder Memo,Productivity,2019-09-26,2019-09-26,9.57,9,0,0,1,1.2.2,2019-11-01,Support Transcription in English Spanish Portuguese French German Japanese Korean and Chinese. Fix bugs,0,0,0,0,0,0,0,0
1472334093,0,Transcribe Recorder Memo,Productivity,2019-09-26,2019-09-26,9.57,9,0,0,1,1.2.1,2019-10-22,Support Transcription in English Spanish Portuguese French German Japanese Korean and Chinese.,0,0,0,0,0,0,0,0
1472334093,0,Transcribe Recorder Memo,Productivity,2019-09-26,2019-09-26,9.57,9,0,0,1,1.2.0,2019-10-15,Support Transcription in English Spanish Portuguese French German Japanese Korean and Chinese.,0,0,0,0,0,0,0,0
1472334093,0,Transcribe Recorder Memo,Productivity,2019-09-26,2019-09-26,9.57,9,0,0,1,1.1.5,2019-09-27,,0,0,0,0,0,0,0,0
