app_id,unified_app_id,app_name,app_category,worldwide_release,initial_release,app_size,app_lang,multihoming,paid,in_app_purchases,app_version,app_version_date,release_note,dummy_1,dummy_2,dummy_3,dummy_4,dummy_5,dummy_6,dummy_7,dummy_8
1020339980,1000600000001567,Explain Everything Whiteboard,Productivity,2015-11-13,2015-10-10,238.89,15,1,0,1,5.4.7,2019-09-03,Open and edit projects directly in your cloud storage. If you keep your Explain Everything projects on a cloud repository outside the app you can now open them using Files. When you re finished editing your project Explain Everything will automatically save it to the original location. This also lets teachers send and receive Explain Everything projects as Schoolwork assignments.,0,0,0,0,0,0,0,0
1020339980,1000600000001567,Explain Everything Whiteboard,Productivity,2015-11-13,2015-10-10,238.89,15,1,0,1,5.4.6,2019-08-12,Forgot to record something No need to redo the whole thing anymore! You can use the new Insert recording mode to squeeze in any new content. Did you have a lot of interactive whiteboard files made with other programs You can now import .iwb files as Explain Everything projects instead of rebuilding them from scratch!,0,0,0,0,0,0,0,0
1020339980,1000600000001567,Explain Everything Whiteboard,Productivity,2015-11-13,2015-10-10,238.89,15,1,0,1,5.4.5,2019-07-29,We ve added a brand new set of high quality clipart and updated the library! It s now much easier to find the right image thanks to the new search option. Share your screen to other apps with a quick access to the Broadcast option in the Share menu. You can create a screen recording with it too! When you connect to an external screen Explain Everything will let you know about it and allow you to quickly switch between external screen modes.,0,0,0,0,0,0,0,0
1020339980,1000600000001567,Explain Everything Whiteboard,Productivity,2015-11-13,2015-10-10,238.89,15,1,0,1,5.4.4,2019-07-19,We ve added a brand new set of high quality clipart and updated the library! It s now much easier to find the right image thanks to the new search option. Share your screen to other apps with a quick access to the Broadcast option in the Share menu. You can create a screen recording with it too! When you connect to an external screen Explain Everything will let you know about it and allow you to quickly switch between external screen modes.,0,0,0,0,0,0,0,0
1020339980,1000600000001567,Explain Everything Whiteboard,Productivity,2015-11-13,2015-10-10,238.89,15,1,0,1,5.4.3,2019-07-08,We ve added a brand new set of high quality clipart and updated the library! It s now much easier to find the right image thanks to the new search option. Share your screen to other apps with a quick access to the Broadcast option in the Share menu. You can create a screen recording with it too! When you connect to an external screen Explain Everything will let you know about it and allow you to quickly switch between external screen modes.,0,0,0,0,0,0,0,0
1020339980,1000600000001567,Explain Everything Whiteboard,Productivity,2015-11-13,2015-10-10,238.89,15,1,0,1,5.4.2,2019-05-30,Find the right photo for your project. The new Unsplash library is now in the Add Media menu where you can choose from thousands of beautiful images or photos. Saving copies of your local projects to Explain Drive is now much easier. You can save copies directly from the Project Menu while in the project or using the Move option in your library. Explain Everything s tolerance for SVG files wasn t the greatest. We ve spent some time on that and now it munches them like a grown up would.,0,0,0,0,0,0,0,0
1020339980,1000600000001567,Explain Everything Whiteboard,Productivity,2015-11-13,2015-10-10,238.89,15,1,0,1,5.4.1,2019-05-10,Quickly change your workspace layout. With the Workspace Switcher you can toggle between Standard Simple and the brand new Presenter layouts right from your project. Explain Everything projects now show up in the iOS Search so you can get to them in a jiffy. Add files from Slack to your project directly in Explain Everything. Toggling between apps wasn t exactly a productive use of your time. Consider yourself toggle free.,0,0,0,0,0,0,0,0
1020339980,1000600000001567,Explain Everything Whiteboard,Productivity,2015-11-13,2015-10-10,238.89,15,1,0,1,5.4,2019-05-01,What s New New Explainers now can try out all the whiteboarding features without registering. Image Editor went through a makeover and is now back on the catwalk showing off its brand new icons. Fixes Microphone should no longer automatically unmute when joining cloud projects. Other minor bug fixes.,0,0,0,0,0,0,0,0
1020339980,1000600000001567,Explain Everything Whiteboard,Productivity,2015-11-13,2015-10-10,238.89,15,1,0,1,5.3.9,2019-04-10,Add audio clips to your recording. Drag and drop pre recorded narration or existing background sounds into the Timeline for more creative flexibility. Available on iOS 11 and higher. Resolution of images exported with Share Export Image is now much higher. Fixes: Straightening objects with the Hand Tool s double tap gesture wasn t working as intended for some angles. We won t argue with 90 degree angles. Now they re always right. We dealt with many small but annoying bugs so your work in Explain Everything should be more pleasant.,0,0,0,0,0,0,0,0
1020339980,1000600000001567,Explain Everything Whiteboard,Productivity,2015-11-13,2015-10-10,238.89,15,1,0,1,5.3.8,2019-04-04,Add audio clips to your recording. Drag and drop pre recorded narration or existing background sounds into the Timeline for more creative flexibility. Available on iOS 11 and higher. Resolution of images exported with Share Export Image is now much higher. Fixes: Straightening objects with the Hand Tool s double tap gesture wasn t working as intended for some angles. We won t argue with 90 degree angles. Now they re always right. We dealt with many small but annoying bugs so your work in Explain Everything should be more pleasant.,0,0,0,0,0,0,0,0
1020339980,1000600000001567,Explain Everything Whiteboard,Productivity,2015-11-13,2015-10-10,238.89,15,1,0,1,5.3.7,2019-03-07,Added awesome new video hints to welcome new users to Explain Everything. If you re a longtime user and want to see them anyway open the three dots menu and select Video Hints. Got questions We got answers. A brand new in depth help center has been added to assist you. Access it by tapping the three dots menu . Tired of forgetting your CODEs Well now your last CODE is saved for you! Every user has a Last Used Codes list. Fixes: There was a bug causing a popping sound when using an external microphone so we took the stage and won that battle mic drop,0,0,0,0,0,0,0,0
1020339980,1000600000001567,Explain Everything Whiteboard,Productivity,2015-11-13,2015-10-10,238.89,15,1,0,1,5.3.6,2019-03-01,Added awesome new video hints to welcome new users to Explain Everything. If you re a longtime user and want to see them anyway open the three dots menu and select Video Hints. Got questions We got answers. A brand new in depth help center has been added to assist you. Access it by tapping the three dots menu . Tired of forgetting your CODEs Well now your last CODE is saved for you! Every user has a Last Used Codes list. Fixes: There was a bug causing a popping sound when using an external microphone so we took the stage and won that battle mic drop,0,0,0,0,0,0,0,0
1020339980,1000600000001567,Explain Everything Whiteboard,Productivity,2015-11-13,2015-10-10,238.89,15,1,0,1,5.3.5,2019-02-18,More freedom for project participants in view only mode. They can now move around the canvas using Zoom and switch between slides. No need to ask the project s owner about the CODE multiple times. Join with CODE fields now remember and suggest the last 5 CODEs you used to connect to a project. If you fancy a background color with your desired HEX or RGB value check out the new option in the Custom Color template. By the way you can find the Custom Color background picker in the Slide Sorter too. Control automatic rotations precisely. You can now set Inspector s auto rotation speed by providing the RPM value. Additionally multiple bugs with auto rotations during recording were fixed. Fixes When saving a project and inviting people to it Explain Everything would ask whether you d like to overwrite the project again. While we appreciate hospitality it felt a bit overzealous so we scratched the unnecessary question. Some custom clipart for group accounts weren t loading properly and required relogging to fix it. We re not fans of workarounds or bugs like this one so it s no longer the case. A bug was preventing video object scrubbing when it was done in a cloud project. That s been taken care of too.,0,0,0,0,0,0,0,0
1020339980,1000600000001567,Explain Everything Whiteboard,Productivity,2015-11-13,2015-10-10,238.89,15,1,0,1,5.3.4,2019-02-08,Invite with email now you can send email invitations also to people that doesn t have Explain Everything account yet.,0,0,0,0,0,0,0,0
1020339980,1000600000001567,Explain Everything Whiteboard,Productivity,2015-11-13,2015-10-10,238.89,15,1,0,1,5.3.3,2019-02-02,Create projects with custom background colors straight away. Start from Template and select Custom Color. The image quality of objects created with the Cutout Tool is now higher thanks to some engineering magic. You can now Export GIFs from cloud projects. We squashed some minor bugs here and there.,0,0,0,0,0,0,0,0
1020339980,1000600000001567,Explain Everything Whiteboard,Productivity,2015-11-13,2015-10-10,238.89,15,1,0,1,5.3.2,2019-01-30,Create projects with custom background colors straight away. Start from Template and select Custom Color. The image quality of objects created with the Cutout Tool is now higher thanks to some engineering magic. You can now Export GIFs from cloud projects. We squashed some minor bugs here and there.,0,0,0,0,0,0,0,0
1020339980,1000600000001567,Explain Everything Whiteboard,Productivity,2015-11-13,2015-10-10,238.89,15,1,0,1,5.3.1,2019-01-26,Create projects with custom background colors straight away. Start from Template and select Custom Color. The image quality of objects created with the Cutout Tool is now higher thanks to some engineering magic. You can now Export GIFs from cloud projects. We squashed some minor bugs here and there.,0,0,0,0,0,0,0,0
1020339980,1000600000001567,Explain Everything Whiteboard,Productivity,2015-11-13,2015-10-10,238.89,15,1,0,1,5.3,2019-01-24,Create projects with custom background colors straight away. Start from Template and select Custom Color. The image quality of objects created with the Cutout Tool is now higher thanks to some engineering magic. You can now Export GIFs from cloud projects. We squashed some minor bugs here and there.,0,0,0,0,0,0,0,0
1020339980,1000600000001567,Explain Everything Whiteboard,Productivity,2015-11-13,2015-10-10,238.89,15,1,0,1,5.2.9,2018-12-28,Change the project orientation while editing Rename cloud projects while editing Export cloud projects as project file video image or document Drag and drop projects on Explain Everything Drive Quickly create new slides using the active template the template picker is available when adding a slide from the slide sorter No longer need to change to the Hand Tool in order to play video objects Zoom frames of collaboration participants are now hidden by default option in settings Option to disable web browser object via MDM configuration Bug Fixes,0,0,0,0,0,0,0,0
1020339980,1000600000001567,Explain Everything Whiteboard,Productivity,2015-11-13,2015-10-10,238.89,15,1,0,1,5.2.8,2018-12-19,Change the project orientation while editing Rename cloud projects while editing Export cloud projects as project file video image or document Drag and drop projects on Explain Everything Drive Quickly create new slides using the active template the template picker is available when adding a slide from the slide sorter No longer need to change to the Hand Tool in order to play video objects Zoom frames of collaboration participants are now hidden by default option in settings Option to disable web browser object via MDM configuration Bug Fixes,0,0,0,0,0,0,0,0
1020339980,1000600000001567,Explain Everything Whiteboard,Productivity,2015-11-13,2015-10-10,238.89,15,1,0,1,5.2.6,2018-11-24,5.2.6 Update Sharing is caring. The GDrive integration now features team folders. What s New in Explain Everything 5.2 Your cloud projects are now always available for editing to you and anyone you ve invited. Start your ongoing cloud collaborations with the new Invite button. Guests can now join your collaborations with no account required. Invite them with a link or CODE and you ll be working together in no time. We made sure everyone can join your cloud project from a browser with the new Explain Everything s online whiteboard. Web Video Link fiesta! Web Video Links are now optional and a single project can have multiple of them. Redesigned project details help you stay organized with Web Video Links and people you invited. New insert document layouts. Add document pages horizontally vertically in a grid or as a stack. New Timeline lets you take your video editing skills to the next level.,0,0,0,0,0,0,0,0
1020339980,1000600000001567,Explain Everything Whiteboard,Productivity,2015-11-13,2015-10-10,238.89,15,1,0,1,5.2.5,2018-11-09,5.2.5 Update Bug fixes What s New in Explain Everything 5.2 Your cloud projects are now always available for editing to you and anyone you ve invited. Start your ongoing cloud collaborations with the new Invite button. Guests can now join your collaborations with no account required. Invite them with a link or CODE and you ll be working together in no time. We made sure everyone can join your cloud project from a browser with the new Explain Everything s online whiteboard. Web Video Link fiesta! Web Video Links are now optional and a single project can have multiple of them. Redesigned project details help you stay organized with Web Video Links and people you invited. New insert document layouts. Add document pages horizontally vertically in a grid or as a stack. New Timeline lets you take your video editing skills to the next level.,0,0,0,0,0,0,0,0
1020339980,1000600000001567,Explain Everything Whiteboard,Productivity,2015-11-13,2015-10-10,238.89,15,1,0,1,5.2.4,2018-11-06,5.2.4 Update Support for the new Apple Pencil What s New in Explain Everything 5.2 Your cloud projects are now always available for editing to you and anyone you ve invited. Start your ongoing cloud collaborations with the new Invite button. Guests can now join your collaborations with no account required. Invite them with a link or CODE and you ll be working together in no time. We made sure everyone can join your cloud project from a browser with the new Explain Everything s online whiteboard. Web Video Link fiesta! Web Video Links are now optional and a single project can have multiple of them. Redesigned project details help you stay organized with Web Video Links and people you invited. New insert document layouts. Add document pages horizontally vertically in a grid or as a stack. New Timeline lets you take your video editing skills to the next level.,0,0,0,0,0,0,0,0
1020339980,1000600000001567,Explain Everything Whiteboard,Productivity,2015-11-13,2015-10-10,238.89,15,1,0,1,5.2.3,2018-10-30,5.2.3 Update Bug fixes What s New in Explain Everything 5.2 Your cloud projects are now always available for editing to you and anyone you ve invited. Start your ongoing cloud collaborations with the new Invite button. Guests can now join your collaborations with no account required. Invite them with a link or CODE and you ll be working together in no time. We made sure everyone can join your cloud project from a browser with the new Explain Everything s online whiteboard. Web Video Link fiesta! Web Video Links are now optional and a single project can have multiple of them. Redesigned project details help you stay organized with Web Video Links and people you invited. New insert document layouts. Add document pages horizontally vertically in a grid or as a stack. New Timeline lets you take your video editing skills to the next level.,0,0,0,0,0,0,0,0
1020339980,1000600000001567,Explain Everything Whiteboard,Productivity,2015-11-13,2015-10-10,238.89,15,1,0,1,5.2.2,2018-10-19,Your cloud projects are now always available for editing to you and anyone you ve invited. Start your ongoing cloud collaborations with the new Invite button. Guests can now join your collaborations with no account required. Invite them with a link or CODE and you ll be working together in no time. We made sure everyone can join your cloud project from a browser with the new Explain Everything s online whiteboard. Web Video Link fiesta! Web Video Links are now optional and a single project can have multiple of them. Redesigned project details help you stay organized with Web Video Links and people you invited. New insert document layouts. Add document pages horizontally vertically in a grid or as a stack. New Timeline lets you take your video editing skills to the next level.,0,0,0,0,0,0,0,0
1020339980,1000600000001567,Explain Everything Whiteboard,Productivity,2015-11-13,2015-10-10,238.89,15,1,0,1,5.2.1,2018-10-11,Your cloud projects are now always available for editing to you and anyone you ve invited. Start your ongoing cloud collaborations with the new Invite button. Guests can now join your collaborations with no account required. Invite them with a link or CODE and you ll be working together in no time. We made sure everyone can join your cloud project from a browser with the new Explain Everything s online whiteboard. Web Video Link fiesta! Web Video Links are now optional and a single project can have multiple of them. Redesigned project details help you stay organized with Web Video Links and people you invited. New insert document layouts. Add document pages horizontally vertically in a grid or as a stack. New Timeline lets you take your video editing skills to the next level.,0,0,0,0,0,0,0,0
1020339980,1000600000001567,Explain Everything Whiteboard,Productivity,2015-11-13,2015-10-10,238.89,15,1,0,1,5.2,2018-10-08,Your cloud projects are now always available for editing to you and anyone you ve invited. Start your ongoing cloud collaborations with the new Invite button. Guests can now join your collaborations with no account required. Invite them with a link or CODE and you ll be working together in no time. We made sure everyone can join your cloud project from a browser with the new Explain Everything s online whiteboard. Web Video Link fiesta! Web Video Links are now optional and a single project can have multiple of them. Redesigned project details help you stay organized with Web Video Links and people you invited. New insert document layouts. Add document pages horizontally vertically in a grid or as a stack. New Timeline lets your take your video editing skills to the next level.,0,0,0,0,0,0,0,0
1020339980,1000600000001567,Explain Everything Whiteboard,Productivity,2015-11-13,2015-10-10,238.89,15,1,0,1,5.1.2,2018-09-18,minor improvements,0,0,0,0,0,0,0,0
1020339980,1000600000001567,Explain Everything Whiteboard,Productivity,2015-11-13,2015-10-10,238.89,15,1,0,1,5.1.1,2018-08-14,project orientation simply rotate the device to choose portrait or landscape,0,0,0,0,0,0,0,0
1020339980,1000600000001567,Explain Everything Whiteboard,Productivity,2015-11-13,2015-10-10,238.89,15,1,0,1,5.1,2018-08-01,What s New Start with Templates Explain Everything now features a wide range of templates you can choose from when starting a new project. Personalize the New Project menu and add your own templates to it. Bug Fixes If you registered with an email from a domain that was already subscribed the amount of trial days left would appear. We got rid of this bug so you don t feel haunted with irrelevant information. We re adding it to the list of spooky decorations for the next Halloween party.,0,0,0,0,0,0,0,0
1020339980,1000600000001567,Explain Everything Whiteboard,Productivity,2015-11-13,2015-10-10,238.89,15,1,0,1,5.0.12,2018-07-19,bug fixes,0,0,0,0,0,0,0,0
1020339980,1000600000001567,Explain Everything Whiteboard,Productivity,2015-11-13,2015-10-10,238.89,15,1,0,1,5.0.11,2018-06-23,Bug fixes,0,0,0,0,0,0,0,0
1020339980,1000600000001567,Explain Everything Whiteboard,Productivity,2015-11-13,2015-10-10,238.89,15,1,0,1,5.0.10,2018-06-08,Schoolwork integration: It s possible to assign activities on projects stored Explain Everything Drive. To activate please go to settings integrations. Fix for crash during video export,0,0,0,0,0,0,0,0
1020339980,1000600000001567,Explain Everything Whiteboard,Productivity,2015-11-13,2015-10-10,238.89,15,1,0,1,5.0.9,2018-06-02,Bug Fixes: fix for crash when attempting to download document from GDrive other minor,0,0,0,0,0,0,0,0
1020339980,1000600000001567,Explain Everything Whiteboard,Productivity,2015-11-13,2015-10-10,238.89,15,1,0,1,5.0.8,2018-05-29,GDPR compliance,0,0,0,0,0,0,0,0
1020339980,1000600000001567,Explain Everything Whiteboard,Productivity,2015-11-13,2015-10-10,238.89,15,1,0,1,5.0.7,2018-05-08,Sign in with OKTA,0,0,0,0,0,0,0,0
1020339980,1000600000001567,Explain Everything Whiteboard,Productivity,2015-11-13,2015-10-10,238.89,15,1,0,1,5.0.6,2018-05-01,Bug fixes If you had a lot of projects stored in Explain Drive their loading time was way too long. Now you can get to them faster. Fixed iPhone audio recording issues when not using headphones during collaboration Other minor fixes and improvements,0,0,0,0,0,0,0,0
1020339980,1000600000001567,Explain Everything Whiteboard,Productivity,2015-11-13,2015-10-10,238.89,15,1,0,1,5.0.5,2018-04-17,Explain Everything Discover is now Explain Drive Home Screen Lets you start creating collaborating and sharing in a snap. Library One stop to find all of your projects folders and cloud files. Learn Get up to speed with tips tricks tutorials and more. Playback speed up Infinite scroll function available from the inspector menu,0,0,0,0,0,0,0,0
1020339980,1000600000001567,Explain Everything Whiteboard,Productivity,2015-11-13,2015-10-10,238.89,15,1,0,1,5.0.4,2018-03-20,Explain Everything Discover is now Explain Drive Home Screen Lets you start creating collaborating and sharing in a snap. Library One stop to find all of your projects folders and cloud files. Learn Get up to speed with tips tricks tutorials and more. Playback speed up Infinite scroll function available from the inspector menu,0,0,0,0,0,0,0,0
1020339980,1000600000001567,Explain Everything Whiteboard,Productivity,2015-11-13,2015-10-10,238.89,15,1,0,1,5.0.3,2018-03-10,Explain Everything Discover is now Explain Drive Home Screen Lets you start creating collaborating and sharing in a snap. Library One stop to find all of your projects folders and cloud files. Learn Get up to speed with tips tricks tutorials and more. Playback speed up Infinite scroll function available from the inspector menu,0,0,0,0,0,0,0,0
1020339980,1000600000001567,Explain Everything Whiteboard,Productivity,2015-11-13,2015-10-10,238.89,15,1,0,1,5.0.2,2018-03-02,Explain Everything Discover is now Explain Drive Home Screen Lets you start creating collaborating and sharing in a snap. Library One stop to find all of your projects folders and cloud files. Learn Get up to speed with tips tricks tutorials and more. Playback speed up Infinite scroll function available from the inspector menu,0,0,0,0,0,0,0,0
1020339980,1000600000001567,Explain Everything Whiteboard,Productivity,2015-11-13,2015-10-10,238.89,15,1,0,1,5.0.1,2018-02-24,Explain Everything Discover is now Explain Drive Home Screen Lets you start creating collaborating and sharing in a snap. Library One stop to find all of your projects folders and cloud files. Learn Get up to speed with tips tricks tutorials and more. Playback speed up Infinite scroll function available from the inspector menu,0,0,0,0,0,0,0,0
1020339980,1000600000001567,Explain Everything Whiteboard,Productivity,2015-11-13,2015-10-10,238.89,15,1,0,1,5.0,2018-02-21,Explain Everything Discover is now Explain Drive Home Screen Lets you start creating collaborating and sharing in a snap. Library One stop to find all of your projects folders and cloud files. Learn Get up to speed with tips tricks tutorials and more. Playback speed up Infinite scroll function available from the inspector menu,0,0,0,0,0,0,0,0
1020339980,1000600000001567,Explain Everything Whiteboard,Productivity,2015-11-13,2015-10-10,238.89,15,1,0,1,4.2.7,2017-12-28,Hand Tool Zoom Option Zooming on the entire canvas with the Hand Tool can now be disabled in the Hand Tool menu. Tap on the Hand Tool when selected to reveal the option. Bluetooth Audio Playback Quality Improvement Using bluetooth audio devices with Explain Everything will no longer cause the playback quality to decrease.,0,0,0,0,0,0,0,0
1020339980,1000600000001567,Explain Everything Whiteboard,Productivity,2015-11-13,2015-10-10,238.89,15,1,0,1,4.2.6,2017-12-13,Bug fixes,0,0,0,0,0,0,0,0
1020339980,1000600000001567,Explain Everything Whiteboard,Productivity,2015-11-13,2015-10-10,238.89,15,1,0,1,4.2.5,2017-11-08,Interface adjustments for iPhone X Bug fixes,0,0,0,0,0,0,0,0
1020339980,1000600000001567,Explain Everything Whiteboard,Productivity,2015-11-13,2015-10-10,238.89,15,1,0,1,4.2.4,2017-10-17,Bug fixes,0,0,0,0,0,0,0,0
1020339980,1000600000001567,Explain Everything Whiteboard,Productivity,2015-11-13,2015-10-10,238.89,15,1,0,1,4.2.3,2017-10-13,Drawing improvements Drawing is now smoother and more responsive thanks to improvements in Explain Everything s drawing algorithm. Exporting adjustments Slight adjustments in the export flow make it more intuitive now. Bug fixes,0,0,0,0,0,0,0,0
