app_id,unified_app_id,app_name,app_category,worldwide_release,initial_release,app_size,app_lang,multihoming,paid,in_app_purchases,app_version,app_version_date,release_note,dummy_1,dummy_2,dummy_3,dummy_4,dummy_5,dummy_6,dummy_7,dummy_8
1530965242,0,Metion Markdown Notes,Productivity,2020-11-04,2020-11-04,82.49,28,0,0,1,3.5.20,2024-02-18,Fixed: In the recent iteration it was found that in the iPad version the height of the input fields in the interfaces for creating a new document and renaming documents is insufficient. Fixed: The Tags add remove interface introduced some new bugs in the recent version update. Fixed: The logic that keeping vertical center position while typing which caused potential cursor displacement jitter. Fixed: Resolved the issue where multiple clicks are required for the Zen mode background to take effect on the desktop version. New: Added support for selecting font for PDF exporting on the desktop version. Fixed: ghosting when rendering the contents of the file manager in the latest OS. Fixed: the problem caused by the previous versions incorrect cursor position offsets in code highlighting and in the Meta window. Tweak: Since Metion 3.5 has been released for a long time we have adjusted the logic of synchronizing and replacing old versions of documents. If the old version of a document does not have the mdate attribute it will be compared with the modification time of the local document to determine the mdate value so that the document can be synchronized with the documents after version 3.5 automatically without being placed in the historical version again. Tweak: iPad version displays the header when cursor moves to item and it is hidden. Optimize: Logic of screen auto lock Tweak: When restoring a document version the mdate field will be modified at the same time to avoid being automatically overwritten by an unintended version later than the restored version during synchronization. Other bugs fixed,0,0,0,0,0,0,0,1
1530965242,0,Metion Markdown Notes,Productivity,2020-11-04,2020-11-04,82.49,28,0,0,1,3.5.19,2024-02-01,Fixed: The Tags add remove interface introduced some new bugs in the recent version update. Fixed: The logic that keeping vertical center position while typing which caused potential cursor displacement jitter. Fixed: Resolved the issue where multiple clicks are required for the Zen mode background to take effect on the desktop version. New: Added support for selecting font for PDF exporting on the desktop version. Fixed: ghosting when rendering the contents of the file manager in the latest OS. Fixed: the problem caused by the previous versions incorrect cursor position offsets in code highlighting and in the Meta window. Tweak: Since Metion 3.5 has been released for a long time we have adjusted the logic of synchronizing and replacing old versions of documents. If the old version of a document does not have the mdate attribute it will be compared with the modification time of the local document to determine the mdate value so that the document can be synchronized with the documents after version 3.5 automatically without being placed in the historical version again. Tweak: iPad version displays the header when cursor moves to item and it is hidden. Optimize: Logic of screen auto lock Tweak: When restoring a document version the mdate field will be modified at the same time to avoid being automatically overwritten by an unintended version later than the restored version during synchronization. Other bugs fixed,0,0,0,0,0,0,0,1
1530965242,0,Metion Markdown Notes,Productivity,2020-11-04,2020-11-04,82.49,28,0,0,1,3.5.18,2024-01-27,Fixed: The logic that keeping vertical center position while typing which caused potential cursor displacement jitter. Fixed: Resolved the issue where multiple clicks are required for the Zen mode background to take effect on the desktop version. New: Added support for selecting font for PDF exporting on the desktop version. Fixed: ghosting when rendering the contents of the file manager in the latest OS. Fixed: the problem caused by the previous versions incorrect cursor position offsets in code highlighting and in the Meta window. Tweak: Since Metion 3.5 has been released for a long time we have adjusted the logic of synchronizing and replacing old versions of documents. If the old version of a document does not have the mdate attribute it will be compared with the modification time of the local document to determine the mdate value so that the document can be synchronized with the documents after version 3.5 automatically without being placed in the historical version again. Tweak: iPad version displays the header when cursor moves to item and it is hidden. Optimize: Logic of screen auto lock Tweak: When restoring a document version the mdate field will be modified at the same time to avoid being automatically overwritten by an unintended version later than the restored version during synchronization. Other bugs fixed,0,0,0,0,0,0,0,1
1530965242,0,Metion Markdown Notes,Productivity,2020-11-04,2020-11-04,82.49,28,0,0,1,3.5.17,2024-01-10,Fixed: ghosting when rendering the contents of the file manager in the latest OS. Fixed: the problem caused by the previous versions incorrect cursor position offsets in code highlighting and in the Meta window. Tweak: Since Metion 3.5 has been released for a long time we have adjusted the logic of synchron izing and replacing old versions of documents. If the old version of a document does not have the mdate attribute it will be compared with the modification time of the local document to determine the mdate value so that the document can be synchronized with the documents after version 3.5 automatically without being placed in the historical version again. Tweak: iPad version displays the header when cursor moves to item and it is hidden. Optimize: Logic of screen auto lock Tweak: When restoring a document version the mdate field will be modified at the same time to avoid being automatically overwritten by an unintended version later than the restored version during synchronization. Other bugs fixed,0,0,0,0,0,0,1,0
1530965242,0,Metion Markdown Notes,Productivity,2020-11-04,2020-11-04,82.49,28,0,0,1,3.5.16,2024-01-02,Tweak: Since Metion 3.5 has been released for a long time we have adjusted the logic of synchronizing and replacing old versions of documents. If the old version of a document does not have the mdate attribute it will be compared with the modification time of the local document to determine the mdate value so that the document can be synchronized with the documents after version 3.5 automatically without being placed in the historical version again. Tweak: iPad version displays the header when cursor moves to item and it is hidden. Optimize: Logic of screen auto lock Tweak: When restoring a document version the mdate field will be modified at the same time to avoid being automatically overwritten by an unintended version later than the restored version during synchronization. Other bugs fixed,0,0,0,0,0,0,1,0
1530965242,0,Metion Markdown Notes,Productivity,2020-11-04,2020-11-04,82.49,28,0,0,1,3.5.15,2023-12-26,Tweak: iPad version displays the header when cursor moves to item and it is hidden. Optimize: Logic of screen auto lock Tweak: When restoring a document version the mdate field will be modified at the same time to avoid being automatically overwritten by an unintended version later than the restored version during synchronization. Other bugs fixed,0,0,0,0,0,0,1,0
1530965242,0,Metion Markdown Notes,Productivity,2020-11-04,2020-11-04,82.49,28,0,0,1,3.5.14,2023-11-23,Fixed: Adopted new merge processing logic for Metadata to keep the different formats of Metadata as compatible as possible. Fixed: Compatibility with new iPadOS versions avoiding the situation where setting items have no effect after tapping on them Optimize: Logic of screen auto lock Tweak: When restoring a document version the mdate fiel d will be modified at the same time to avoid being automatically overwritten by an unintended version later than the restored version during synchronization. Other bugs fixed,0,0,0,0,1,0,0,0
1530965242,0,Metion Markdown Notes,Productivity,2020-11-04,2020-11-04,82.49,28,0,0,1,3.5.13,2023-11-22,Fixed: Adopted new merge processing logic for Metadata to keep the different formats of Metadata as compatible as possible. Tweak: When restoring a document version the mdate field will be modified at the same time to avoid being automatically overwritten by an unintended version later than the restored version during synchronization. Other bugs fixed,0,0,0,0,1,0,0,0
1530965242,0,Metion Markdown Notes,Productivity,2020-11-04,2020-11-04,82.49,28,0,0,1,3.5.12,2023-11-01,Fixed: a little more text and with the separator lines inserted a potential performance problem in the text rendering engine which will lead to a laggy feeling if typping new words. New: in iCloud related menu you can uncheck Show Alert even if the App detected a connectivity problem in iCloud sync it will not make pop up reminders to avoid interference. Tweak: remove the turn on automatically feature for reader mode to avoid potential confusion with editing mode. Tweak: Auto populate doc_id into metadata when saving a document so that if iClo ud Drive automatically copies a document due to an unavoidable version conflict Metion automatically removes duplicate redundancy based on the doc_id. Tweak: calculate automatic position scrolling in some writing modes without using UI animations to avoid potential position jitter. Fixed: fit the checkbox position offset and try to keep the cursor position when list item toggle into todo item. Other bugs fixed,0,0,0,0,1,0,0,0
1530965242,0,Metion Markdown Notes,Productivity,2020-11-04,2020-11-04,82.49,28,0,0,1,3.5.11,2023-10-18,Fixed: Continue to improve typewriter writing mode Fixed: Customize Y offset in typewriter mode iOS to avoid conflicts with keeping the cursor visible during text inputing Fixed: Move To command window not displaying Enhancement: Continued enhancements iCloud synchronization Tweaks: Fine tuning of the document list interface and repositioning of the arrows of the folder context menu window Other bugs fixed,0,0,0,1,0,0,0,0
1530965242,0,Metion Markdown Notes,Productivity,2020-11-04,2020-11-04,82.49,28,0,0,1,3.5.10,2023-10-15,Fixed: the background image is not displayed in Zen mode on iOS Fixed: Optimized the typewriter writing mode for iPad and iPhone to avoid unnecessary scrolling. Fixed: Compatibility adjustments for Widgets in the latest OS. Fixed: Customized the desktop pop up menu to correspond OS 12 14 avoiding backward compatibility issues when corresponding to the latest OS. Adjustment: Fine tuned the layout of the document list interface. Other fixes and adjustments.,0,0,0,1,0,0,0,0
1530965242,0,Metion Markdown Notes,Productivity,2020-11-04,2020-11-04,82.49,28,0,0,1,3.5.8,2023-10-02,Fixed: 3.5.7 performance issue if autohide Markdown syntax enabled when dealing some Markdown structure text writing there will be a stuttering situation. Fixed: Incorrect position of search bar especially when there is a preview column. Fixed: Git related ICONs in the library list don t change when the theme changed. Adjust: Adjust the preloading logic of some interfaces to reduce unnecessary preloading. Others fixes,0,0,0,1,0,0,0,0
1530965242,0,Metion Markdown Notes,Productivity,2020-11-04,2020-11-04,82.49,28,0,0,1,3.5.7,2023-09-22,Compatible with the latest version of OS Optimizations related to iCloud sync and adding the display of iCloud Status. Many other details have been fixed.,0,0,1,0,0,0,0,0
1530965242,0,Metion Markdown Notes,Productivity,2020-11-04,2020-11-04,82.49,28,0,0,1,3.5.4,2023-09-14,Fixed: The case that the content in the Metadata window is not saved successfully. Fixed: PDF export can not be saved if the file name contains non English characters. Fixed: iPad version of the line breaks may produce half of the screen scrolling automatically. Adjustment: iPad version of the Option R shortcut is invalid adjusted to Control R Many other details have been fixed.,0,0,1,0,0,0,0,0
1530965242,0,Metion Markdown Notes,Productivity,2020-11-04,2020-11-04,82.49,28,0,0,1,3.5.1,2023-09-11,Fixed: The case that the content in the Metadata window is not saved successfully. Fixed: PDF export can not be saved if the file name contains non English characters. Fixed: iPad version of the line breaks may produce half of the screen scrolling automatically. Adjustment: iPad version of the Option R shortcut is invalid adjusted to Control R Many other details have been fixed.,0,0,1,0,0,0,0,0
1530965242,0,Metion Markdown Notes,Productivity,2020-11-04,2020-11-04,82.49,28,0,0,1,3.5.0,2023-08-29,Rewrote the Mac native version of Metion which has the same features and experience as the iOS version. Incorporates CloudKit with iCloud Drive or Git to improve the speed and stability of cross devices synchronization. Enhanced the Tags feature which can be set through the interface rather than text syntax and the Tags Tree that complements the file manager. e right state. Many other details have been fixed.,0,0,1,0,0,0,0,0
1530965242,0,Metion Markdown Notes,Productivity,2020-11-04,2020-11-04,82.49,28,0,0,1,3.1.0,2023-05-07,Fixed: typing in Meta popups will be refocused into core text body Optimize: minimize unnecessary autoscrolling logic in typewriter mode Optimize: On iPad version when connecting a keyboard ensure that the body is in editing state before the title when the Enter key is pressed down. Optimize: After disabling the display of shortcut keys pressing and holding the Command key by mistake will attempt to automatically return to editing state after releasing the Command key. Optimize: Add Move support to the right click menu of folders and documents. Optimize: Adjust the comparison algorithm of old and new versions during synchronization to reduce performance loss during synchronization comparison. Optimize: Speed up the synchronization of images contained in the article currently being edited when synchronizing across devices. Enhance: Long pressing an item in the workspace directory list can now be sorted. New: Added support for Special Fonts in the settings which can be used for custom fonts when exporting PDFs or images. Note that this feature may be limited by the system at runtime use it as needed. Other details are adjusted and fixed Note: Metion 3.0 uses a new synchronization mechanism which in simple terms adds real time modification mdate to the header Meta information to ensure the reliability of syncing content merging as much as possible through iCloud. If you are using Metion 2.0 such as the old iOS version or the Mac version to edit content it is unlikely to be merged into Metion 3.0 but the data should have been synced normally. In this case you can refer to the following methods: 1. The document is stored as a historical version and you can restore it yourself in the historical version to sync it. 2. You can also manually declare mdate in the Mac version so that the latest content can be automatically merged after syncing which is the same as the default date format Meta . 3. Synchronization through Git is not affected. The new Metion 3.0 the biggest change since the birth of Metion. A better looking interface a more natural interaction logic further optimization for iPadOS and likewise a more iPhone compliant form on the iPhone. We ve rewritten almost all of the interface and in addition to that the underlying data logic is better. For example the new syncing mechanism which it should be noted will only be used for articles edited by the new version of Metion others will be saved as history versions and not automatically merged by syncing. Due to the large number of changes we have already caught and fixed many bugs but in the early days of Metion 3.0 there are still many omissions. We look forward to understanding and giving us feedback so that we can make quick fixes in our regular iterations. Thanks. :,0,0,0,0,0,0,0,0
1530965242,0,Metion Markdown Notes,Productivity,2020-11-04,2020-11-04,82.49,28,0,0,1,3.0.9,2023-04-24,Optimize: On iPad version when connecting a keyboard ensure that the body is in editing state before the title when the Enter key is pressed down. Optimize: After disabling the display of shortcut keys pressing and holding the Command key by mistake will attempt to automatically return to editing state after releasing the Command key. Optimize: Add Mov e support to the right click menu of folders and documents. Optimize: Adjust the comparison algorithm of old and new versions during synchronization to reduce performance loss during synchronization comparison. Optimize: Speed up the synchronization of images contained in the article currently being edited when synchronizing across devices. Enhance: Long pressing an item in the workspace directory list can now be sorted. New: Added support for Special Fonts in the settings which can be used for custom fonts when exporting PDFs or images. Note that this feature may be limited by the system at runtime use it as needed. Other details are adjusted and fixed Note: Metion 3.0 uses a new synchronization mechanism which in simple terms adds real time modification mdate to the header Meta information to ensure the reliability of syncing content merging as much as possible through iCloud. If you are using Metion 2.0 such as the old iOS version or the Mac version to edit content it is unlikely to be merged into Metion 3.0 but the data should have been synced normally. In this case you can refer to the following methods: 1. The document is stored as a historical version and you can restore it yourself in the historical version to sync it. 2. You can also manually declare mdate in the Mac version so that the latest content can be automatically merged after syncing which is the same as the default date format Meta . 3. Synchronization through Git is not affected. The new Metion 3.0 the biggest change since the birth of Metion. A better looking interface a more natural interaction logic further optimization for iPadOS and likewise a more iPhone compliant form on the iPhone. We ve rewritten almost all of the interface and in addition to that the underlying data logic is better. For example the new syncing mechanism which it should be noted will only be used for articles edited by the new version of Metion others will be saved as history versions and not automatically merged by syncing. Due to the large number of changes we have already caught and fixed many bugs but in the early days of Metion 3.0 there are still many omissions. We look forward to understanding and giving us feedback so that we can make quick fixes in our regular iterations. Thanks. :,0,0,0,0,0,0,0,0
1530965242,0,Metion Markdown Notes,Productivity,2020-11-04,2020-11-04,82.49,28,0,0,1,3.0.8,2023-04-16,Adjustment: Slightly tweaked the layout when starting to edit on iPadOS. Fixed: Cross device syncing may not work when the system time is set to 12 hour format. New: Added a new Edit menu to the app. New: Added support for Special Fonts in the settings which can be used for custom fonts when exporting PDFs or images. Note that this feature may be limited by the system at runtime use it as needed. Other details are adjusted and fixed Note: Metion 3.0 uses a new synchronization mechanism which in simple terms adds real time modification mdate to the header Meta information to ensure the reliability of syncing content merging as much as possible through iCloud. If you are using Metion 2.0 such as the old iOS version or the Mac version to edit content it is unlikely to be merged into Metion 3.0 but the data should have been synced normally. In this case you can refer to the following methods: 1. The document is stored as a historical version and you can restore it yourself in the historical version to sync it. 2. You can also manually declare mdate in the Mac version so that the latest content can be automatically merged after syncing which is the same as the default date format Meta . 3. Synchronization through Git is not affected. The new Metion 3.0 the biggest change since the birth of Metion. A better looking interface a more natural interaction logic further optimization for iPadOS and likewise a more iPhone compliant form on the iPhone. We ve rewritten almost all of the interface and in addition to that the underlying data logic is better. For example the new syncing mechanism which it should be noted will only be used for articles edited by the new version of Metion others will be saved as history versions and not automatically merged by syncing. Due to the large number of changes we have already caught and fixed many bugs but in the early days of Metion 3.0 there are still many omissions. We look forward to understanding and giving us feedback so that we can make quick fixes in our regular iterations. Thanks. :,0,0,0,0,0,0,0,0
1530965242,0,Metion Markdown Notes,Productivity,2020-11-04,2020-11-04,82.49,28,0,0,1,3.0.7,2023-04-11,Adjustment: Slightly tweaked the layout when starting to edit on iPadOS. Fixed: Cross device syncing may not work when the system time is set to 12 hour format. New: Added a new Edit menu to the app. New: Added support for Special Fonts in the settings which can be used for custom fonts when exporting PDFs or images. Note that this feature may be limited by the system at runtime use it as needed. Other details are adjusted and fixed Note: Metion 3.0 uses a new synchronization mechanism which in simple terms adds real time modification mdate to the header Meta information to ensure the reliability of syncing content merging as much as possible through iCloud. If you are using Metion 2.0 such as the old iOS version or the Mac version to edit content it is unlikely to be merged into Metion 3.0 but the data should have been synced normally. In this case you can refer to the following methods: 1. The document is stored as a historical version and you can restore it yourself in the historical version to sync it. 2. You can also manually declare mdate in the Mac version so that the latest content can be automatically merged after syncing which is the same as the default date format Meta . 3. Synchronization through Git is not affected. The new Metion 3.0 the biggest change since the birth of Metion. A better looking interface a more natural interaction logic further optimization for iPadOS and likewise a more iPhone compliant form on the iPhone. We ve rewritten almost all of the interface and in addition to that the underlying data logic is better. For example the new syncing mechanism which it should be noted will only be used for articles edited by the new version of Metion others will be saved as history versions and not automatically merged by syncing. Due to the large number of changes we have already caught and fixed many bugs but in the early days of Metion 3.0 there are still many omissions. We look forward to understanding and giving us feedback so that we can make quick fixes in our regular iterations. Thanks. :,0,0,0,0,0,0,0,0
1530965242,0,Metion Markdown Notes,Productivity,2020-11-04,2020-11-04,82.49,28,0,0,1,3.0.6,2023-03-30,Adjustment: Slightly tweaked the layout when starting to edit on iPadOS. Fixed: Cross device syncing may not work when the system time is set to 12 hour format. New: Added a new Edit menu to the app. New: Added support for Special Fonts in the settings which can be used for custom fonts when exporting PDFs or images. Note that this feature may be limited by the system at runtime use it as needed. Other details are adjusted and fixed Note: Metion 3.0 uses a new synchronization mechanism which in simple terms adds real time modification mdate to the header Meta information to ensure the reliability of syncing content merging as much as possible through iCloud. If you are using Metion 2.0 such as the old iOS version or the Mac version to edit content it is unlikely to be merged into Metion 3.0 but the data should have been synced normally. In this case you can refer to the following methods: 1. The document is stored as a historical version and you can restore it yourself in the historical version to sync it. 2. You can also manually declare mdate in the Mac version so that the latest content can be automatically merged after syncing which is the same as the default date format Meta . 3. Synchronization through Git is not affected. The new Metion 3.0 the biggest change since the birth of Metion. A better looking interface a more natural interaction logic further optimization for iPadOS and likewise a more iPhone compliant form on the iPhone. We ve rewritten almost all of the interface and in addition to that the underlying data logic is better. For example the new syncing mechanism which it should be noted will only be used for articles edited by the new version of Metion others will be saved as history versions and not automatically merged by syncing. Due to the large number of changes we have already caught and fixed many bugs but in the early days of Metion 3.0 there are still many omissions. We look forward to understanding and giving us feedback so that we can make quick fixes in our regular iterations. Thanks. :,0,0,0,0,0,0,0,0
