app_id,unified_app_id,app_name,app_category,worldwide_release,initial_release,app_size,app_lang,multihoming,paid,in_app_purchases,app_version,app_version_date,release_note,dummy_1,dummy_2,dummy_3,dummy_4,dummy_5,dummy_6,dummy_7,dummy_8
1530965242,0,Metion Markdown Notes,Productivity,2020-11-04,2020-11-04,82.49,28,0,0,1,3.0.5,2023-03-28,Adjustment: Slightly tweaked the layout when starting to edit on iPadOS. Fixed: Cross device syncing may not work when the system time is set to 12 hour format. New: Added a new Edit menu to the app. New: Added support for Special Fonts in the settings which can be used for custom fonts when exporting PDFs or images. Note that this feature may be limited by the system at runtime use it as needed. Other details are adjusted and fixed Note: Metion 3.0 uses a new synchronization mechanism which in simple terms adds real time modification mdate to the header Meta information to ensure the reliability of syncing content merging as much as possible through iCloud. If you are using Metion 2.0 such as the old iOS version or the Mac version to edit content it is unlikely to be merged into Metion 3.0 but the data should have been synced normally. In this case you can refer to the following methods: 1. The document is stored as a historical version and you can restore it yourself in the historical version to sync it. 2. You can also manually declare mdate in the Mac version so that the latest content can be automatically merged after syncing which is the same as the default date format Meta . 3. Synchronization through Git is not affected. The new Metion 3.0 the biggest change since the birth of Metion. A better looking interface a more natural interaction logic further optimization for iPadOS and likewise a more iPhone compliant form on the iPhone. We ve rewritten almost all of the interface and in addition to that the underlying data logic is better. For example the new syncing mechanism which it should be noted will only be used for articles edited by the new version of Metion others will be saved as history versions and not automatically merged by syncing. Due to the large number of changes we have already caught and fixed many bugs but in the early days of Metion 3.0 there are still many omissions. We look forward to understanding and giving us feedback so that we can make quick fixes in our regular iterations. Thanks. :,0,0,0,0,0,0,0,0
1530965242,0,Metion Markdown Notes,Productivity,2020-11-04,2020-11-04,82.49,28,0,0,1,3.0.3,2023-03-21,Adjustment: Some downward compatible logic for the new and old synchronous mechanisms Fixed: Conflict between default keyboard shortcuts e.g. copy paste and the text editing context menu in Metion 3.0 Adjustment: Line numbers are not displayed by default on iPadOS Adjustment: Preview of stack mode is adjusted and corresponding shortcut keys are added Adjustment: Fine tuning of empty space in text area under iPadOS Other details are adjusted and fixed Note: Metion 3.0 uses a new synchronization mechanism which in simple terms adds real time modification mdate to the header Meta information to ensure the reliability of syncing content merging as much as possible through iCloud. If you are using Metion 2.0 such as the old iOS version or the Mac version to edit content it is unlikely to be merged into Metion 3.0 but the data should have been synced normally. In this case you can refer to the following methods: 1. The document is stored as a historical version and you can restore it yourself in the historical version to sync it. 2. You can also manually declare mdate in the Mac version so that the latest content can be automatically merged after syncing which is the same as the default date format Meta . 3. Synchronization through Git is not affected. The new Metion 3.0 the biggest change since the birth of Metion. A better looking interface a more natural interaction logic further optimization for iPadOS and likewise a more iPhone compliant form on the iPhone. We ve rewritten almost all of the interface and in addition to that the underlying data logic is better. For example the new syncing mechanism which it should be noted will only be used for articles edited by the new version of Metion others will be saved as history versions and not automatically merged by syncing. Due to the large number of changes we have already caught and fixed many bugs but in the early days of Metion 3.0 there are still many omissions. We look forward to understanding and giving us feedback so that we can make quick fixes in our regular iterations. Thanks. :,0,0,0,0,0,0,0,0
1530965242,0,Metion Markdown Notes,Productivity,2020-11-04,2020-11-04,82.49,28,0,0,1,3.0.2,2023-03-12,New: font size settings for file manager Adjust: context menu rendering interaction Tweak: header section is hidden by default after entering writing state Tweak: default value for showing thumbnails in document list changed to No Fixed: long press on Meta button to set it as Export button Fixed: indent 2em cannot be canceled after setup Fixed: the keyboard shortcut of toggle Zen mode does not work Fixed: The setting of predictive completions of input method did not work when changing Fixed: unintended scrolling may occur after the cursor enters the inline Markdown markup syntax Other detailed adjustments and fixes The new Metion 3.0 the biggest change since the birth of Metion. A better looking interface a more natural interaction logic further optimization for iPadOS and likewise a more iPhone compliant form on the iPhone. We ve rewritten almost all of the interface and in addition to that the underlying data logic is better. For example the new syncing mechanism which it should be noted will only be used for articles edited by the new version of Metion others will be saved as history versions and not automatically merged by syncing. Due to the large number of changes we have already caught and fixed many bugs but in the early days of Metion 3.0 there are still many omissions. We look forward to understanding and giving us feedback so that we can make quick fixes in our regular iterations. Thanks. :,0,0,0,0,0,0,0,0
1530965242,0,Metion Markdown Notes,Productivity,2020-11-04,2020-11-04,82.49,28,0,0,1,3.0.1,2023-03-03,The new Metion 3.0 the biggest change since the birth of Metion. A better looking interface a more natural interaction logic further optimization for iPadOS and likewise a more iPhone compliant form on the iPhone. We ve rewritten almost all of the interface and in addition to that the underlying data logic is better. For example the new syncing mechanism which it should be noted will only be used for articles edited by the new version of Metion others will be saved as history versions and not automatically merged by syncing. Due to the large number of changes we have already caught and fixed many bugs but in the early days of Metion 3.0 there are still many omissions. We look forward to understanding and giving us feedback so that we can make quick fixes in our regular iterations. Thanks. :,0,0,0,0,0,0,0,0
1530965242,0,Metion Markdown Notes,Productivity,2020-11-04,2020-11-04,82.49,28,0,0,1,3.0.0,2023-02-27,The new Metion 3.0 the biggest change since the birth of Metion. A better looking interface a more natural interaction logic further optimization for iPadOS and likewise a more iPhone compliant form on the iPhone. We ve rewritten almost all of the interface and in addition to that the underlying data logic is better. For example the new syncing mechanism which it should be noted will only be used for articles edited by the new version of Metion others will be saved as history versions and not automatically merged by syncing. Due to the large number of changes we have already caught and fixed many bugs but in the early days of Metion 3.0 there are still many omissions. We look forward to understanding and giving us feedback so that we can make quick fixes in our regular iterations. Thanks. :,0,0,0,0,0,0,0,0
1530965242,0,Metion Markdown Notes,Productivity,2020-11-04,2020-11-04,82.49,28,0,0,1,2.7.4,2022-09-23,Some bugs and crash cases are fixed,0,0,0,0,0,0,0,0
1530965242,0,Metion Markdown Notes,Productivity,2020-11-04,2020-11-04,82.49,28,0,0,1,2.7.3,2022-09-12,Fixed: Git based working directory image attachments were synced to iCloud Enhancement: Git auto sync logic Enhancement: change the audio to text recognition policy to best . Enhancement: fine tuned the keyboard shortcut bar to have as many visible areas as possible for different phone models Enhancement: preview popover for math formulas on iPad with down arrow as possible Fixed: the message style when saving as image Some other bugs and crash cases are fixed,0,0,0,0,0,0,0,0
1530965242,0,Metion Markdown Notes,Productivity,2020-11-04,2020-11-04,82.49,28,0,0,1,2.7.2,2022-08-03,New: font size settings for exporting PDF Enhancement: Some compatibility handling for iPad multi windows Fixed: when compile Markdown a paragraph that embeds pure html may cuase error Enhancement: compatible to newest OS version Some other bugs and flashing cases are fixed,0,0,0,0,0,0,0,0
1530965242,0,Metion Markdown Notes,Productivity,2020-11-04,2020-11-04,82.49,28,0,0,1,2.7.1,2022-07-19,Enhancement: compatible to newest OS version Fixed: a local database related bug will cause App crash Some other bugs and flashing cases are fixed,0,0,0,0,0,0,0,0
1530965242,0,Metion Markdown Notes,Productivity,2020-11-04,2020-11-04,82.49,28,0,0,1,2.7.0,2022-07-05,Fixed: a local database related bug will cause App crash Some other bugs and flashing cases are fixed,0,0,0,0,0,0,0,0
1530965242,0,Metion Markdown Notes,Productivity,2020-11-04,2020-11-04,82.49,28,0,0,1,2.6.9,2022-06-24,Some other bugs and flashing cases are fixed,0,0,0,0,0,0,0,0
1530965242,0,Metion Markdown Notes,Productivity,2020-11-04,2020-11-04,82.49,28,0,0,1,2.6.7,2022-06-03,Updates for Current Version Enhancement: Context menu for on working directory list will be automatically hidden during interface scrolling Fixed: Wiki Graph II is displayed incorrectly in the newest OS Some other bugs and flashing cases are fixed,0,0,0,0,0,0,0,0
1530965242,0,Metion Markdown Notes,Productivity,2020-11-04,2020-11-04,82.49,28,0,0,1,2.6.6,2022-05-20,Updates for Current Version Enhancement: highlighting the keyword when searching documents Some other bugs and flashing cases are fixed,0,0,0,0,0,0,0,0
1530965242,0,Metion Markdown Notes,Productivity,2020-11-04,2020-11-04,82.49,28,0,0,1,2.6.5,2022-05-10,Updates for Current Version New: Added some white noise background music in Zen mode New: Support for word count statistics for folders Enhancement: Some rule improvements for syntax highlighting Some other bugs and flashing cases are fixed,0,0,0,0,0,0,0,0
1530965242,0,Metion Markdown Notes,Productivity,2020-11-04,2020-11-04,82.49,28,0,0,1,2.6.4,2022-04-30,Updates for Current Version Enhancement: The interface of New Working Directory has been redesigned. Enhancement: Changed the data synchronization mechanism documents are first stored as historical versions instead of directly overwritten increasing user control including the synchronization behavior generated by iCloud and Git. Enhancement: The whole app was redesigned and adjusted for iOS and iPadOS. Enhancement: Rewrote the interface for creating and renaming folders and files to make it better and more user friendly and enhanced the keyboard support in the interface. New: New shortcut bar area most operations in the app can be quickly found here. New: New Zen Mode white noises for both Standard and Pro. Enhancement: context menu added for currently selected objects on folder and document list Enhancement: Re adjusted and optimized the distribution of each menu in the App New: On iPad you can keep the left document list bar always there no more overlay New: Initially added support for 25 localized languages Enhancement: Many other fine tuning such as the version history window can be closed by pulling down the fine tuning of the Zen mode for CJK the adjustment of some prompt messages and the optimization of the mechanism .etc Some other bugs and flashing cases are fixed,0,0,0,0,0,0,0,0
1530965242,0,Metion Markdown Notes,Productivity,2020-11-04,2020-11-04,82.49,28,0,0,1,2.6.3,2022-04-27,Updates for Current Version Enhancement: The interface of New Working Directory has been redesigned. Enhancement: Changed the data synchronization mechanism documents are first stored as historical versions instead of directly overwritten increasing user control including the synchronization behavior generated by iCloud and Git. Enhancement: The whole app was redesigned and adjusted for iOS and iPadOS. Enhancement: Rewrote the interface for creating and renaming folders and files to make it better and more user friendly and enhanced the keyboard support in the interface. New: New shortcut bar area most operations in the app can be quickly found here. New: New Zen Mode white noises for both Standard and Pro. Enhancement: context menu added for currently selected objects on folder and document list Enhancement: Re adjusted and optimized the distribution of each menu in the App New: On iPad you can keep the left document list bar always there no more overlay New: Initially added support for 25 localized languages Enhancement: Many other fine tuning such as the version history window can be closed by pulling down the fine tuning of the Zen mode for CJK the adjustment of some prompt messages and the optimization of the mechanism .etc Some other bugs and flashing cases are fixed,0,0,0,0,0,0,0,0
1530965242,0,Metion Markdown Notes,Productivity,2020-11-04,2020-11-04,82.49,28,0,0,1,2.6.0,2022-04-26,Updates for Current Version Enhancement: The interface of New Working Directory has been redesigned. Enhancement: Changed the data synchronization mechanism documents are first stored as historical versions instead of directly overwritten increasing user control including the synchronization behavior generated by iCloud and Git. Enhancement: The whole app was redesigned and adjusted for iOS and iPadOS. Enhancement: Rewrote the interface for creating and renaming folders and files to make it better and more user friendly and enhanced the keyboard support in the interface. New: New shortcut bar area most operations in the app can be quickly found here. New: New Zen Mode white noises for both Standard and Pro. Enhancement: context menu added for currently selected objects on folder and document list Enhancement: Re adjusted and optimized the distribution of each menu in the App New: On iPad you can keep the left document list bar always there no more overlay New: Initially added support for 25 localized languages Enhancement: Many other fine tuning such as the version history window can be closed by pulling down the fine tuning of the Zen mode for CJK the adjustment of some prompt messages and the optimization of the mechanism .etc Some other bugs and flashing cases are fixed,0,0,0,0,0,0,0,0
1530965242,0,Metion Markdown Notes,Productivity,2020-11-04,2020-11-04,82.49,28,0,0,1,2.4.2,2022-03-01,Updates for Current Version Enhancement: Add Change Words Counter Type in the Settings Panel Fixed some other bugs and crash situations,0,0,0,0,0,0,0,0
1530965242,0,Metion Markdown Notes,Productivity,2020-11-04,2020-11-04,82.49,28,0,0,1,2.4.0,2022-02-14,Updates for Current Version Fixed: Image syntax information is lost when save current article which has many more image in it Enhancement: Markdown parsing logic for colon figure Fixed: Confusing syntax highlighting for multiple links with in same line Adjust: logic of Drag and drop image to insert on iOS Fixed some other bugs and crash situations,0,0,0,0,0,0,0,0
1530965242,0,Metion Markdown Notes,Productivity,2020-11-04,2020-11-04,82.49,28,0,0,1,2.3.8,2022-01-27,Updates for Current Version Adjust: Change the position of popover for the preview of Mathjax formulas Fixed: Layout of Work Folder List issue for iPhone X and others with the same screen width Fixed: Another enhancement for Restore Purchase under macOS Fixed some other bugs and crash situations,0,0,0,0,0,0,0,0
1530965242,0,Metion Markdown Notes,Productivity,2020-11-04,2020-11-04,82.49,28,0,0,1,2.3.7,2022-01-13,Updates for Current Version FIXED: When querying backlinks there may be cases of unmatched documents. Fixed: Another enhancement for Restore Purchase under macOS Fixed some other bugs and crash situations,0,0,0,0,0,0,0,0
1530965242,0,Metion Markdown Notes,Productivity,2020-11-04,2020-11-04,82.49,28,0,0,1,2.3.5,2022-01-06,Updates for Current Version New: In the list of Work Folder new Files Information for right click context menu you can see the total count of files and occupied space related to posts pictures and videos in the current Work Folder. New: Add some clear files related actions under the File Manager related menu in the Settings Panel please use it carefully. Fixed: When the selected text contains images the content converted to text does not correctly escape the path of the images Tweak: Adjust the notification after successful Git Push in iOS version Fixed some other bugs and crash situations,0,0,0,0,0,0,0,0
1530965242,0,Metion Markdown Notes,Productivity,2020-11-04,2020-11-04,82.49,28,0,0,1,2.3.4,2021-12-23,Updates for Current Version Adjust: The mechanism of Restore Purchase is adjusted the communication time with Apple s server has become much longer try to reduce the probability of problems. New: Customize the content template for new documents iPadOS macOS to be visible on the right click menu. Tweak: CSS style for preview support letter spacing from Settings Panel Tweak: Git sync does not alert you of content changes when writing in Zen mode Fixed some other bugs and crash situations,0,0,0,0,0,0,0,0
1530965242,0,Metion Markdown Notes,Productivity,2020-11-04,2020-11-04,82.49,28,0,0,1,2.3.3,2021-12-15,Updates for Current Version New: iOS iPadOS add support for automatically locking the app and unlocking it with FaceID and TouchID New: iOS iPadOS Share selected text as card . Adjusted: iOS iPadOS new interface of working directory list Tweak: iPadOS when text is selected and keyboard is connected it can be in scrolling state Fixed: A logical fix in Markdown parsing to avoid unnecessary in line elements line breaks. Fixed some other bugs and crash situations,0,0,0,0,0,0,0,0
1530965242,0,Metion Markdown Notes,Productivity,2020-11-04,2020-11-04,82.49,28,0,0,1,2.3.2,2021-10-30,Updates for Current Version FIXED: Text to Mindmap may cause duplicate Header if empty content under related Header FIXED: Multiple wiki style link syntax in the same line compiled error FIXED: Export Image as Simple theme was re styled for article which does not start with a Header Fixed: Metion for Mac changed the alert style notification now after a successful Git Push Fixed some other bugs and crash situations,0,0,0,0,0,0,0,0
1530965242,0,Metion Markdown Notes,Productivity,2020-11-04,2020-11-04,82.49,28,0,0,1,2.3.1,2021-10-16,Updates for Current Version Fixed: PDF export for iOS version may fail Fixed: Centered writing mode on iPad may have scrolled to the bottom in some cases Fixed: Git syncing does not sync the sorting of documents and folders Adjustment: When creating a new document if current is in reading mode exit reading mode first. Enhancement: When opening a document if it is synced through iCloud will ask whether to restore the latest history version if 200 more words than current document. Fixed some other bugs and crash situations.,0,0,0,0,0,0,0,0
1530965242,0,Metion Markdown Notes,Productivity,2020-11-04,2020-11-04,82.49,28,0,0,1,2.3.0,2021-10-07,Updates for Current Version Bug Fixed: Under Big Sur the presence of input area would cause the interface to be stuck and the memory to be burst mainly manifested by renaming panels and searching panels. Enhancement: Mac version of Reading Mode supports right click menu. Enhancement: Add Copy and Select All commands to the right click menu of the preview area in Mac version. Bug Fixed: The window can be moved when dragging the top of the preview area in Mac version. Bug Fixed: The order of Markdown footnote syntax is reversed after compiled. Bug Fixed: The judgment of auto hide syntax markdown has a very low probability of crash. Fixed some other bugs and crash situations.,0,0,0,0,0,0,0,0
1530965242,0,Metion Markdown Notes,Productivity,2020-11-04,2020-11-04,82.49,28,0,0,1,2.2.8,2021-09-28,Optimizations mainly for iOS 15 and iPadOS 15: Live Text can be used directly in the shortcut bar Live Text can be used in the Knowledge Base features to scan real world text to match your own knowledge base New widget types have been added especially the extra large size for iPad Enhanced support for split screen on iPadOS especially for the new features of iPadOS 15,0,0,0,0,0,0,0,0
1530965242,0,Metion Markdown Notes,Productivity,2020-11-04,2020-11-04,82.49,28,0,0,1,2.2.7,2021-09-24,Updates for Current Version Optimizations mainly for iOS 15 and iPadOS 15: Live Text can be used directly in the shortcut bar Live Text can be used in the Knowledge Base features to scan real world text to match your own knowledge base New widget types have been added especially the extra large size for iPad Enhanced support for split screen on iPadOS especially for the new features of iPadOS 15,0,0,0,0,0,0,0,0
1530965242,0,Metion Markdown Notes,Productivity,2020-11-04,2020-11-04,82.49,28,0,0,1,2.2.6,2021-09-23,Optimizations mainly for iOS 15 and iPadOS 15: Live Text can be used directly in the shortcut bar Live Text can be used in the Knowledge Base features to scan real world text to match your own knowledge base New widget types have been added especially the extra large size for iPad Enhanced support for split screen on iPadOS especially for the new features of iPadOS 15,0,0,0,0,0,0,0,0
1530965242,0,Metion Markdown Notes,Productivity,2020-11-04,2020-11-04,82.49,28,0,0,1,2.2.5,2021-09-15,Updates for Current Version Added: Visual theme settings to auto follow the system theme Fixed: Keep centered mode in iOS version to avoid jittering in one case. Improved: Alert when the content you are editing is changed by Git Enhancement: Markdown parsing optimization for WYSIWYG mode Some other details and bugs,0,0,0,0,0,0,0,0
1530965242,0,Metion Markdown Notes,Productivity,2020-11-04,2020-11-04,82.49,28,0,0,1,2.2.4,2021-09-13,Updates for Current Version Added: Visual theme settings to auto follow the system theme Fixed: Keep centered mode in iOS version to avoid jittering in one case. Improved: Alert when the content you are editing is changed by Git Enhancement: Markdown parsing optimization for WYSIWYG mode Some other details and bugs,0,0,0,0,0,0,0,0
1530965242,0,Metion Markdown Notes,Productivity,2020-11-04,2020-11-04,82.49,28,0,0,1,2.2.3,2021-09-09,Updates for Current Version Compatibility: Github changed the default branch from master to main Some other details and bugs,0,0,0,0,0,0,0,0
1530965242,0,Metion Markdown Notes,Productivity,2020-11-04,2020-11-04,82.49,28,0,0,1,2.2.0,2021-09-06,Updates for Current Version Added: an option to automatically hide syntax characters equivalent to WYSIWYG mode Added: a better network graph for knowledge base Enhancement: count the number of words that are selected Some other details and bugs,0,0,0,0,0,0,0,0
1530965242,0,Metion Markdown Notes,Productivity,2020-11-04,2020-11-04,82.49,28,0,0,1,2.1.7,2021-08-28,Updates for Current Version Enhancement: Initially add the option of Auto Hide Syntax Characters in the Writing related sub menus FIXED: A situation that rendering process of code highlighting may cause a crash. FIXED: If a custom font that have no corresponding weight and not work for Header syntax. Fixed: The default option of show back references when parsing Markdown has been changed to No . Enhancement: A way to handle some deadlocked files in Git s auto policy. Metion 2.0 has arrived and several minor versions have released so we won t repeat the updates of 2.0 again and they can be found in the previous history. Thank you very much :,0,0,0,0,0,0,0,0
1530965242,0,Metion Markdown Notes,Productivity,2020-11-04,2020-11-04,82.49,28,0,0,1,2.1.3,2021-08-22,Updates for Current Version Enhancements: Tab and Shift Tab indent increment decrement complement logic optimization Enhancements: Markdown compilation and highlighting and logic enhancements related to embeded code blocks simply in list syntax Enhancement: A policy in Git to automatically reset when pushing a local remote that is already in conflict. Enhancement: Git s policy for pushing to avoid using force policy to overwrite data of remote and report an error directly Enhancement: reset .gitignore if a conflict occurs already Metion 2.0 has arrived and several minor versions have released so we won t repeat the updates of 2.0 again and they can be found in the previous history. Thank you very much :,0,0,0,0,0,0,0,0
1530965242,0,Metion Markdown Notes,Productivity,2020-11-04,2020-11-04,82.49,28,0,0,1,2.1.2,2021-08-20,Updates for Current Version Enhancement: Writing statistics Widget data optimization when syncing by iCloud Enhancement: Optimization of the write mode of keep current line in center of screen on iPadOS Fixed: When toggling Read Mode the word count display area may disappear. Metion 2.0 has arrived and several minor versions have released so we won t repeat the updates of 2.0 again and they can be found in the previous history. Thank you very much :,0,0,0,0,0,0,0,0
