app_id,unified_app_id,app_name,app_category,worldwide_release,initial_release,app_size,app_lang,multihoming,paid,in_app_purchases,app_version,app_version_date,release_note,dummy_1,dummy_2,dummy_3,dummy_4,dummy_5,dummy_6,dummy_7,dummy_8
459248037,1000600000440297,Slideshow Creator,Photo and Video,2011-12-19,2011-12-19,79.58,19,1,0,1,4.1.2,2013-08-05,Improved notifications support Updated our login and registration pages Bug fixes and stability improvements,0,0,0,0,0,0,0,0
459248037,1000600000440297,Slideshow Creator,Photo and Video,2011-12-19,2011-12-19,79.58,19,1,0,1,4.1.1,2013-07-19,Critical bug fixes.,0,0,0,0,0,0,0,0
459248037,1000600000440297,Slideshow Creator,Photo and Video,2011-12-19,2011-12-19,79.58,19,1,0,1,4.1.0,2013-06-10,Revamped workflow! New style gallery and intro outro helpers Song recommendations Caption support More fun Thanks for your continued feedback. We hope you enjoy creating memorable videos with Animoto!,0,0,0,0,0,0,0,0
459248037,1000600000440297,Slideshow Creator,Photo and Video,2011-12-19,2011-12-19,79.58,19,1,0,1,4.0.8,2013-05-09,Squashed some crashing bugs making the app even more reliable than before. Thanks for your feedback and we hope you continue to enjoy making great videos with Animoto!,0,0,0,0,0,0,0,0
459248037,1000600000440297,Slideshow Creator,Photo and Video,2011-12-19,2011-12-19,79.58,19,1,0,1,4.0.7,2013-05-01,General bug fixes to make the app even more reliable. Now you can subscribe to our Plus subscription on an ongoing basis to easily make longer videos with up to 300 photos.,0,0,0,0,0,0,0,0
459248037,1000600000440297,Slideshow Creator,Photo and Video,2011-12-19,2011-12-19,79.58,19,1,0,1,4.0.6,2013-03-28,We ve corrected some critical bugs that prevented users from selecting certain songs changing information about their videos or saving finished videos to their Camera Roll. Thanks for your feedback and continuing to help make Animoto even better!,0,0,0,0,0,0,0,0
459248037,1000600000440297,Slideshow Creator,Photo and Video,2011-12-19,2011-12-19,79.58,19,1,0,1,4.0.5,2013-03-12,Added local notifications so we can tell you when your videos are finished previewing or rendering. You can now add video clips as well as photos when first creating a new project. Performance enhancements and bug fixes.,0,0,0,0,0,0,0,0
459248037,1000600000440297,Slideshow Creator,Photo and Video,2011-12-19,2011-12-19,79.58,19,1,0,1,4.0.1,2013-01-31,A new look and feel to go along with the updates on Animoto.com. Updates to our photo picker to make it even easier to add your memories to a video. Bug fixes.,0,0,0,0,0,0,0,0
459248037,1000600000440297,Slideshow Creator,Photo and Video,2011-12-19,2011-12-19,79.58,19,1,0,1,4.0,2013-01-24,Updates to our photo picker to make it even easier to add your memories to a video. A whole new look and feel that makes video creation even more intuitive.,0,0,0,0,0,0,0,0
459248037,1000600000440297,Slideshow Creator,Photo and Video,2011-12-19,2011-12-19,79.58,19,1,0,1,3.8.0,2012-12-28,A new and improved photo picker is waiting for you! Photos are grouped by date and location making it easier to see the stories inside your photo library. Similar photos are automatically stacked together making it easy to compare and choose the best image to use. Four new themes: Carousel Gifting Gifts Eight Days of Light and Big Beat. Bug fixes and performance enhancements.,0,0,0,0,0,0,0,0
459248037,1000600000440297,Slideshow Creator,Photo and Video,2011-12-19,2011-12-19,79.58,19,1,0,1,3.7.0,2012-11-08,Share your videos on Facebook faster Tag your Facebook friends in your videos Native iOS Facebook and Twitter login support Four new styles Autumn Fireworks Inkwell and Dance Party Support for iPhone 5 s larger Retina display,0,0,0,0,0,0,0,0
459248037,1000600000440297,Slideshow Creator,Photo and Video,2011-12-19,2011-12-19,79.58,19,1,0,1,3.6.0,2012-09-11,iOS 6 Support Various bug fixes Cleaned up FB permission requests Several new styles plus in the future get new styles without an app update! Fixed issue some users were experiencing previewing and producing their videos,0,0,0,0,0,0,0,0
459248037,1000600000440297,Slideshow Creator,Photo and Video,2011-12-19,2011-12-19,79.58,19,1,0,1,3.5.1,2012-07-20,Fixed an issue where some users videos were not displayed in the app,0,0,0,0,0,0,0,0
459248037,1000600000440297,Slideshow Creator,Photo and Video,2011-12-19,2011-12-19,79.58,19,1,0,1,3.5,2012-06-18,In Version 3.5: Use your own music as well as choosing from Animoto s library. New Baby Bellissimo style. In Version 3.4: Added 8 new styles including Retro Wheel . Copy and edit videos you ve created in the past. Several bug fixes.,0,0,0,0,0,0,0,0
459248037,1000600000440297,Slideshow Creator,Photo and Video,2011-12-19,2011-12-19,79.58,19,1,0,1,3.4,2012-05-03,In Version 3.4: Added 8 new styles including Retro Wheel for Mother s Day. Copy and edit videos you ve created in the past. Several bug fixes. In Version 3.3: Now you can use video clips as well as photos to make your Animoto video! Added the ability to choose photos from your Photo Stream for iOS5 users . Added 4 more styles for Pro users.,0,0,0,0,0,0,0,0
459248037,1000600000440297,Slideshow Creator,Photo and Video,2011-12-19,2011-12-19,79.58,19,1,0,1,3.3,2012-03-21,In version 3.3: Added the ability to add short video clips to your videos Added the ability to choose photos from your Photo Stream for iOS5 users Added 4 more styles for Pro users Fixed issue some users were having playing older videos Please make sure you refresh the videos list before trying to play the older videos Fixed an issue some users had with audio playback In version 3.2: Added 3 Valentine s Day styles Added 3 more styles for Pro users Added support for Education and Cause users Fixed issue some users were having with upgrading Fixed issue where latest version of a video from our site was not displayed Fixed issue with AirPlay not working for users on 4.3 Other minor bug fixes,0,0,0,0,0,0,0,0
459248037,1000600000440297,Slideshow Creator,Photo and Video,2011-12-19,2011-12-19,79.58,19,1,0,1,3.2,2012-02-07,New in version 3.2: Added 3 Valentine s Day styles Added 3 more styles for Pro users Added support for Education and Cause users Fixed issue some users were having with upgrading Fixed issue where latest version of a video from our site was not displayed Fixed issue with AirPlay not working for users on 4.3 Other minor bug fixes,0,0,0,0,0,0,0,0
459248037,1000600000440297,Slideshow Creator,Photo and Video,2011-12-19,2011-12-19,79.58,19,1,0,1,8.7.0,2011-12-19,Prepare for ludicrous speed! Before when you wanted to preview or produce a video you had enough time to go mow your lawn take a nap and build a house before it was done loading. With this update you can still mow your lawn but you ll only have enough time to cut one single piece of grass before your videos are ready. Plus lots of pesky bugs have been squashed in this release along with improvements to overall app stability. Love Animoto Please review our app in the App Store. If you have any issues with the app please email us at help animoto.com.,0,0,0,0,0,0,0,0
459248037,1000600000440297,Slideshow Creator,Photo and Video,2011-12-19,2011-12-19,79.58,19,1,0,1,3.1.0,2011-12-16,All new application with tons of new features and improvements over our older app previously Animoto Videos .,0,0,0,0,0,0,0,0
459248037,1000600000440297,Slideshow Creator,Photo and Video,2011-12-19,2011-12-19,79.58,19,1,0,1,3.0.5,2011-11-09,,0,0,0,0,0,0,0,0
