app_id,unified_app_id,app_name,app_category,worldwide_release,initial_release,app_size,app_lang,multihoming,paid,in_app_purchases,app_version,app_version_date,release_note
519524685,1000600000508222,Inkflow Visual Notebook,Productivity,2012-05-14,2012-05-14,33.07,1,1,0,1,6.9,2023-01-22,Bug fixes
519524685,1000600000508222,Inkflow Visual Notebook,Productivity,2012-05-14,2012-05-14,33.07,1,1,0,1,6.8,2022-07-23,Minor improvements
519524685,1000600000508222,Inkflow Visual Notebook,Productivity,2012-05-14,2012-05-14,33.07,1,1,0,1,6.7,2022-01-08,Updated for the latest OS and devices
519524685,1000600000508222,Inkflow Visual Notebook,Productivity,2012-05-14,2012-05-14,33.07,1,1,0,1,6.6,2021-10-31,Minor UI fixes
519524685,1000600000508222,Inkflow Visual Notebook,Productivity,2012-05-14,2012-05-14,33.07,1,1,0,1,6.5,2021-10-02,UI layout fixes
519524685,1000600000508222,Inkflow Visual Notebook,Productivity,2012-05-14,2012-05-14,33.07,1,1,0,1,6.4,2019-07-09,Minor bug fixes
519524685,1000600000508222,Inkflow Visual Notebook,Productivity,2012-05-14,2012-05-14,33.07,1,1,0,1,6.3,2019-07-02,Improved support for new devices.
519524685,1000600000508222,Inkflow Visual Notebook,Productivity,2012-05-14,2012-05-14,33.07,1,1,0,1,6.2,2018-09-23,Support for iOS 12
519524685,1000600000508222,Inkflow Visual Notebook,Productivity,2012-05-14,2012-05-14,33.07,1,1,0,1,6.1,2018-08-10,Fixed zoom limits on iPad Pro 10
519524685,1000600000508222,Inkflow Visual Notebook,Productivity,2012-05-14,2012-05-14,33.07,1,1,0,1,6.0,2018-07-17,Display page numbers above 100 correctly
519524685,1000600000508222,Inkflow Visual Notebook,Productivity,2012-05-14,2012-05-14,33.07,1,1,0,1,5.9,2018-06-28,Fixed an issue with popups on iPhone Plus.
519524685,1000600000508222,Inkflow Visual Notebook,Productivity,2012-05-14,2012-05-14,33.07,1,1,0,1,5.8,2017-12-08,Support for iOS 11
519524685,1000600000508222,Inkflow Visual Notebook,Productivity,2012-05-14,2012-05-14,33.07,1,1,0,1,5.7,2017-07-16,Added a Try Inkflow Plus file.
519524685,1000600000508222,Inkflow Visual Notebook,Productivity,2012-05-14,2012-05-14,33.07,1,1,0,1,5.6,2017-05-09,Performance improvements.
519524685,1000600000508222,Inkflow Visual Notebook,Productivity,2012-05-14,2012-05-14,33.07,1,1,0,1,5.5,2017-02-24,fixed some text layout issues.
519524685,1000600000508222,Inkflow Visual Notebook,Productivity,2012-05-14,2012-05-14,33.07,1,1,0,1,5.4,2016-10-29,Swipe pages on iPhone: Swipe from the edges of the screen to switch pages can be disabled in App Settings .
519524685,1000600000508222,Inkflow Visual Notebook,Productivity,2012-05-14,2012-05-14,33.07,1,1,0,1,5.3,2016-10-23,Split screen multitasking on iPad: Work side by side with your documents web pages videos or books. Replaced the sliding toolbar with an adaptive toolbar on iPhone: Fewer taps to get to the most common tools. Improved Pencil palm rejection and Pencil only drawing mode: Turn it on and rest your palm with impunity. iOS 10 support.
519524685,1000600000508222,Inkflow Visual Notebook,Productivity,2012-05-14,2012-05-14,33.07,1,1,0,1,4.6,2016-07-05,Higher resolution edited images. Improved palm rejection. Fix sliding toolbar on 3D Touch devices.
519524685,1000600000508222,Inkflow Visual Notebook,Productivity,2012-05-14,2012-05-14,33.07,1,1,0,1,4.4,2016-02-18,Support for iPad Pro and Apple Pencil. Separate color setting for each tool. Improved palm rejection. Searchable file names in Spotlight.
519524685,1000600000508222,Inkflow Visual Notebook,Productivity,2012-05-14,2012-05-14,33.07,1,1,0,1,4.3,2015-10-14,Compatibility with iPhone 6S and 6S Plus.
519524685,1000600000508222,Inkflow Visual Notebook,Productivity,2012-05-14,2012-05-14,33.07,1,1,0,1,4.2,2015-10-06,More color slots on iPhone 6 and iPhone 6 Plus. Improved Export PDF and Image dialog. Inkflow now uses the standard image picker with a new setting to toggle adjusting inserted images.
519524685,1000600000508222,Inkflow Visual Notebook,Productivity,2012-05-14,2012-05-14,33.07,1,1,0,1,4.1,2015-03-02,Bug fixes around inserting images.
519524685,1000600000508222,Inkflow Visual Notebook,Productivity,2012-05-14,2012-05-14,33.07,1,1,0,1,4.0,2014-12-12,New Inkflow Plus features: The Single Color Eraser. Toggle this in the palette to only erase the selected color. Directly adjust the pen width on the iPhone. Free for all new and existing Inkflow Plus users. Thanks for upgrading!
519524685,1000600000508222,Inkflow Visual Notebook,Productivity,2012-05-14,2012-05-14,33.07,1,1,0,1,3.9,2014-11-13,Add support for the iPad Air 2 which adds a whole new world of performance!
519524685,1000600000508222,Inkflow Visual Notebook,Productivity,2012-05-14,2012-05-14,33.07,1,1,0,1,3.8,2014-10-28,The iOS8 Release! New in v3.8: Support for iOS8 and the larger iPhone 6 and iPhone 6 Plus screens. Inkflow Plus: Export as PNG with transparent backgrounds. Great for inserting into other compositions saving a few steps in your workflow. Inkflow Plus: Full font picker on the iPhone. Enjoy 50 fonts. You can now long press on a book in the Gallery to access its options. Each version is rated separately. If you enjoy Inkflow please take a moment to rate it again in the App Store. We really appreciate it! Thank you and keep on creating! The Inkflow Team Qrayon.
519524685,1000600000508222,Inkflow Visual Notebook,Productivity,2012-05-14,2012-05-14,33.07,1,1,0,1,3.7,2014-05-21,NEW INKFLOW PLUS TOOL: Introducing the Write Behind Hilighter! It draws behind existing ink. Use it to color within the lines and touch up your drawings. It s a free addition for all Inkflow Plus users because we love you. Enjoy! We also made a few tweaks to the palette interface to give it a cleaner look.
519524685,1000600000508222,Inkflow Visual Notebook,Productivity,2012-05-14,2012-05-14,33.07,1,1,0,1,3.6,2014-03-27,Re mastered for iOS7 with native 64 bit support.
519524685,1000600000508222,Inkflow Visual Notebook,Productivity,2012-05-14,2012-05-14,33.07,1,1,0,1,3.4,2013-09-26,Fixed a bug where saved image snapshots might get mirrored when editing.
519524685,1000600000508222,Inkflow Visual Notebook,Productivity,2012-05-14,2012-05-14,33.07,1,1,0,1,3.3,2013-09-16,Color update for Inkflow Plus on iPad New: Multiple color palettes. Swipe left and right to see more. New: Color eye dropper tool for inks. New: Copy and paste from Vittle to Inkflow.
519524685,1000600000508222,Inkflow Visual Notebook,Productivity,2012-05-14,2012-05-14,33.07,1,1,0,1,3.2,2013-08-22,Adding a couple more oft requested features: You can now copy images from other Apps such as mail and paste them in Inkflow. The Gallery sort order by name or by date is now persisted across sessions. Enjoy! If you like Inkflow please remember to rate us in the App Store each version gets a separate rating . Thanks!
519524685,1000600000508222,Inkflow Visual Notebook,Productivity,2012-05-14,2012-05-14,33.07,1,1,0,1,3.1,2013-08-16,Bug Fixes.
519524685,1000600000508222,Inkflow Visual Notebook,Productivity,2012-05-14,2012-05-14,33.07,1,1,0,1,3.0,2013-08-08,Inkflow v3 is a major update which adds: Inkport Plus iTunes File Sharing An iPad Wrist Guard Change Text Default Styles iPad Picture Rotation with Snap Plus Flipping Ink Plus Tap View Blog to read bookmark the changes in more detail. Each version is rated separately. If you enjoy Inkflow please take a moment to rate it again in the App Store. We really appreciate it! Thanks The Inkflow Team Qrayon.
519524685,1000600000508222,Inkflow Visual Notebook,Productivity,2012-05-14,2012-05-14,33.07,1,1,0,1,2.5,2013-07-01,Bug fixes.
519524685,1000600000508222,Inkflow Visual Notebook,Productivity,2012-05-14,2012-05-14,33.07,1,1,0,1,2.4,2013-05-11,Minor bug fixes.
519524685,1000600000508222,Inkflow Visual Notebook,Productivity,2012-05-14,2012-05-14,33.07,1,1,0,1,2.3,2013-05-01,Bug fixes and performance improvements loading files.
519524685,1000600000508222,Inkflow Visual Notebook,Productivity,2012-05-14,2012-05-14,33.07,1,1,0,1,2.2,2013-04-19,Bug fixes: Fixed a bug where exported JPEGs can appear mirrored and rotated on Windows and some services tip: Rotation EXIF data doesn t get much respect .
519524685,1000600000508222,Inkflow Visual Notebook,Productivity,2012-05-14,2012-05-14,33.07,1,1,0,1,2.1,2013-03-27,This release adds an option for Higher resolution PDF export older devices may not support it and file sizes will be up to 4 times larger . It also fixes several bugs including: iPad3 Retina display bug when running iOS 5 you still need to upgrade to iOS6 to get retina support JPEG export bug on original iPad
519524685,1000600000508222,Inkflow Visual Notebook,Productivity,2012-05-14,2012-05-14,33.07,1,1,0,1,2.0,2013-02-20,Inkflow v2.0 is a major update that adds many popularly requested features: Insert text and edit with the keyboard Add photos from your albums Resize text and photos seamlessly with the ink Paper backgrounds Custom stationery for the Plus Edition. This dramatically expands the scope of what you can do and create with Inkflow while preserving the ease of use and intuitiveness you d expect. We hope you enjoy this new release. If you do please consider taking a moment to rate us in the App Store. We really appreciate it! Keep on creating! The Inkflow Team Qrayon.
519524685,1000600000508222,Inkflow Visual Notebook,Productivity,2012-05-14,2012-05-14,33.07,1,1,0,1,1.7,2013-02-11,Bug fixes and memory optimizations.
519524685,1000600000508222,Inkflow Visual Notebook,Productivity,2012-05-14,2012-05-14,33.07,1,1,0,1,1.6,2013-01-08,v1.6 brings retina iPad support with iOS 6. Sharper lines as smooth as ever. It also takes advantage of the iPhone 5 s larger screen. If you enjoy these updates please consider taking a moment to rate this version in the App Store. We really appreciate it! Best regards The Inkflow Team.
519524685,1000600000508222,Inkflow Visual Notebook,Productivity,2012-05-14,2012-05-14,33.07,1,1,0,1,1.4,2012-08-03,New in v1.4: Export books pdf and pages jpg to other Apps and to print. New in v1.3: Plus Edition for iPhone and iPod Touch! Upgrade today from the actions menu. Reorganized toolbar to make two handed use easier. You can change this in settings. Email books as PDF. High resolution email page as image. Plus Edition Rotate selected ink. We really appreciate all the great feedback and reviews. Please rate this new free update and Tweet to tell your friends about Inkflow!
519524685,1000600000508222,Inkflow Visual Notebook,Productivity,2012-05-14,2012-05-14,33.07,1,1,0,1,1.3,2012-07-13,Thanks for all your five star ratings! Please rate this new update too. This major update brings Plus to the iPhone and adds several new features. New in v1.3: Plus Edition for iPhone and iPod Touch! Upgrade today from the actions menu. Reorganized toolbar to make two handed use easier. You can change this back to the previous orientation in settings. Email books as PDF. Higher resolution email page as image. Plus Edition Rotate selected ink. New in v1.2: Improved memory usage especially on older devices. Added a restore purchase option to the upgrade dialog use this on new devices or after re downloading. We really appreciate all the great feedback and reviews. Please tweet and tell your friends about Inkflow. Warm regards The Inkflow Team at Qrayon
519524685,1000600000508222,Inkflow Visual Notebook,Productivity,2012-05-14,2012-05-14,33.07,1,1,0,1,1.2,2012-06-28,New in v1.2: Thanks for all your five star ratings! This update fixes a few intermittent issues. Improved memory usage especially on older devices. Added a restore purchase option to the upgrade dialog use this on new devices or after re downloading. New in v1.1: New Sliding Toolbar! iPhone users can slide the toolbar to show editing controls in portrait mode. Plus Enhancements: When you select all ink then paste it pastes in the same position as the original. More precise erasing of paint. Bug fixes: Fixed Gallery title display after a search. Fixed occasional flickering when drawing very long lines. Thanks for all the great feedback and reviews. You guys are awesome! We are listening and are working hard to make Inkflow the best Visual Thinking tool available. If you like it please take a moment to rate this new update. We really appreciate it!
519524685,1000600000508222,Inkflow Visual Notebook,Productivity,2012-05-14,2012-05-14,33.07,1,1,0,1,1.1,2012-06-07,New Sliding Toolbar! iPhone users can slide the toolbar to show editing controls in portrait mode. Plus Enhancements: When you select all ink then paste it pastes in the same position as the original. More precise erasing of paint. Bug fixes: Fixed Gallery title display after a search. Fixed occasional flickering when drawing very long lines. Fixed occasional Gallery transition skips. Tweaked some icon images. Thanks for all the great feedback and reviews. You guys are awesome! We are listening and are working hard to make Inkflow the best Visual Thinking tool available. If you like it please take a moment to rate this new update. We really appreciate it!
519524685,1000600000508222,Inkflow Visual Notebook,Productivity,2012-05-14,2012-05-14,33.07,1,1,0,1,1.0,2012-05-11,
