app_id,unified_app_id,app_name,app_category,worldwide_release,initial_release,app_size,app_lang,multihoming,paid,in_app_purchases,app_version,app_version_date,release_note,dummy_1,dummy_2,dummy_3,dummy_4,dummy_5,dummy_6,dummy_7,dummy_8
1462023656,1000600000837464,Comera,Social Networking,2019-05-26,2019-05-26,196.88,2,1,0,0,5.0.7,2024-02-20,Calling library upgraded to have a better call experience. Improved messages delivery in groups Minor bug fixes and user experience improvement,0,0,0,0,0,0,0,1
1462023656,1000600000837464,Comera,Social Networking,2019-05-26,2019-05-26,196.88,2,1,0,0,5.0.6,2024-02-02,New settings for enhanced group management. Polished design for a more intuitive experience. Improved message delivery and call connectivity. Resolved issues and enhanced overall app efficiency.,0,0,0,0,0,0,0,1
1462023656,1000600000837464,Comera,Social Networking,2019-05-26,2019-05-26,196.88,2,1,0,0,5.0.5,2024-01-26,New settings for enhanced group management. Polished design for a more intuitive experience. Improved message delivery and call connectivity. Resolved issues and enhanced overall app efficiency.,0,0,0,0,0,0,0,1
1462023656,1000600000837464,Comera,Social Networking,2019-05-26,2019-05-26,196.88,2,1,0,0,5.0.4,2024-01-20,Bug fixes performance enhancements and overall user experience improvements.,0,0,0,0,0,0,1,0
1462023656,1000600000837464,Comera,Social Networking,2019-05-26,2019-05-26,196.88,2,1,0,0,5.0.3,2024-01-07,Enhanced Call Connectivity Performance Minor bug fixes and UI Improvements,0,0,0,0,0,0,1,0
1462023656,1000600000837464,Comera,Social Networking,2019-05-26,2019-05-26,196.88,2,1,0,0,5.0.2,2023-12-28,Enhanced Call Connectivity Performance Minor bug fixes nd UI Improvements,0,0,0,0,0,0,1,0
1462023656,1000600000837464,Comera,Social Networking,2019-05-26,2019-05-26,196.88,2,1,0,0,5.0.1,2023-12-09,Introduced a new User Interface for enhanced user experience. Improved User Experience with a more intuitive design. General performance improvements and bug fixes.,0,0,0,0,0,1,0,0
1462023656,1000600000837464,Comera,Social Networking,2019-05-26,2019-05-26,196.88,2,1,0,0,5.0.0,2023-12-03,Introduced a new User Interface for enhanced user experience. Improved User Experience with a more intuitive design. General performance improvements and bug fixes.,0,0,0,0,0,1,0,0
1462023656,1000600000837464,Comera,Social Networking,2019-05-26,2019-05-26,196.88,2,1,0,0,4.0.11,2023-11-25,File Sharing: Share larger files up to 500 MB! Conference Call: Connect with more friends in bigger conference calls up to 50 members. Call Performance: Improved call performance and connectivity. Bug Fixes: Bug fixes for a smoother experience.,0,0,0,0,0,1,0,0
1462023656,1000600000837464,Comera,Social Networking,2019-05-26,2019-05-26,196.88,2,1,0,0,4.0.10,2023-09-18,Stickers: Make your chats more fun with stickers! Improved Call Connectivity: Enhanced call connectivity for quicker and better communication. Bug Fixes Enhancements: Enjoy a smoother and improved experience with various fixes and enhancements.,0,0,1,0,0,0,0,0
1462023656,1000600000837464,Comera,Social Networking,2019-05-26,2019-05-26,196.88,2,1,0,0,4.0.9,2023-08-14,Call Link Generation: Effortlessly share unique call links for quick connections. Image Collage View: Simplified browsing through merged chat photos. Enhanced Control: Manage your online visibility choosing who sees you. Bug Fixes Enhancements: Enjoy a smoother and optimized experience.,0,1,0,0,0,0,0,0
1462023656,1000600000837464,Comera,Social Networking,2019-05-26,2019-05-26,196.88,2,1,0,0,4.0.8,2023-07-13,Other party time during calls: Now shows the current time of the other party during audio calls. Improved Last Seen Functionality: Information on when contacts were last active has been enhanced for better accuracy. Extended Message character limit: Character limit for messages has been increased for longer messages. Bug Fixes and Improvements: Bug fixes and improvements made for better user experience.,1,0,0,0,0,0,0,0
1462023656,1000600000837464,Comera,Social Networking,2019-05-26,2019-05-26,196.88,2,1,0,0,4.0.7,2023-06-20,Enhanced Contact Sharing: Share contact details using an improved contact card in chat. Forward Message Upgrade: Forward messages to up to 5 participants in a single action. Screen Sharing on Call: Share your screen during one on one calls for better communication. Auto Chat Backup: Automatically back up and restore chats for logged out sessions on the same device. Improved Call Quality: Enjoy smoother calls with enhanced call quality.,0,0,0,0,0,0,0,0
1462023656,1000600000837464,Comera,Social Networking,2019-05-26,2019-05-26,196.88,2,1,0,0,4.0.6,2023-06-15,Enhanced Contact Sharing: Share contact details using an improved contact card in chat. Forward Message Upgrade: Forward messages to up to 5 participants in a single action. Screen Sharing on Call: Share your screen during one on one calls for better communication. Auto Chat Backup: Automatically back up and restore chats for logged out sessions on the same device. Improved Call Quality: Enjoy smoother calls with enhanced call quality.,0,0,0,0,0,0,0,0
1462023656,1000600000837464,Comera,Social Networking,2019-05-26,2019-05-26,196.88,2,1,0,0,4.0.5,2023-05-19,Sound wave in voice notes: Visualize audio in voice notes for easier understanding. Improved call connectivity quality: Faster clearer calls with friends and family. Conference Call Optimization: Improved Conference Call feature for better communication. Bug Fixes and Improvements: Overall user experience enhancements.,0,0,0,0,0,0,0,0
1462023656,1000600000837464,Comera,Social Networking,2019-05-26,2019-05-26,196.88,2,1,0,0,4.0.4,2023-05-12,Sound wave in voice notes: Visualize audio in voice notes for easier understanding. Improved call connectivity quality: Faster clearer calls with friends and family. Conference Call Optimization: Improved Conference Call feature for better communication. Bug Fixes and Improvements: Overall user experience enhancements.,0,0,0,0,0,0,0,0
1462023656,1000600000837464,Comera,Social Networking,2019-05-26,2019-05-26,196.88,2,1,0,0,4.0.3,2023-04-29,Improved call connectivity on unstable networks,0,0,0,0,0,0,0,0
1462023656,1000600000837464,Comera,Social Networking,2019-05-26,2019-05-26,196.88,2,1,0,0,4.0.1,2023-04-11,Conference Call : Added Conference Calling for up to 20 participants for high quality communication. Faster Message Delivery : Optimized message delivery for fast and reliable messaging. Enhanced File Sharing : Enhanced file sharing for quick and secure transmission of files. Bug fixes and performance improvements to enhance the overall app experience.,0,0,0,0,0,0,0,0
1462023656,1000600000837464,Comera,Social Networking,2019-05-26,2019-05-26,196.88,2,1,0,0,3.1.31,2023-03-21,Bug Fixes and Improvements,0,0,0,0,0,0,0,0
1462023656,1000600000837464,Comera,Social Networking,2019-05-26,2019-05-26,196.88,2,1,0,0,3.1.30,2023-03-18,Change Phone number: Change your phone number associated with your Comera account. Logout: Switch between existing or new accounts without uninstalling and reinstalling Comera. Permanent contacts: Save your Comera contacts in the server and retrieve them on a new device as permanent contacts. Nick Name: See the nicknames of unsaved contacts group participants for easy identification. Improved call connectivity quality: Experience better audio and video call quality with faster connectivity.,0,0,0,0,0,0,0,0
1462023656,1000600000837464,Comera,Social Networking,2019-05-26,2019-05-26,196.88,2,1,0,0,3.1.29,2023-03-10,Change Phone number: Change your phone number associated with your Comera account. Logout: Switch between existing or new accounts without uninstalling and reinstalling Comera. Permanent contacts: Save your Comera contacts in the server and retrieve them on a new device as permanent contacts. Nick Name: See the nicknames of unsaved contacts group participants for easy identification. Improved call connectivity quality: Experience better audio and video call quality with faster connectivity.,0,0,0,0,0,0,0,0
1462023656,1000600000837464,Comera,Social Networking,2019-05-26,2019-05-26,196.88,2,1,0,0,3.1.28,2023-02-13,Tag Participants: Tag participants in group chats for more interactive communication. Online Presence Indicator: See who s online with a visual indicator. Improved Call Stability: Calls are now more stable even on low bandwidth. Bug Fixes and UI Improvements: Improved experience with bug fixes and UI enhancements.,0,0,0,0,0,0,0,0
1462023656,1000600000837464,Comera,Social Networking,2019-05-26,2019-05-26,196.88,2,1,0,0,3.1.27,2023-01-17,Users can now tap the group link or scan the QR code to join a group Improved call connectivity and call quality Improved message delivery time Contact Sync optimized Some minor bug fixes and improvements to the overall user experience,0,0,0,0,0,0,0,0
1462023656,1000600000837464,Comera,Social Networking,2019-05-26,2019-05-26,196.88,2,1,0,0,3.1.26,2022-11-23,Listen to Voice Notes before Sending: Users can now listen to recorded voice notes before sending them. Read Receipt for Voice Notes: Users can know whether their voice note has been viewed and played. Play Voice Notes outside the Native Chat: A voice note will continue to play even when the user has navigated away from the native chat. Pause Continue Recording Voice Notes: Users can pause while recording voice notes and resume recording from the time it was paused. Feedback after Call: Users can share their call experience as feedback after ending a call. Bug Fixes Enhancements: Some minor bug fixes and improvements to the overall user experience.,0,0,0,0,0,0,0,0
1462023656,1000600000837464,Comera,Social Networking,2019-05-26,2019-05-26,196.88,2,1,0,0,3.1.25,2022-10-11,Delete Multiple Messages: Users can delete multiple messages at a time. Enter is Send: Users can configure the Enter key to send messages. Group Chat Improvements: Members of a group chat have more options to interact with other members directly from the group. Bug Fixes Enhancements: Some minor bug fixes and improvements to the overall user experience.,0,0,0,0,0,0,0,0
1462023656,1000600000837464,Comera,Social Networking,2019-05-26,2019-05-26,196.88,2,1,0,0,3.1.24,2022-09-29,Bug fixes and feature improvements.,0,0,0,0,0,0,0,0
1462023656,1000600000837464,Comera,Social Networking,2019-05-26,2019-05-26,196.88,2,1,0,0,3.1.23,2022-09-08,Profile Status: Users can select from predefined status or create their own. Read Unread: Users can mark chats read or unread as per their needs. Improvements: Functional UI improvements for a better user experience.,0,0,0,0,0,0,0,0
1462023656,1000600000837464,Comera,Social Networking,2019-05-26,2019-05-26,196.88,2,1,0,0,3.1.22,2022-08-19,Profile Status: Users can select from predefined status or create their own. Read Unread: Users can mark chats read or unread as per their needs. Improvements: Functional improvements for a better user experience.,0,0,0,0,0,0,0,0
1462023656,1000600000837464,Comera,Social Networking,2019-05-26,2019-05-26,196.88,2,1,0,0,3.1.21,2022-07-08,Chat Backup: Create restore your chat backup whenever needed. Low Battery Alert: Comera will now alert the caller the callee in case of low battery. Latest features Improvements: A dedicated section created to share new developments. Security: Enhanced security for network communications. Improvements: Improvements made in contact syncing and other bugs fixes,0,0,0,0,0,0,0,0
1462023656,1000600000837464,Comera,Social Networking,2019-05-26,2019-05-26,196.88,2,1,0,0,3.1.20,2022-06-09,Message Scheduler: Users can schedule messages to be sent at a specific date and time. Broadcast Messages: Users can broadcast messages to up to 25 contacts. Less Data for Calls: Users can opt for less data to be consumed for audio video calls.,0,0,0,0,0,0,0,0
1462023656,1000600000837464,Comera,Social Networking,2019-05-26,2019-05-26,196.88,2,1,0,0,3.1.19,2022-04-28,Auto Download: Users can now control auto download of media on Wifi and data. Avatars: More avatars added to our avatars collection. Delete Account: The Delete Account feature and functionality have been further streamlined for better user experience Maintenance: Introduced performance improvements and bug fixes.,0,0,0,0,0,0,0,0
1462023656,1000600000837464,Comera,Social Networking,2019-05-26,2019-05-26,196.88,2,1,0,0,3.1.18,2022-04-01,Avatar as Display Picture: Users can now set their Avatar as their Display Picture. Instant Media Sharing: Media can be captured and shared instantly from the home screen. Blocked Contacts: Stricter policies applied to Blocked Contacts. Report Contacts: Major tweaks to the Report Contact feature. Minor bug fixes.,0,0,0,0,0,0,0,0
1462023656,1000600000837464,Comera,Social Networking,2019-05-26,2019-05-26,196.88,2,1,0,0,3.1.17,2022-03-01,View Once: Media files marked view once will be automatically deleted from the chat and won t be saved on the device after being viewed once. Media Preview and Editor: Comera users can now edit media files before sending them. In App Youtube videos: YouTube Videos can now be played directly in Comera. Minor Bug Fixes.,0,0,0,0,0,0,0,0
1462023656,1000600000837464,Comera,Social Networking,2019-05-26,2019-05-26,196.88,2,1,0,0,3.1.16,2022-01-20,Custom Notification. Users can now set their favorite ringtone for messages and group message. Better Search. Users can search their image video link and Gifs using filter tags. Multiple bugs and crashes fixed.,0,0,0,0,0,0,0,0
1462023656,1000600000837464,Comera,Social Networking,2019-05-26,2019-05-26,196.88,2,1,0,0,3.1.15,2022-01-19,Custom Notification. Users can now set their favorite ringtone for messages and group message. Better Search. Users can search their image video link and Gifs using filter tags. Multiple bugs and crashes fixed.,0,0,0,0,0,0,0,0
1462023656,1000600000837464,Comera,Social Networking,2019-05-26,2019-05-26,196.88,2,1,0,0,3.1.14,2021-12-28,Disappearing messages. Users can now time their private messages which will disappear after the specified time adding more to user privacy. Better Search. Users can search their Audio and Document files using filter tags Push Notifications availability is improved Multiple bugs and crashes fixed.,0,0,0,0,0,0,0,0
1462023656,1000600000837464,Comera,Social Networking,2019-05-26,2019-05-26,196.88,2,1,0,0,3.1.13,2021-12-21,Privacy options for User s Last Seen and Profile Photo. Voice note can now be played at 1.5x and 2x speed. Star message improvements. Simplified add edit remove process for display picture name and status. User can now remove display picture from the group. Bug fixes and refinements.,0,0,0,0,0,0,0,0
1462023656,1000600000837464,Comera,Social Networking,2019-05-26,2019-05-26,196.88,2,1,0,0,3.1.12,2021-11-18,Privacy options for User s Last Seen and Profile Photo. Voice note can now be played at 1.5x and 2x speed. Star message improvements. Simplified add edit remove process for display picture name and status. User can now remove display picture from the group. Bug fixes and refinements.,0,0,0,0,0,0,0,0
1462023656,1000600000837464,Comera,Social Networking,2019-05-26,2019-05-26,196.88,2,1,0,0,3.1.11,2021-10-29,You can now pin up to 3 conversations for instant accessibility. Export chats without media to other users. Star important messages to bookmark for later reference. Support for Arabic language added. UI refinements bug fixes and performance improvements. If you have any feedback or questions please navigate to Comera Settings Help Feedback or you can visit www.comeratech.com and chat with our representatives.,0,0,0,0,0,0,0,0
1462023656,1000600000837464,Comera,Social Networking,2019-05-26,2019-05-26,196.88,2,1,0,0,3.1.10,2021-10-20,You can now pin up to 3 conversations for instant accessibility. Export chats without media to other users. Star important messages to bookmark for later reference. Support for Arabic language added. UI refinements bug fixes and performance improvements. If you have any feedback or questions please navigate to Comera Settings Help Feedback or you can visit www.comeratech.com and chat with our representatives.,0,0,0,0,0,0,0,0
1462023656,1000600000837464,Comera,Social Networking,2019-05-26,2019-05-26,196.88,2,1,0,0,3.1.9,2021-09-22,Comera is striving hard to deliver the best voice call and messaging services to its users. For that our team continually tweaks the app to enhance user experience and add new features. Our regular updates fix minor bugs and improve the app s performance. Update to the latest version to keep enjoying your favorite call and chat app. Have suggestions or want to share your feedback with us Please visit www.comeratech.com and chat with our representatives.,0,0,0,0,0,0,0,0
1462023656,1000600000837464,Comera,Social Networking,2019-05-26,2019-05-26,196.88,2,1,0,0,3.1.8,2021-08-26,Comera is striving hard to deliver the best voice call and messaging services to its users. For that our team continually tweaks the app to enhance user experience and add new features. Our regular updates fix minor bugs and improve the app s performance. Update to the latest version to keep enjoying your favorite call and chat app. Have suggestions or want to share your feedback with us Please visit www.comeratech.com and chat with our representatives.,0,0,0,0,0,0,0,0
1462023656,1000600000837464,Comera,Social Networking,2019-05-26,2019-05-26,196.88,2,1,0,0,3.1.7,2021-08-18,Comera is striving hard to deliver the best voice call and messaging services to its users. For that our team continually tweaks the app to enhance user experience and add new features. Our regular updates fix minor bugs and improve the app s performance. Update to the latest version to keep enjoying your favorite call and chat app. Have suggestions or want to share your feedback with us Please visit www.comeratech.com and chat with our representatives.,0,0,0,0,0,0,0,0
1462023656,1000600000837464,Comera,Social Networking,2019-05-26,2019-05-26,196.88,2,1,0,0,3.1.6,2021-07-15,Comera is striving hard to deliver the best voice call and messaging services to its users. For that our team continually tweaks the app to enhance user experience and add new features. Our regular updates fix minor bugs and improve the app s performance. Update to the latest version to keep enjoying your favorite call and chat app. Have suggestions or want to share your feedback with us Please visit www.comeratech.com and chat with our representatives.,0,0,0,0,0,0,0,0
1462023656,1000600000837464,Comera,Social Networking,2019-05-26,2019-05-26,196.88,2,1,0,0,3.1.5,2021-05-21,Comera is striving hard to deliver the best voice call and messaging services to its users. For that our team continually tweaks the app to enhance user experience and add new features. Our regular updates fix minor bugs and improve the app s performance. Update to the latest version to keep enjoying your favorite call and chat app. Have suggestions or want to share your feedback with us Please visit www.comeratech.com and chat with our representatives.,0,0,0,0,0,0,0,0
1462023656,1000600000837464,Comera,Social Networking,2019-05-26,2019-05-26,196.88,2,1,0,0,3.1.4,2021-04-21,Comera is striving hard to deliver the best voice call and messaging services to its users. For that our team continually tweaks the app to enhance user experience and add new features. Our regular updates fix minor bugs and improve the app s performance. Update to the latest version to keep enjoying your favorite call and chat app. Have suggestions or want to share your feedback with us Please visit www.comeratech.com and chat with our representatives.,0,0,0,0,0,0,0,0
1462023656,1000600000837464,Comera,Social Networking,2019-05-26,2019-05-26,196.88,2,1,0,0,3.1.3,2021-03-18,Comera is striving hard to deliver the best voice call and messaging services to its users. For that our team continually tweaks the app to enhance user experience and add new features. Our regular updates fix minor bugs and improve the app s performance. Update to the latest version to keep enjoying your favorite call and chat app. Have suggestions or want to share your feedback with us Please visit www.comeratech.com and chat with our representatives.,0,0,0,0,0,0,0,0
1462023656,1000600000837464,Comera,Social Networking,2019-05-26,2019-05-26,196.88,2,1,0,0,3.1.2,2021-02-18,Comera is striving hard to deliver the best voice call and messaging services to its users. For that our team continually tweaks the app to enhance user experience and add new features. Our regular updates fix minor bugs and improve the app s performance. Update to the latest version to keep enjoying your favorite call and chat app. Have suggestions or want to share your feedback with us Please visit www.comeratech.com and chat with our representatives.,0,0,0,0,0,0,0,0
1462023656,1000600000837464,Comera,Social Networking,2019-05-26,2019-05-26,196.88,2,1,0,0,3.1.1,2021-01-26,Performance improvements and bug fixes.,0,0,0,0,0,0,0,0
1462023656,1000600000837464,Comera,Social Networking,2019-05-26,2019-05-26,196.88,2,1,0,0,3.1.0,2021-01-21,Improvements in calls and chat functionality. Performance improvements and bug fixes.,0,0,0,0,0,0,0,0
1462023656,1000600000837464,Comera,Social Networking,2019-05-26,2019-05-26,196.88,2,1,0,0,3.0.9,2021-01-11,Performance improvements and bug fixes.,0,0,0,0,0,0,0,0
1462023656,1000600000837464,Comera,Social Networking,2019-05-26,2019-05-26,196.88,2,1,0,0,3.0.8,2020-12-19,Performance improvements and bug fixes,0,0,0,0,0,0,0,0
1462023656,1000600000837464,Comera,Social Networking,2019-05-26,2019-05-26,196.88,2,1,0,0,3.0.7,2020-11-18,Performance improvements and bug fixes.,0,0,0,0,0,0,0,0
1462023656,1000600000837464,Comera,Social Networking,2019-05-26,2019-05-26,196.88,2,1,0,0,3.0.6,2020-11-05,Performance improvements and bug fixes,0,0,0,0,0,0,0,0
1462023656,1000600000837464,Comera,Social Networking,2019-05-26,2019-05-26,196.88,2,1,0,0,3.0.5,2020-10-19,Improvements in call and chat Enhanced notifications and status for messages Added support for call logs grouping Performance improvements and bug fixes,0,0,0,0,0,0,0,0
1462023656,1000600000837464,Comera,Social Networking,2019-05-26,2019-05-26,196.88,2,1,0,0,3.0.4,2020-09-21,Improvements in chats audio and video call. Performance enhancements and app iteration fixes.,0,0,0,0,0,0,0,0
1462023656,1000600000837464,Comera,Social Networking,2019-05-26,2019-05-26,196.88,2,1,0,0,3.0.3,2020-08-16,Improved group chat in terms of message forwarding and file sharing. Option to add or remove group participants now added. Adding and Blocking a contact made more convenient in chats. Contact saving and copying made easier. Design refinements in Chats Contacts and Calls screens. Performance upgradations and bug fixes.,0,0,0,0,0,0,0,0
1462023656,1000600000837464,Comera,Social Networking,2019-05-26,2019-05-26,196.88,2,1,0,0,3.0.2,2020-07-28,Improved call and chat features. Addition of voice OTP feature to make registration more convenient. Improved user status visibility with timestamp on last seen. Performance improvements and bug fixes.,0,0,0,0,0,0,0,0
1462023656,1000600000837464,Comera,Social Networking,2019-05-26,2019-05-26,196.88,2,1,0,0,3.0.1,2020-07-14,Improved call and chat experience. Improved group chat experience. Share multimedia messages to external apps. Contact sync feature upgraded. Performance improvement and bug fixes.,0,0,0,0,0,0,0,0
1462023656,1000600000837464,Comera,Social Networking,2019-05-26,2019-05-26,196.88,2,1,0,0,3.0.0,2020-06-12,End to End encryption to secure calls and messages Unlimited high quality voice and video calls Effective and stable handling of calls over different networks such as 2G 3G 4G and Wi Fi Offline Calls Chat notifications One to one or group chats with people to share multimedia messages including documents links locations photos and videos Option to send audio messages Emojis to express your emotions better External multimedia sharing,0,0,0,0,0,0,0,0
1462023656,1000600000837464,Comera,Social Networking,2019-05-26,2019-05-26,196.88,2,1,0,0,2.0.5,2020-01-20,Call stability on network switching is improved. Call status messages are enhanced. Friend Requests and Friend List sections are added on Contact Screen. Call notifications are added to the chat screen. GSM and VoIP calls can be handled simultaneously now. Welcome banner added on new friend addition. Contacts UI has been improved. App crashes call bugs have been fixed.,0,0,0,0,0,0,0,0
1462023656,1000600000837464,Comera,Social Networking,2019-05-26,2019-05-26,196.88,2,1,0,0,2.0.4,2019-12-17,The Comera app is updated regularly so that users can experience a better calling and messaging service. The latest release has several bug fixes and performance improvements. Get the latest version from the Appstore. Here s what s New: 1. Voice and video calling quality have been improved. 2. Call bugs have been fixed. 3. Voice and video call performance on poor internet conditions has been improved. 4. Chat experience reliability has been enhanced. 5. New updates will be automatically notified to the user by alerts. 6. Contacts searching has been made more user friendly. 7. Missed call notification and alerts will be displayed on the screen. 8. Application permission handling has been improved. 9. Swipe menu options are provided in the application.,0,0,0,0,0,0,0,0
1462023656,1000600000837464,Comera,Social Networking,2019-05-26,2019-05-26,196.88,2,1,0,0,2.0.3,2019-11-05,Calling improvements and bug fixes UI improvements,0,0,0,0,0,0,0,0
1462023656,1000600000837464,Comera,Social Networking,2019-05-26,2019-05-26,196.88,2,1,0,0,2.0.2,2019-10-23,Unfriend and delete account feature added Minor bug fixes and regular updates,0,0,0,0,0,0,0,0
1462023656,1000600000837464,Comera,Social Networking,2019-05-26,2019-05-26,196.88,2,1,0,0,2.0.1,2019-10-04,Calling bug fixes Regular updates,0,0,0,0,0,0,0,0
