app_id,unified_app_id,app_name,app_category,worldwide_release,initial_release,app_size,app_lang,multihoming,paid,in_app_purchases,app_version,app_version_date,release_note,dummy_1,dummy_2,dummy_3,dummy_4,dummy_5,dummy_6,dummy_7,dummy_8
1462023656,1000600000837464,Comera,Social Networking,2019-05-26,2019-05-26,196.88,2,1,0,0,2.0.0,2019-10-01,Introduced new theme Video calling improvements Conference calling implemented Group chat improvements,0,0,0,0,0,0,0,0
1462023656,1000600000837464,Comera,Social Networking,2019-05-26,2019-05-26,196.88,2,1,0,0,1.0.3,2019-08-09,Introducing conference call Minor bug fixes,0,0,0,0,0,0,0,0
1462023656,1000600000837464,Comera,Social Networking,2019-05-26,2019-05-26,196.88,2,1,0,0,1.0.2,2019-07-01,Share media and docs with Comera users using share extension When you re on call check the call quality with quality meter Bug fixes and UI improvements,0,0,0,0,0,0,0,0
1462023656,1000600000837464,Comera,Social Networking,2019-05-26,2019-05-26,196.88,2,1,0,0,1.0.1,2019-06-03,Group chat improvements and bug fixes Multi call improvements,0,0,0,0,0,0,0,0
1462023656,1000600000837464,Comera,Social Networking,2019-05-26,2019-05-26,196.88,2,1,0,0,1.0,2019-05-26,,0,0,0,0,0,0,0,0
