app_id,unified_app_id,app_name,app_category,worldwide_release,initial_release,app_size,app_lang,multihoming,paid,in_app_purchases,app_version,app_version_date,release_note,dummy_1,dummy_2,dummy_3,dummy_4,dummy_5,dummy_6,dummy_7,dummy_8
1296718520,0,ShazzleChat,Social Networking,2020-08-24,2020-08-24,57.74,3,0,0,0,1.4.7,2022-09-27,Our development team has fixed some bugs and improved the overall performance of the app.,0,0,0,0,0,0,0,0
1296718520,0,ShazzleChat,Social Networking,2020-08-24,2020-08-24,57.74,3,0,0,0,1.4.6,2022-05-05,Our Development team has optimized the Calls function in order to provide better quality and stability. We hope that all our users will continue enjoying our application for private calls!,0,0,0,0,0,0,0,0
1296718520,0,ShazzleChat,Social Networking,2020-08-24,2020-08-24,57.74,3,0,0,0,1.4.5,2022-04-26,We have collected feedbacks from our users about the application and fixed some bugs in the application. We will try to improve ShazzleChat to make it even more comfortable for you!,0,0,0,0,0,0,0,0
1296718520,0,ShazzleChat,Social Networking,2020-08-24,2020-08-24,57.74,3,0,0,0,1.4.4,2022-04-21,This update will free all our users from having to provide an email address to submit feedback. Our development team has removed the email field from all screens so you don t have to enter it. We have collected feedback from our users about the application and fixed some bugs in the application. We will try to improve ShazzleChat to make it even more comfortable for you!,0,0,0,0,0,0,0,0
1296718520,0,ShazzleChat,Social Networking,2020-08-24,2020-08-24,57.74,3,0,0,0,1.4.3,2022-03-18,Minor bugfixes,0,0,0,0,0,0,0,0
1296718520,0,ShazzleChat,Social Networking,2020-08-24,2020-08-24,57.74,3,0,0,0,1.4.2,2022-03-16,We have improved contacts access logic. If you don t want to share your contacts then just click Cancel button and all functionality will be available. No more need to enter email addres for registration. We increased minimal iOS version to 13.0. It s good time to update iOS on yours devices,0,0,0,0,0,0,0,0
1296718520,0,ShazzleChat,Social Networking,2020-08-24,2020-08-24,57.74,3,0,0,0,1.4.1,2022-02-09,Improved application performance. Updated app design.,0,0,0,0,0,0,0,0
1296718520,0,ShazzleChat,Social Networking,2020-08-24,2020-08-24,57.74,3,0,0,0,1.4.0,2022-01-17,Updated the functionality of deleting an account. Optimized application performance.,0,0,0,0,0,0,0,0
1296718520,0,ShazzleChat,Social Networking,2020-08-24,2020-08-24,57.74,3,0,0,0,1.3.4,2021-11-05,Improved application performance for audio and video calls. Added the ability to switch sound sources headphones speaker bluetooth Fixed bugs with playing sound files.,0,0,0,0,0,0,0,0
1296718520,0,ShazzleChat,Social Networking,2020-08-24,2020-08-24,57.74,3,0,0,0,1.3.3,2021-10-14,Changes Added audio messages. Improved call quality.,0,0,0,0,0,0,0,0
1296718520,0,ShazzleChat,Social Networking,2020-08-24,2020-08-24,57.74,3,0,0,0,1.3.2,2021-08-14,We fixed minor bugs improved performance and optimized the application.,0,0,0,0,0,0,0,0
1296718520,0,ShazzleChat,Social Networking,2020-08-24,2020-08-24,57.74,3,0,0,0,1.2.7,2021-05-06,SUPPORT AND FAQ s and more in new version 1.2.7 Support and FAQ s User experience optimization,0,0,0,0,0,0,0,0
1296718520,0,ShazzleChat,Social Networking,2020-08-24,2020-08-24,57.74,3,0,0,0,1.2.6,2021-04-12,UI IMPROVEMENTS BUG FIXES and more in new version 1.2.6 User Experience Optimization Bugs Fixes,0,0,0,0,0,0,0,0
1296718520,0,ShazzleChat,Social Networking,2020-08-24,2020-08-24,57.74,3,0,0,0,1.2.5,2021-03-17,REGISTRATION IMPROVEMENTS UX IMPROVEMENTS BUG FIXES and more in new version 1.2.5 Get Verification Code via Call User Experience Optimization,0,0,0,0,0,0,0,0
1296718520,0,ShazzleChat,Social Networking,2020-08-24,2020-08-24,57.74,3,0,0,0,1.2.4,2021-03-02,CHANGE BACKGROUND BUG FIXES and more in the new version 1.2.4 Change Background: Customize the chat to suit your mood Use completely solid colours Choose a background image directly from your gallery,0,0,0,0,0,0,0,0
1296718520,0,ShazzleChat,Social Networking,2020-08-24,2020-08-24,57.74,3,0,0,0,1.2.3,2021-02-17,Contacts synchronization fixes Chat with friends even if you are far from each other,0,0,0,0,0,0,0,0
1296718520,0,ShazzleChat,Social Networking,2020-08-24,2020-08-24,57.74,3,0,0,0,1.2.2,2021-01-15,WELCOME MESSAGE TUTORIAL and more in new version 1.2.2 Welcome Message Get more information about application Tutorial Find out how you can invite a friend Find out how you can create a group Find out how you can send a support request,0,0,0,0,0,0,0,0
1296718520,0,ShazzleChat,Social Networking,2020-08-24,2020-08-24,57.74,3,0,0,0,1.2.1,2021-01-13,REDESIGNED FORWARD CELL INCREASED MESSAGE SIZE AND OTHER MINOR BUG FIXED and more in new version 1.2.1 Forward cell Identify forwarded messages more easily Forwarding won t change your text Message size Insert and send great articles Write more in one message,0,0,0,0,0,0,0,0
1296718520,0,ShazzleChat,Social Networking,2020-08-24,2020-08-24,57.74,3,0,0,0,1.2.0,2020-12-31,COMPRESSION FILE OPTIMIZATION BUG FIXES and more in new version 1.2.0 Compression. Send files much faster Send files in full size File Optimization. File loading logic upgraded Files download faster Minor Bug Fixes.,0,0,0,0,0,0,0,0
1296718520,0,ShazzleChat,Social Networking,2020-08-24,2020-08-24,57.74,3,0,0,0,1.1.6,2020-12-15,Minor bug fixes,0,0,0,0,0,0,0,0
1296718520,0,ShazzleChat,Social Networking,2020-08-24,2020-08-24,57.74,3,0,0,0,1.1.5,2020-12-10,PHOTO EDITOR CAPTION AND REPLY TO MESSAGES USING FILES and more in new version 1.1.5 Photo Editor Draw on the photo to highlight important points Crop the picture to send the only needed part Resize the picture to increase the quality Add text on a picture Caption Add a caption to the photos Add a caption to a videos Reply to messages with files Reply to messages with photos or video Answer to questions with files,0,0,0,0,0,0,0,0
1296718520,0,ShazzleChat,Social Networking,2020-08-24,2020-08-24,57.74,3,0,0,0,1.1.4,2020-12-02,Meet the new version 1.1.4 In this version we have fixed bugs so now your push notifications will be sent to the recipient at the fastest speed. You will no longer experience problems or inconveniences when creating groups. We implemented the new text for errors so you can easily understand what is the problem!,0,0,0,0,0,0,0,0
1296718520,0,ShazzleChat,Social Networking,2020-08-24,2020-08-24,57.74,3,0,0,0,1.1.3,2020-10-02,Bug fixes,0,0,0,0,0,0,0,0
1296718520,0,ShazzleChat,Social Networking,2020-08-24,2020-08-24,57.74,3,0,0,0,1.1.2,2020-09-23,GIFs support Buf fixes,0,0,0,0,0,0,0,0
1296718520,0,ShazzleChat,Social Networking,2020-08-24,2020-08-24,57.74,3,0,0,0,1.1.1,2020-09-04,Bugfixes,0,0,0,0,0,0,0,0
1296718520,0,ShazzleChat,Social Networking,2020-08-24,2020-08-24,57.74,3,0,0,0,1.1,2020-08-26,Bugfixes,0,0,0,0,0,0,0,0
1296718520,0,ShazzleChat,Social Networking,2020-08-24,2020-08-24,57.74,3,0,0,0,1.0,2020-08-24,,0,0,0,0,0,0,0,0
