app_id,unified_app_id,app_name,app_category,worldwide_release,initial_release,app_size,app_lang,multihoming,paid,in_app_purchases,app_description
1524421486,1000800000086625,DreamApp My Dream Journal AI,Health and Fitness,2020-08-12,2020-08-16,133.08,30.0,1,0,1,Personalized dream meanings Explore dream themes Find mental clarity So what do those strange dreams really mean With personalized meanings and therapist guidance get to know your dreams and yourself at a deeper level with DreamApp. Grounded in tradition and backed by science we delve into your dreams so you can understand your subconscious mind. DreamApp is a companion who will listen in a friendly manner give advice and connect the dots between your dreams and your life. Discovering the hidden meanings of your dreams is just the beginning. Do you need help to feel confident in your decisions Is it difficult to find peace for yourself and your life Your dreams may be telling you how to take on your biggest challenges. Become one with your step towards overcoming anxiety and depression gaining mental clarity and releasing your past. Here is how DreamApp works if you break down the process into stages STAGE ONE Dreaming and Healing Let the dreaming do the healing. Your healing journey starts in your bed when you drift off to sleep and enter a dreaming REM stage. Your brain is sorting out your emotional concerns. DreamApp has little to do with this process stage and all the credit goes to its evolution and nature. STAGE TWO Dream Reporting and Journaling Wake up and make sure to log your dream report. Notice how the story you dreamed about makes you feel upon awakening. Does it define your mood for the coming day Capture your thoughts and feelings before they fizzle out as they most definitely will. Journaling your dreams sets the ground for asking questions like why you were dreaming what you were dreaming and how you can use this information to make decisions in your waking life. This self examination is crucial for noticing and further understanding the states your mind enters whether during your dreams or waking hours. STAGE THREE Understanding Your Dreams Get the first raw analysis of the themes that appeared in your dream. Using a range of AI solutions DreamApp will analyze your dream to give you a rough idea of why you might have dreamed what you dreamed. You will get the meaning of your dream with an important caveat that there are no universal meanings the realm of horoscopes . There are rather dream patterns that can point towards some common emotional concerns reflected in common dreams. Unlike reading your lab exam results the chart will only show you the statistical norm across the studied populations and any actionable recommendations can only be prescribed to you according to your specific state and history of health and illness. STAGE FOUR Discussing Your Dreams with a Therapist Yes you heard it right. DreamApp connects you to a board certified psychologist specializing in using dream analysis. It doesn t mean that DreamApp thinks you are mental and connects you to a doctor . It means that DreamApp believes in the immense power of honest and open conversation in a safe and compassionate setting. DreamApp therapists are here to hear any of your concerns with zero judgment and no expectations of you. Simply put their only job is to figure out how to make you feel better in your waking life. STAGE FIVE Sound Sleeping Deep sound restful sleep indicates a healthier happier more meaningful waking life. Go to sleep relieved of the emotional baggage of complex past experiences. Find yourself dreaming and living a more content life. If anything goes wrong go back to stage one.
1606879552,0,Ease Journal Diary Gratitude,Health and Fitness,2022-02-02,2022-02-02,65.58,1.0,0,0,1,Ease journal is a free journal diary with a lock gratitude journal and mood tracker app for your mental health that will help you feel calmer and reduce anxiety. Self care mental health and personal growth are important and this app will help you with in depth reflection and exploration of your values opinions and personality traits to strengthen not just the relationship you have with yourself but also the connections you build with others. This is the best free journal app for self care happiness anxiety and stress relief. Ease Journal mood tracker free gratitude journal and private Diary with a lock will help you lower stress levels feel calmer and reconnect with yourself. Use this free gratitude journal to focus on the positive things in your live and to record what you are grateful for. Practice gratitude with this simple free and private gratitude journaling app. A private journal and diary that offers a safe space to express difficult emotions making it easier to work through distressing thoughts that you might struggle to share out loud. This mood tracker app and gratitude journal app also supports adding photos and recordings. Simply the best diary app that that allows you to personalize your journal diary with beautiful themes and fonts. Ease journal is a journaling app that can help you stay accountable. Ease journal sends you daily reminders to write in your gratitude journal and dairy. The app provides you with prompts for self discovery managing emotions anxiety and depression so you can never run out of ideas about what to write. Be more happy and mindful of your days. Track your moods and identify your triggers Manage stress and reduce anxiety Track your activities for self improvement Build positive thinking through journaling Be more grateful and calmer with the free Gratitude journal Journal for self improvement self reflection and self discovery Track the achievements you made in life with journal app Improve your mental health with the best dairy app Reflect back on your past moments of gratitude Self care journal for personal growth. improve your mood motivation mental health Ease journal Journal with a lock free diary gratitude journal and mood tracker features: Customize color themes for your journal app Edit and create new customizable moods for mood tracker Set daily journaling reminders Hundreds of journal prompts for self reflection self discovery and managing anxiety. Mood tracker and journaling statistics PIN lock to protect your journals Set Code lock for your entries Export PDF and TXT to share or print your diary entries Back up your journals safely Never lose your memories Quick widget access to your private journal Private diary and journal We do not collect your data Customize fonts for your journal Beautiful stickers for your private diary Write journals with pictures Subscriptions a Monthly Length of subscription: 1 month Price of subscription: USD 1.99 month Payment will be charged to iTunes Account at confirmation of purchase Account will be charged for renewal within 24 hours prior to the end of the current period and identify the cost of the renewal Subscriptions may be managed by the user and auto renewal may be turned off by going to the user s Account Settings after purchase Any unused portion of a free trial period if offered will be forfeited when the user purchases a subscription to that publication where applicable b Lifetime Length of subscription: Indefinite Lifetime Price of subscription: USD 9.99 One time payment Payment will be charged to iTunes Account at confirmation of purchase Subscriptions may be managed by the user Any unused portion of a free trial period if offered will be forfeited when the user purchases a subscription to that publication where applicable Privacy policy terms of use: https: bizchineseapp.com ease journal terms.php
6475245187,0,Easy Journaling,Lifestyle,2024-02-06,2024-02-06,5.39,1.0,0,0,1,Easy Journaling: Capture Life as it Happens Discover Easy Journaling the friendly app that lets you write about your day as it unfolds. No fuss no hassle just you and your thoughts whenever you want. Write Right Away: Open Easy Journaling and start typing. It s that simple. Our writing pad is always the first thing you see so you can get your thoughts down without any delays. Your Day Pieced Together: Jot down notes ideas or feelings anytime. Easy Journaling automatically puts your day s notes together into one complete story. Remember Every Spot: At a special place Add it to your note! Easy Journaling lets you remember not just what you thought but where you were too. Add Your Own Flair: Make your journal yours by adding photos videos drawings or even funny gifs. Your words and your world all in one place. Easy to Use: Our app is super simple so you can focus on your thoughts not on how to use the app. Safe and Private: Your memories are for your eyes only. Nothing leaves your device. No Subscriptions! Easy Journaling is like a friendly chat where you re the storyteller. Capture the big events and the little moments all in one place with ease.
1071845526,0,Easy Mood Diary,Health and Fitness,2016-01-13,2016-01-13,19.17,1.0,0,0,0,This free simple app is a mood journal tracker and charting tool. It will help you discover your ups and downs and get insights into yourself. Easy Mood Diary can help you track level of anxiety tics obsessive compulsive disorder stress general well being or simply mood. Easy Mood Diary help you do this very simple nothing fancy just a simple and effective mood diary. WHAT IS A MOOD JOURNAL A mood journal help you register and visualize your mood with the purpose of taking action to improve it. Mood diary is a tool often recommended by psychologists and therapists to help discover facts about ourselves that otherwise slip our attention. You may experience a diagnosed condition like anxiety bipolar OCD or depression. You may have stressful job or you may otherwise be emotional unbalanced.
1484760450,0,Easy Mood,Health and Fitness,2019-01-11,2019-11-01,67.31,1.0,0,0,0,Improving one s mood and emotional health requires knowing what you ve felt in the past. Easy Mood does just that. Track all of your feelings from day to day using a simple but familiar calendar interface. Get a quick view of each emotion for each day in a month. Each emotion has a unique color so you can easily identify and track which days you have felt each emotion.
1466962236,1000800000188215,Ein guter Plan Achtsamkeit,Health and Fitness,2020-01-15,2019-07-24,98.38,1.0,1,0,0,A good plan is your daily companion for more mindfulness and self love in everyday life. With simple but effective reflection units this app supports you in consciously taking a few minutes for yourself and your mental well being in the hectic everyday life. Reflecting on your needs identifying stress patterns and keeping a journal to train your gratitude has been shown to help bring more satisfaction and relaxation into your life. Without compulsive self optimisation and kitsch. We think the most important app in your life should be about your life. Here s how a good plan helps with self care: Mindfulness traffic light: Evaluate eight factors that influence your well being every day sleep mood diet drinking exercise self care social contacts and stress perception. It s not necessarily about the evaluation itself but about the few seconds you listen to yourself and mindfully observe your emotional state. Graphical evaluation: Understand how the influencing factors are related and affect your well being. Does your stress level increase if you don t maintain your social contacts Do you sleep worse when you move less In this way you can recognize stress patterns before they become a burden and intervene at an early stage. Gratitude journal: Write down a few things you re grateful for each day. This has been proven to make you happier and help you reflect on the day and end it. Even if not every day is a good day you will learn to see the good in the little things and to articulate appreciation. Bulletin board: All your diary entries to scroll through. So you always have the good things in your life at a glance. Especially on bad days this collection of beautiful memories can be really beneficial. The good thought of the day: An inspiring quote far away from kitsch and clich every day which can show you new perspectives. Reminder function: Be reminded of your short break every day at the time of your choice. Through this regularity mindfulness becomes an integral part of your life. Soundscapes: Choose your favourite sound from rain birdsong cat purring the sound of the sea or meditation music and combine it to create your own personal soundscape to relax or concentrate. Timer: Select a time interval and the sounds will stop automatically when the time is up. Perfect for distracting yourself from thought spirals when falling asleep or for scheduling focus phases for productive work Pomodoro . Dark Mode: Especially if your entries are part of your evening routine Dark Mode can be more comfortable for you. Security: Your data will not be transferred to us and no account is required. The app is also completely ad free and free. It is also perfect as a supplement to the books of our publishing house.
1184456130,0,eMoods Bipolar Mood Tracker,Lifestyle,2017-05-06,2017-05-04,51.86,7.0,0,0,1,EASY PRIVATE MOOD TRACKER Your privacy matters! eMoods never stores any of your data in the cloud or connects to any APIs. No data leaves your phone without your explicit action. eMoods is a mood tracking and charting journal perfect for logging Bipolar I Bipolar II Depression Anxiety or any general kind of mood tracking! eMoods allows you to track medication changes so that you can safely make adjustments titrations or medication tapers with the help of your doctor and learn about what works and what doesn t. These insights can be used for titrating up to a new medication or for assistance in coming off a medication. eMoods allows you to send a monthly PDF report to your doctor BETTER REPORTING FOR YOUR DOCTOR VISITS Managing your mood just became easier and more effective! eMoods is a private and easy to use mood tracker and diary for journaling logging graphing reporting and managing symptoms related to Bipolar Manic Depression Depression Anxiety and other mood disorders. Start tracking notice your triggers and take control of your mood and other symptoms! FEATURES eMoods is a free mood tracker app that lets you: Easily chart your daily highs and lows sleep medications and other symptoms related to common mood disorders like Bipolar Manic Depressive illness Depression and Anxiety. Email a printable PDF report at the end of each month to your doctor or therapist to help you identify triggers or other events that could lead to an episode or relapse. View in app graphs and printable charts to track trends and visualize your symptoms and triggers in between appointments. You can add emojis or any other language characters to your medication names and free form notes which will show up in your reports. PRIVACY IS PARAMOUNT Privacy is extremely important to us. All information you log is stored on your phone iPad only and never transmitted off of your device without your express permission. OPTIONAL PRO VERSION An in app upgrade is available that allows you to track custom symptoms and store multiple timestamped notes per day. Your data is still completely available in the app and via export if your upgrade expires. Upgrades are auto renewing subscriptions. Upgrade choices are as follows: one month term In app purchase title eMoods Pro Monthly 1.99 one year term In app purchase title eMoods Pro Yearly 9.99 terms. Both options can be canceled at any time. Payment will be charged to iTunes Account at confirmation of purchase Subscription automatically renews unless auto renew is turned off at least 24 hours before the end of the current period Account will be charged for renewal within 24 hours prior to the end of the current period and identify the cost of the renewal Subscriptions may be managed by the user and auto renewal may be turned off by going to the user s Account Settings after purchase Any unused portion of a free trial period if offered will be forfeited when the user purchases a subscription to that publication where applicable The app s terms of use can be found here: https: emoodtracker.com emoods classic reporting app terms of use The app s privacy policy can be found here: https: emoodtracker.com emoods classic reporting app privacy policy
1335347860,1000800000223538,Emotion Tracker Moodistory,Health and Fitness,2018-08-03,2018-07-31,36.28,8.0,1,0,1,Moodistory is a low effort mood tracker with a unique and beautiful design that respects 100 your privacy. Create journal entries in less than 5 seconds without writing a single word. Use the integrated mood calendar or year in pixels view to easily find mood patterns. Become aware of your mood highs and lows and analyze the cause of mood swings. Better manage anxiety discover triggers for a positive mood and ultimately establish awareness about your mental health. FEATURES Easy quick entry creation in less than 5 seconds! 180 events activities in 10 categories to describe what you ve been up to Fully customizable events activities Add photos notes and location automatically or manually Customizable mood scale: Use any scale from a 2 point scale up to an 11 point scale Mood calendar: Interactive yearly monthly and daily calendar views Year in Pixels view Powerful analysis engine: Find out what triggers a positive or negative mood identify mood swings and better manage anxiety and stress levels Random reminders that fit your daily routine Themes: Choose from a collection of carefully composed color palettes or create your own theme and select every single color yourself Set up Face ID Touch ID Passcode to keep your mood data safe from others Import mood data: Reuse any existing mood data from other apps Excel or Google Sheets PDF Export: Create a beautiful PDF in seconds for printing sharing archiving CSV Export: Export your mood data for use in external programs apps Easy data backup: Keep your diary safe from data loss using auto backup via iCloud OR use the manual local backup 5 beautiful and convenient widgets for your home screen Powerful search engine Highest data privacy standard: All data stays on your device Including Moodistory s Apple Watch app: Create entries and check your mood trend from your wrist YOUR MOOD TRACKER Life is about ups and downs and can sometimes leave you confused. If you want to understand your emotions and mood self awareness is key. Moodistory is here to support you in doing that! It s a mood tracker for self improvement to foster your mental health happiness and well being. It is a supporting tool for coping with mood swings bipolar disorders anxiety and depression. Your mental well being your mental health is Moodistory s mission. Selfcare and empowerment are the cornerstones. YOUR PRIVACY A mood tracker holds sensitive data that s why we made sure that your data is always safe! Moodistory stores your data solely on your iPhone meaning that ONLY YOU can access it. In case you enable iCloud backup your data will be saved to your personal iCloud account. We never store any of your mood data on external servers or share it with any third party apps or websites. Your mood tracker data is strictly confidential and only you can access it. BENEFITS Only things that are measured can be improved! Therefore the first step in self improvement is raising awareness and understanding. Knowledge is power selfcare is key! Moodistory helps you in understanding problems fears and concerns. It supports you in increasing your problem solving skills by discovering behavioral patterns by e.g. analyzing your Year in Pixels chart and triggers. Because Moodistory establishes facts about the history of your mood you ll feel more in control! IT S YOUR MENTAL HEALTH TRACKER Moodistory was designed to make selfcare and mood tracking an enjoyable and hassle free experience. We constantly strive to enhance our app. Your input is crucial in steering us towards the right path. If you have any questions or suggestions feel free to reach out to us at https: moodistory.com contact . We look forward to hearing from you and are always happy to help! Terms and conditions: https: moodistory.com termsandconditions Privacy policy: https: moodistory.com privacypolicy
6450100126,0,Emotion Tracker Moodup,Lifestyle,2023-07-07,2023-07-07,2.66,1.0,0,0,1,Moods are a natural part of your emotional rhythm and they can change based on various factors such as time situation and circumstance. By tracking your moods you can discover patterns and insights that can help you improve your well being. This app allows you to record your moods and associate them with different emotions and triggers. You can use them as a daily journal to track your thoughts and feelings and see them in a visual way. This can help you understand yourself better and manage your moods more effectively. Benefits of using this app are: You can become more aware of your feelings and emotions You can create your space to reflect on your feelings and emotions You can recognize patterns and triggers affecting your moods You can make better decisions related to triggers and moods You can share your mood checks with your therapist and get the support you need With MoodUp Premium you can also: Observe Stats: See how your moods emotions and triggers vary and identify trends and patterns. Attach Photo: Add a photo to your mood entry to capture the moment and express yourself visually. Backup Data: Sync your data across devices via iCloud automatically and never lose your mood history. To access the MoodUp Premium content and functionality you can choose the yearly auto renewable subscription. This recurring transaction will be charged to your iTunes Account at confirmation of purchase and will automatically renew unless you cancel it at least 24 hours before the end of your subscription. Renewals will be charged the same cost within 24 hours prior to the end of the current period. You can manage your subscriptions or turn off auto renewal by going to your iTunes Account Settings after purchase. Privacy Policy: https: medium.com patrickzhong privacy policy 40aa0a184fe4 Terms of Use: https: www.apple.com legal internet services itunes dev stdeula
1623853314,0,Ever Journal,Lifestyle,2022-11-20,2022-11-20,51.09,2.0,0,0,1,As of the 20th century AD there were about 100 billion people living on Earth. Only one million have left even a single name. Another 99 999 000 000 people have not left a single trace as if they had never existed. How did they spend their lives Who did they love What kind of pain and happiness did they experience In the vast space of the universe and the constant scale of time no one is more important than anyone else and no achievement is more important than the life journey itself. We believe that everyone s life story deserves to be saved and we hope that 10 000 years later there will still be people who can feel our lives in the story. It is the goal of the Ever Journal to do everything possible to preserve the true life story of each individual human being to the greatest extent possible. Journal Extremely pure and simple like a real diary. Autobiography A perfect place where you can write down your whole life journey. Biography Stories How about we tell each other s life stories. Nine Column Every night at nine o clock let s share our little secrets to strangers. Join Pro to Unlock Following Features Adding photos to your diary Cradle service Up to 10 permanent photos storage 10GB of regular photo storage space CONTACT Any problems or suggestions please let us know: Email: feedback xiangzi.tech Privacy Policy: https: everjournal.life privacy policy en.html Terms of Service: https: everjournal.life terms and conditions en.html
1519935634,0,Everlog Journal,Lifestyle,2020-10-14,2020-10-14,59.42,8.0,0,0,1,Everlog is a lightweight and elegant journal and diary app that helps you reflect on your life. Everlog was created with the simple premise of being fast and uncluttered so it s just you and your thoughts. CLEAN Everlog gets out of your way. Just hit the quill button and start typing. SUPPORTS MARKDOWN Format your entries using powerful Markdown syntax. PHOTOS Make your entries stand out by adding photos. COMMENTS Want to add to or reflect on an entry With comments you can do just that! Swipe right on any entry in the timeline or tap the reflection button in the editor and start reflecting. WIDGETS Keep track of your journaling stats with the beautiful widgets CALENDAR An expandable weekly monthly calendar gives you a birds eye view of your journaling activity as well as helping you travel back in time in a breeze. PASSCODE PROTECTION Keep your thoughts to yourself. Everlog can protect your journal entries with a passcode. ALWAYS IN SYNC PREMIUM Your entries are synced seamlessly over all your devices using iCloud Sync. AND MUCH MORE Unlimited journals PREMIUM Tags Bookmarks Search Dark mode Terms of Use: https: everlog.app terms Privacy Policy: https: everlog.app privacy
1508635535,0,Fabulam Personal Diary,Lifestyle,2020-04-08,2020-05-30,62.92,1.0,0,0,0,Note down your daily memories or inspirations using a rich text editor and you can even add photos to make them more visible. Its WYSIWYG editor offers a soft and gentle rich text editing with a good experience of writing and adding photos for keeping good memories. Don t let your memories slip away use Fabulam.
