app_id,unified_app_id,app_name,app_category,worldwide_release,initial_release,app_size,app_lang,multihoming,paid,in_app_purchases,app_description
1668640413,0,Mental health emotions diary,Health and Fitness,2023-02-23,2023-02-23,133.73,2.0,0,0,1,We will help you take care of yourself! PSY your best companion on the path to self development psychological well being and mental health. Mental health balance functionality helps assess your state manage stress and enhance psychological well being. It also assists in setting goals and receiving daily recommendations to improve your well being and psychological state. Various techniques and tools for working with different aspects of personality and roles: Inner Child Inner Adult and Inner Parent. We will help you systemize your thoughts and improve harmony among internal roles. Here are the functions available for each role: Inner Child: Idea Diary: Record your creative ideas dreams and inspirations. Wish Diary: Note your desires and dreams to bring them closer to realization. Free Writing: Use freewriting technique for expressive writing emotional release and thought processing. Gratitude Diary: Write down daily gratitudes to appreciate and enhance your life. Breath Meditations: Engage in breathing exercises and meditations for relaxation and mindfulness. Inner Adult: Self Esteem Work: Employ exercises and techniques to enhance self esteem and self love. Failure Diary: Record your failures and mistakes to extract lessons and grow. Acts of Self Love: Practice self care and actions that strengthen self esteem and well being. Emergency Toolkit: Create a list of techniques and strategies to cope with stress and difficulties. Inner Parent: Success Diary: Document your achievements and successes to encourage yourself and boost confidence. Belief Work: Explore and reframe limiting beliefs that may hinder your progress. Positive Affirmations: Create a list of positive affirmations to strengthen motivation and positive thinking. Life Rules: Define your personal rules and values to guide decision making and live according to your goals. Ideal Life: Visualize the ideal life you want to create and gradually work towards its realization. Additional app features: Personality Harmony Test: Take a test to assess your progress in achieving harmony among different roles. Home Screen Widgets: Set widgets with your own affirmations and positive statements to have them always at hand. Password Protection: Secure access to the app with a password. Self Care Reminders: Set reminders to take care of yourself improve well being and maintain balance among internal roles. Our privacy policy: https: github.com skaz2 doc wiki Privacy Policy Our terms of use: https: github.com skaz2 doc wiki LICENSED APPLICATION END USER LICENSE AGREEMENT
1620561662,0,Mentalio AI Mood Journal,Health and Fitness,2022-08-26,2022-07-20,100.5,1.0,0,0,1,Designed to assist individuals coping with depression stress and anxiety. Main App Features: Mood Reporting Journaling Breathing Exercises Self tests Educational Materials Statistics HOW MENTALIO WORKS: 1. Record how you feel each day. 2. Monitor your mood using the daily tracker powered by AI technology. This tracker gauges your emotions feelings panic episodes and other mental health parameters then presents you with related graphs and insights. 3. Respond to personalized questions derived from your journal entries. 4. Review and amend your past journal entries. 5. Obtain daily weekly and monthly summaries containing personalized insights and reminders. MOOD REPORTING: With Mentalio s mood tracker you can consistently monitor your feelings. By grasping your sentiments towards different aspects of life you can better manage them and promote a positive way of living. JOURNALING: Maintaining a diary consistently is beneficial in addressing lingering fears and concerns. These digital journals aid you in prioritizing your concerns necessities and tasks thereby guiding you to tackle issues that affect your mental state. BREATHING: Choose from three distinct breathing exercises accompanied by soothing background sounds. This meditative approach is designed to offer profound relaxation and solace. SELF TESTS: Mentalio administers varied tests to evaluate levels of stress anxiety depression and potential panic episodes. Such self assessment tools and trackers are pivotal in proactively managing mental health empowering you to take preemptive measures. EDUCATIONAL MATERIALS: It s essential to understand and express our feelings and emotions authentically. Concealing or denying them can lead to increased stress and mental vulnerability. Mentalio provides resources and training to help users connect with and understand their true emotions promoting a healthier mental outlook. STATISTICS: Besides providing insights from psychology and Cognitive Behavioral Therapy CBT Mentalio offers a statistical view of your progress using anxiety tests panic episode logs and emotion trackers. This allows you to gauge the effectiveness of your mental health initiatives. Privacy Policy: https: nettlebit.com mentalio privacy Terms of Service: https: nettlebit.com mentalio terms
1449237991,0,Mentalyze Daily Journal,Lifestyle,2019-01-15,2019-01-15,47.21,1.0,0,0,1,Knowledge is the key to changing your life. Mentalyze allows you to plot out your entire year one pixel a day. Color each pixel according to the mood that best represents that day. At the end of the year the entire chart will be filled and you can either reflect on a certain day or month or begin to notice patterns concerning your mood. Reflect and answer questions such as: how many days a year am I happy How many bad days do I experience Is it linked with the weather work health Most importantly how can you make your year better Mentalyze makes it significantly easier to learn more about your patterns and habits. Features: Customizable mood colors Customizable mood text Customizable App Icon Customizable Home Screen Widget Customizable background colors Sync with iCloud Import and export data Diary daily notes Daily task tracker with streaks Daily alerts and notifications Privacy mode Safety lock to prevent accidental changes End User License Agreement EULA : https: www.apple.com legal internet services itunes dev stdeula
1530948945,0,Mind Care Thought Diary,Health and Fitness,2020-11-06,2020-11-06,281.57,2.0,0,0,1,Create your diary stories through guided journaling sessions. Just pick your mood and set activity which is most affected your emotional state. Reflect on a few personalized questions and create habit instruction for future you based on this reflection. Easy and very rewarding! Keep on track your emotional state with insightful statistics. Track your mood changes. Track your activities. Find relationships between mood experience and habits you were following. Gain rewarding insights be motivated to succeed. As a mental health and life tracker Mindventure helps you relieve stress cope with anxiety and depression learn to be grateful put your thoughts in order find your way of life learn mindfulness regained happiness and much more. Features available for Mindventure users: Diary stories. Guided journaling with personalized questions for your efficient reflection. Meditation Journey. Listen to daily meditations that help you relax release stress focus sleep better hit procrastination be productive and more. Habits from psychology experts. Choose the habit you want to follow from the catalog. Or create your own habit. Insightful stats. Explore your experiences on informative charts. Track your progress and mood dynamics. Build motivations chains of created stories. Find relationships between mood and activities. Get actionable insights. Beautiful interface. The dark and clear interface allows immerse yourself into your evening daily reflection without any distraction. Write notes. To each daily story. Helpful notifications. Small auto reminders allow don t forget to create a new memory. If you choose to subscribe we offer Premium Subscription options: Monthly subscription at 9 99 Yearly subscription at 14.99 with 7 day trial period Yearly subscription at 14.99 without trial Lifetime Access at 24.99 and Yearly sale subscription at 11.99. Payment will be charged to iTunes Account at confirmation of purchase. Subscription automatically renews unless auto renew is turned off at least 24 hours before the end of the current period. Account will be charged for renewal within 24 hours prior to the end of the current period and identify the cost of the renewal. Subscriptions may be managed by the user and auto renewal may be turned off by going to the user s Account Settings after purchase. Any unused portion of a free trial period if offered will be forfeited when the user purchases a subscription to that publication where applicable. Our Terms of Service and Privacy Policy you can find here: Terms of use: https: bit.ly mindventure terms Privacy policy: https: bit.ly mindventure pp
1564080533,1000800000223733,Mind Tracker Journal,Lifestyle,2022-05-20,2022-05-20,164.55,1.0,1,0,0,Track your mood energy feelings and events with Mind Tracker. Make notes and determine how different events affect your well being when you re in your best state and when your mood declines. The app will clearly show what influences your well being in the moment and in the future. 1. Mark your mood : Keeping a journal has therapeutic effects on its own record your mood to better understand your emotions and track your well being in time. 2. Monitor your energy : It s essential to track not only your mood but also your energy levels. Remember that your energy level is directly related to your mood. 3. Analyze the data : Keep in mind that bad moments in your life are just points on a chart. Look objectively at the overall picture without cognitive distortions using statistics to analyze your mood diary. 4. Evaluate the impact of events : Mark events and the app will automatically suggest which events have the most significant impact on your well being and future mood. 5. Use neurospheres : Apply an innovative approach to monitoring emotions with neurospheres for a more mindful attitude towards your emotional life. 6. Keep an eye on the calendar : Determine mood cycles using a calendar and leave notes about your experiences. 7. Receive smart recommendations : Use the smart recommendation system to improve your well being and emotional state. 8. Make notes : Taking notes helps you better understand your experiences and look at them from a different perspective. 9. Protect your privacy : We guarantee the security and privacy of your data using modern encryption methods and a strict privacy policy. 10. Collaborate with your treating specialist : Use the app in conjunction with your treating specialist allowing them to more effectively adjust therapy based on the data. Turn your smartphone into an emotion tracker and mood diary with Mind Tracker to better cope with difficulties and lead a more mindful emotional life.
1052216403,1000600000639314,MindDoc Your Companion,Medical,2015-11-11,2015-11-11,21.65,2.0,1,0,1,Top mental health app with over 3 000 000 downloads and 4.7 stars out of 26 000 reviews. Developed by clinical psychologists in close collaboration with leading researchers for those who want to learn about emotional well being or who suffer from mild to moderate mental illness including depression anxiety insomnia and eating disorders. MINDDOC ALLOWS YOU TO Log your mental health and mood in real time. Get insights and summaries on your symptoms behaviors and general emotional well being to help you recognize patterns and find the best resources for you. Discover our library of courses and exercises to help you on your journey toward emotional well being. ABOUT MINDDOC MindDoc is a leading monitoring and self management app for promoting emotional well being and coping with such mental illnesses as depression anxiety insomnia and eating disorders. MindDoc can be used by itself for prevention or self help or as a part of treatment with a mental health practitioner. Our questions insights courses and exercises have been developed by clinical psychologists and are aligned with international treatment guidelines for mental disorders. For technical support or other inquiries please send an email to: feedback minddoc.de. IMPORTANT INFORMATION The MindDoc App is a risk class I medical product according to Annex VIII Rule 11 of the MDR REGULATION EU 2017 745 on medical devices Intended Medical Purpose: The MindDoc monitoring and self management application medical device provides continuous long term sign and symptom monitoring of common mental disorders. This protocol is supplemented by courses and exercises. This enables users to recognize patterns in their symptom trajectories which then can be shared with a mental health care provider and used for self management. MindDoc thus provides users orientation regarding the need to consult a mental health care provider by providing an assessment of the general emotional health. A mental health care provider then can include the summary of the protocols in his overall diagnostic and clinical assessment. enables users to self manage symptoms and related problems by providing both transdiagnostic and disorder specific evidence based courses and exercises which help them to recognize understand and cope with signs and symptoms of mental disorders by self initiating behavior change. The application explicitly does not replace the diagnosis by a mental health care provider but can only give orientation on whether to consult a mental health care provider who then can include the results of the medical device in diagnostic processes. The application explicitly does not replace psychotherapy. Please read the regulatory information e.g. warnings and instruction for use as provided on our medical device site: https: minddoc.com medizinprodukt You can find more information about our terms of use here: https: minddoc.com app agb Here you can learn more about our privacy policy: https: minddoc.com datenschutz The monthly and annual MindDoc Plus subscription renews automatically unless turned off in Account Settings at least 24h before the current period ends. Payment is charged to your iTunes account. The unused portion of the free trial is forfeited after purchase.
1644324300,1000800000172590,MindHealth CBT Thought Diary,Health and Fitness,2022-09-24,2022-09-24,57.8,5.0,1,0,1,Our Cognitive Behavioral Therapy CBT app is designed for those seeking to improve their mental health and increase their emotional resilience. It provides the opportunity to practice cognitive behavioral therapy anytime anywhere. The main feature of our app is an automatic thought diary. It allows users to write down their negative and positive thoughts be aware of them and look for ways to process them. Automatic Thought Diary helps users understand how their thoughts affect their mood behavior and emotional state. Working with the automatic thought diary is one of the main tools of cognitive behavioral therapy which helps users to better understand their thoughts and emotions as well as to get rid of psychological problems. The principle of working with the automatic thought diary is that the user keeps notes about his thoughts and feelings in certain situations that cause him discomfort or stress. By writing down their thoughts the user learns to recognize automatic and negative thoughts that cause them depression anxiety or other problems. As a result of working with the automatic thoughts diary the user will learn to recognize and change his her automatic thoughts which will help him her overcome psychological problems such as depression anxiety low self esteem and others. In addition working with the automatic thoughts diary helps users to become more conscious and emotionally stable which in turn improves their quality of life and allows them to better manage their emotions. An additional feature of our app are psychological tests. They allow users to gain a deeper understanding of their emotions thoughts and behavior. After taking the tests users receive individualized feedback and advice on managing their emotions and thoughts. The following psychological tests are currently available: 1. depression test is a psychological test that helps to assess the presence and degree of depressive symptoms in the user. The test consists of several questions that deal with aspects such as mood energy sleep appetite and interest in life. The results of the test help to determine how serious the user s mood and ability to enjoy life is as well as to identify the presence of symptoms of depression. 2. Anxiety test is a psychological test that helps to assess the user s level of anxiety. The test consists of several questions that deal with aspects such as anxiety tension fear and nervousness. The results of the test allow you to determine how much anxiety the user has and identify the presence of symptoms of anxiety. 3. An eating disorder test is a psychological test that helps determine the presence and extent of an eating disorder in a user. The test consists of several questions that deal with aspects such as eating behavior feelings of hunger and satiety desire to control one s weight and eating large quantities of food. The results of the test determine how serious the user s eating behavior problems are and identify the presence of eating disorder symptoms. Psychology articles are also available in the app to help users better understand the principles of cognitive behavioral therapy and apply them to everyday life. The articles include specific tips and exercises that can be used to overcome negative thoughts and emotions. Note: This app is intended for informational purposes and is not a substitute for professional medical advice diagnosis or treatment. Before making any medical decisions or if you have any questions about your health we strongly recommend that you seek the advice of a qualified physician. Do not ignore professional medical advice or delay seeking help because of information obtained through this app. Use of this application is governed by Apple s standard license agreement available at https: www.apple.com legal internet services itunes dev stdeula .
1505964697,0,Mindlist To Do List Tasks,Productivity,2020-04-12,2020-04-12,35.39,13.0,0,0,1,Manage your day with Mindlist a minimalist to do list planner and organizer for everyone! You can use our app for managing your daily checklists and tasks such as homework schedule or even chores. Mindlist is a very versatile user friendly planner scheduler that everyone can immediately use. It s so simple and yet very powerful. There is no need to spend so much time learning to use complicated task management software for your daily life. Just use Mindlist and be more productive! FEATURES OF MINDLIST: NO ADS! No distraction or intrusion from ads when you use Mindlist. We want you to focus on managing your tasks and schedule. REMINDERS: Mindlist helps remind you of your upcoming appointments meetings deadlines or things to do. Please allow Notification so we can end you reminders for things you need to do. CALENDAR: visualize your work or schedule with our calendar. Plan your daily life starting from the moment you wake until you go to bed easily. CUSTOMIZE YOUR TASK LIST: customize icon color icon shapes enable disable hiding completed tasks and highlight overdue tasks. SIMPLE FAST: our app is minimalist so it s very easy to see where everything is and also very intuitive. To add tasks just tap Add new tasks then Edit to add the name of the task set in on your calendar activate reminder and set if it s a repeating task. DARK NIGHT MODE: Automatically change to dark mode at night time for better visibility. ORGANIZE LISTS: Simply drag and move the list to organize them. Although our app is FREE to use we have Premium features you can unlock with very low cost less than a cost of a latte. If you enjoy using Mindlist please consider getting our Premium version. You only need to unlock it ONCE and you can use all premium features forever. Thank you for supporting Mindlist. Please support Mindlist by leaving a supportive rating and review and share it to your friends and family.
1601025363,0,MindMix Social Journal,Health and Fitness,2022-01-05,2022-01-05,61.89,1.0,0,0,1,Mindmix is a simple but powerful tool for developing mindfulness and self awareness. The Mindmix app helps you build a simple practice of checking in with your feelings and intentions. Just a couple of taps a day can help grow your self awareness and reduce stress. Try it for yourself it s totally free.
634684825,1000600000713315,MindShift CBT Anxiety Relief,Health and Fitness,2013-06-06,2013-06-06,265.83,2.0,1,0,0,Manage your anxiety relax be mindful Break free from anxiety and stress using this free evidence based anxiety management app. MindShift CBT uses scientifically proven strategies based on cognitive behavioral therapy CBT . MindShift CBT is a free self help anxiety relief app that helps you reduce worry stress and panic by following evidence based strategies. Using CBT tools you can challenge negativity learn more about anxiety develop more effective ways of thinking be mindful and relax. If you are looking for anxiety stress and panic relief you have come to the right place. Download MindShift CBT for free on your iOS device learn more about anxiety practice cognitive behavioral therapy and reduce the amount of worry panic social anxiety and discomfort from phobias that you experience. The go to app for anxiety management MindShift CBT the free anxiety relief app comes with a clean and user friendly design that allows you to learn and practice CBT strategies in an easy and intuitive way. We have specifically designed the app to be your free and portable go to tool for anxiety management. Learn about the different CBT strategies including writing thought journals challenging yourself with belief experiments building fear ladders and doing comfort zone challenges. Listen to calming audio to reframe your thoughts practice mindfulness and stay grounded. Participate in the MindShift CBT Community Forum: share stories learn about others experiences and provide peer advice in a safe environment. All the exercises are presented in small chunks with plenty of supporting information to help you naturally integrate these strategies with the rest of your life. MindShift CBT includes additional features that help keep you on track. Stay accountable and track your progress with the check in feature which allows you to record and view graphs and journal entries. You can set goals for yourself and get reminders. If you choose to you can easily export and share your data via email to streamline sessions with any therapists counsellors or psychologists you may be working with. MindShift CBT is completely free so give it a try and explore the features for yourself! MindShift CBT is packed with loads of evidence based and trusted features to help you with anxiety management. With this app we hope that you will be better equipped to manage anxiety find relief from panic attacks overcome your fears and hopefully ease your own mind. MindShift CBT main features: Clean welcoming and user friendly intuitive design Evidence based strategies and tools based on Cognitive Behavioral Therapy CBT designed for anxiety relief and self management Daily check in to keep track of your anxiety level and mood Easy to follow guides on learning about anxiety Facts and tips to overcome general worry social anxiety perfectionism panic attack and phobias Goal setting tools to keep you accountable Coping cards and statements to help you ride out your anxiety and the ability to add your own! Guided relaxation and mindfulness meditations to ground you and give relief Belief experiments to challenge the beliefs that fuel anxiety Tips and tricks for incorporating healthy habits into your life and minimizing anxiety naturally Sharing and data exporting if you choose to streamline sessions with your counsellor therapist or psychologist Community Forum to share your stories and provide peer advice in a safe environment Download MindShift CBT on your iPhone or iPad now and get ready to take charge of your mental health and find anxiety relief. Learn to be more mindful incorporate CBT techniques in your daily life and stay accountable and motivated on your anxiety management journey. Stay tuned for more updates and let us know about any bugs questions feature requests or any other suggestions. We are always looking to improve the app and we appreciate all your feedback!
