app_id,unified_app_id,app_name,app_category,worldwide_release,initial_release,app_size,app_lang,multihoming,paid,in_app_purchases,app_version,app_version_date,release_note
1352706240,0,Italian Keyboard Translator,Utilities,2018-02-26,2018-02-26,38.0,1,0,0,1,1.4.1,2023-09-06,GDPR General Data Protection Regulation consent is added.
1352706240,0,Italian Keyboard Translator,Utilities,2018-02-26,2018-02-26,38.0,1,0,0,1,1.4,2023-02-07,Save your past translations record in history. And Remove ads option is added.
1352706240,0,Italian Keyboard Translator,Utilities,2018-02-26,2018-02-26,38.0,1,0,0,1,1.3,2021-04-27,Keyboard extension is added and performance is improved.
1352706240,0,Italian Keyboard Translator,Utilities,2018-02-26,2018-02-26,38.0,1,0,0,1,1.2,2019-03-04,Improved translator performance.
1352706240,0,Italian Keyboard Translator,Utilities,2018-02-26,2018-02-26,38.0,1,0,0,1,1.1,2018-05-08,Full screen advertisement removed from Translator page.
1352706240,0,Italian Keyboard Translator,Utilities,2018-02-26,2018-02-26,38.0,1,0,0,1,1.0,2018-02-26,
