"application_id","title","description"
"1083758354","Little Fox Chinese","With Little Fox Chinese, anyone can learn the Chinese language in a fun and engaging way with our animated stories and songs!There’s a story for everyone—starting from the basics of Chinese to stories with more challenging topics!You can now start practicing your listening, reading, speaking, and writing skills with our fun, animated stories!Features of Little Fox Chinese:- Readers can enjoy a wide variety of stories. Fiction stories include fantasy, adventure, and everyday life and situations like family, friendship, and school. Nonfiction stories cover topics such as science, nature, history, and biography.- A new story or song is published every day from on Monday to Friday.- Readers can listen to the stories and songs without subtitles to practice listening skills. They can also read the stories and songs with subtitles to practice reading skills.Subscription Benefits:- Subscribers have full access to all of our content.- Each story has a quiz to check comprehension.- A text translation is available for each story and song. - Subscribers have a Learning Log, which helps to track their progress.- Enjoy learning without interruptions by using the screen lock feature. Subscription Details:- A 1-month subscription is $4.99. The subscription will expire one month after the date of payment.- The auto-renewal monthly subscription is $3.99. Monthly subscriptions are automatically renewed each month.About the Auto-Renewal Subscription:• Listed prices include VAT.• Discounted prices may change when a promotion ends.• Automatic recurring payments may be canceled upon changes of personal or credit card information, lack of funds, etc.• App Store purchases are made through your iTunes account.• For App Store purchases of a 1-month recurring subscription, automatic recurring payments are scheduled each month on the same date of the initial purchase (e.g., if the initial payment is made on the 1st of the month, the next payment will be scheduled for the 1st of the next month).• To cancel automatic recurring payments, cancelations must be made at least 24 hours before the date of the next scheduled payment.• Automatic recurring payments will be made within 24 hours of the scheduled payment date.• The automatic recurring payment date, service start date, and expiration date may vary due to service hours, restore-purchases requests, time difference, etc.• Automatic recurring payments may be canceled at any time during the service period prior to 24 hours before the date of the next scheduled payment. Cancelations will not affect the current subscription period and all service and features will be available until the scheduled service period expiration.• Automatic recurring payments may be cancelled through your App Store iTunes account (Account > Subscriptions).For more information, please refer to our Terms of Service or Privacy Policy.Terms of Service:http://chinese.littlefox.com/en/service/accesstermsPrivacy Policy:http://chinese.littlefox.com/en/service/privacyContact Uschinese.help@littlefox.com[App Access Permissions Notice]* Required Access Permissions The following permissions in the stated areas are required to use this app.- Storage: to store content thumbnails temporarily- Device/App history: to maximize services and check errors"
"845139175","Scan & Translate+ Text Grabber","Download NOW the BEST Scan and Translate app in the WORLD and instantly translate business documents, contracts, homework assignments, menus, street signs and other images. GET MORE than 90 different languages which are available for translation!Scan & Translate app extracts texts from any printed sources: documents, books, signs, instructions or announcements and allows to immediately translate them to any of 90 languages. Take a picture of the text and after the text is recognized, you can immediately edit, hear, translate, share it on Facebook, Twitter, vKontakte or simply send by email or as SMS.Better and faster than any other similar product!70% cheaper than any other similar app, offered by competitors!• Recognizes texts in more than 70 languages• Translates to more than 90 languages• Reads texts in more than 44 languages• Advanced optical character recognition technology for 79 languages, including Russian, English, German, Spanish, Greek, Turkish, Chinese, Korean, Japanese, Portuguese, French ( Internet connection is required)• Full text translation for more than 90 languages (Internet connection is required)• Listen to the text that has been recognized and translated into more than 44 languages!• Edit the text, copy it to clipboard, and save in other apps• Share the text on Facebook, Twitter, VKontakte or send as SMS or by email• All texts are saved in History and can be later recovered at any timeWith Scan & Translate app you can easily scan and translate:• any paper documents• recipes from cookbooks• notes and letters• menus in restaurants, bars, and cafes• articles from magazines and newspapers• book parts• instructions and manuals• texts on product labels• road signs as well as signs in airports and stations• and many more...How to use the app:• Select the language of the original text as text recognition language.• Take a picture of the document (page, instruction, or any other text)• Press the ""Scan"" button• Recognized text will appear on the screen with an option to select the source language and the target (translation) language.• After you select the language, the original text will be automatically translated and will appear at the bottom of the screen.• To listen to the translation, press the ""Voice"" buttonScan & Translate app will digitize and translate any printed text right on your device!*Note: The Free version may be subject to limitations (ex. number of daily translations), which are subject to change***Take advantage of the Premium Features:- Unlimited translations- Ads-free translation experienceFor complete access to Scan & Translate and all language change features, you will need to allow access to the following: *Camera *Photos Note: The Free version may be subject to limitations (ex. number of daily text recognitions and translations), which are subject to change Сhoose from different subscription options. Our standard subscription options are: 1-month Subscription 1-year Subscription Subscription plans unlock: - Unlimited translations - Unlimited text recognitions - Offline Text Recognition- Offline translations - Ads-free translation experience - Snap Mode You can cancel a free trial or subscription anytime by canceling your subscription through your iTunes account settings. This must be done 24 hours before the end of a free trial or subscription period to avoid being charged. The cancellation will take effect the day after the last day of the current subscription period, and you will be downgraded to the free service. Please note: any unused portion of a free trial period (if offered) will be forfeited when you purchase a premium subscription during the free trial period.EULA: https://datacomprojects.com/api/Eula?bid=com.translatoria.scanandtranslatefreePrivacy Policy: https://datacomprojects.com/api/PrivacyPolicy?bid=com.translatoria.scanandtranslatefree"
"1435571925","Fast Scan:PDF Doucment Scan","The Fast Scan is the most satisfying scanner app you've ever seen.Who says the scanner app must be boring? Scanner can help you better manage your work and life in a more fun way. Not only can you quickly process files, set up work reminders, but you can also discover new worlds by scanning around things and identifying objects, and you can use the Fast Scan for entertainment when you are free.▷ Powerful AI Recognition FunctionWhen you see an unknown object/animal/plant at work or in life, is it annoying that no one can tell you what it is? What is its name? how to use?Now you can use AI Scanner to see what it is anytime, anywhere!Features:• Supports the identification of common objects, plants, animals, fruits and vegetables.• Real-time output recognition results• Support multi-language translation and voice readingCome and discover the interesting things around you!▷Powerful document scan & ID scan functionPrinting important documents is cumbersome and easy to lose. Especially for those working in the office, the types of documents are complex and many, and keeping them is a headache. Now, you can use the scanner to easily convert it into an electronic document. Just align the document with a single tap, and it will automatically correct and trim the edges for you, and it will be retained in electronic format.At this point, Fast Scan -- the portable scanner is your best choice! It can automatically edit and output clear images or documents by simply clicking on the capture button, which helps you save 90% of the time compared to a large scanner.▷Text translationWhen traveling abroad, I always want to bring some local specialties to my relatives and friends, but when I arrive at the supermarket, I feel embarrassed because I don't know the local language.It will be more convenient if accompanied by a local translator.But now,i don't need to worry, The Fast Scan's translation feature allows me to translate everything in real time.Language barriers no longer exist.Text translation allows me to know the world events better while browsing the news.▷ Fast Scan has the following subscriptions:Weekly subscription: 3 days free trial, then $1.99/week, auto-renewingMonthly Subscription: 3 days free trial, then $4.99/month,auto-renewingYearly Subscription: 3 days free trial, then $29.99/year,auto-renewingPayment will be deducted from your iTunes account upon confirmation of purchase.Subscriptions will automatically renew unless auto-renew is turned off at least 24 hours before the end of the current subscription period.Your account will be charged with the subscription renewal fee within 24 hours prior to the end of the current subscription period at the rate confirmed by you.Subscriptions may be managed by the user and auto-renewal may be turned off by going to the user's Account Settings.Terms of Use : https://sites.google.com/view/scannerios-users-enPrivacy Policy: https://sites.google.com/view/scannerios-policy-enWe would love to hear your feedback! Please provide us with your feedback and suggestions. We will improve the app based on your comments and provide you with a better experience with using our app.Our Email:sscannerdev@gmail.com"
"1446862649","Speak Worldwide - Translator","Better and faster than any other similar product!• Advanced optical character recognition technology for 79 languages. (Internet connection is required)• Full text translation for more than 90 languages (Internet connection is required)• Listen to the text that has been recognized and translated.• Share the text on Facebook, social network.• All texts are saved in History and can be later recovered at any time.How to use Speak Worldwide:• Select the language of the original text as text recognition language.• Take a picture of the text• Press the ""Scan"" button• Recognized text will appear on the screen with an option to select the source language and the target (translation) language.• After you select the language, the original text will be automatically translated.Speak Premium subscription info:Subscribing to the automatic update will give you the opportunity to use our application to the full and be content with the translator:- Without advertising- Unlimited transfers- Update new phrases distributed- All languages of the world* Name of our services:- Speak Premium 1- Speak Premium 2* Length and price of subscription:- for “Speak Premium 1” for the first 3 days you get a free trial period, then the subscription duration is a week, and the price is $ 3.99 a week.- The duration of “Speak Premium 2” is 12 months, and the price is 59.99 dollars for 12 months* Payment will be charged to your iTunes account upon confirmation of purchase.* Any unused portion of the free trial period, if offered, will be confiscated when the user purchases a subscription to this publication, where applicable.* Subscription automatically renews unless auto-renew is turned off at least 24 hours before the end of the current period.* Accounts will be charged for renewal within 24 hours until the end of the current period and determine the cost of renewal.* Subscriptions can be managed by the user, and auto-renewal can be disabled by going to the user account settings after purchase* You can cancel your subscription through this URL:https://support.apple.com/en-us/HT202039* Privacy policy: http://speakworldwide.applicationforios.me/privacy.html* Term of use: http://speakworldwide.applicationforios.me/terms.html"
"1253329267","Interpreter Voice Translator","Traveling abroad? Worried about the local language? Voice translator Instant will speak for you! And speak out loud! So, You can call it as itranslator. With Interpreter: Instant Voice & Text Translator you can:• Instantly speak 57 languages• No typing required. The accuracy of our voice recognition is so amazing that you don't need your keyboard anymore.• Look up definitions and translations for common words & phrases, just using your voice.• Simply send your translations via Email, SMS, Twitter, Skype or Facebook, etc.• Now you have your translation history.• You can add to favorite any translation or conversation • Now you can translate text from image using OCR with high accuracy.Forget about language barriers when traveling abroad, voice translation became so easy! You use this app for text to text translation & speech to speech with Speech to text & Text to speech.Translate it Voice translator allows you to instantly speak and translate by double-clicking the power button of your device. Translate it allows you to choose from any 29 supported languages and double click the power button from anywhere (Yes, anywhere) and speak. It’s the pocket voice translator you have been waiting for. It doesn't matter if you travel or just want to learn a language, voice translations have never been easier and quicker. You just need to tap on the mic button and start speaking it will show your words on the screen.This is by far the simplest and the fastest voice translation app. Just download and enjoy. it will make your life abroad easy and fun. Additionally, it includes a conversation mode for managing full conversations with ease.Supported languages (voice recognition and text to speech): Arabic, Cantonese, Catalan, Chinese (Mandarin), Czech, Danish, Dutch, English, Finnish, French, German, Greek, Hebrew, Hungarian, Indian, Indonesian, Italian, Japanese, Korean, Norwegian, Polish, Portuguese, Romanian, Russian, Slovakian, Spanish, Swedish, Thai, Turkish etc--------------------------------------------With Interpreter's OCR translation, you can easily scan and translate:• any paper documents• recipes from cookbooks• notes and letters• menus in restaurants, bars, and cafes• articles from magazines and newspapers• book parts• instructions and manuals• texts on product labels• and many more...--------------------------------------------Auto-Renewable Subscription Terms:- A monthly subscription for $2.99 USD.- $2.99 USD will be charged for ad' removal for a monthThe price corresponds to the same price segment, which is set in the ""Apple's App Store Matrix"" for other currencies.*Your subscription will automatically renew a paid subscription unless auto-renew is turned off at least 24 hours before the end of the period. * You can cancel the subscription anytime by turning off auto-renewal through your iTunes account settings. This must be done 24 hours before the end of the subscription period to avoid being charged. The cancellation will take effect the day after the last day of the current subscription period, and you will be downgraded to the free service.Terms of Service: http://hexalab.in/interpreter/Terms.htmlPrivacy Policy: http://hexalab.in/interpreter/Privacy.htmlNote: This application works with the internet. Please, make sure you have an internet connection before using it. Thanks"
"516762182","German Dic Pro","Ultimate German-Persian Talking DictionarySuper Fast and PowerfulGerman - Persian (Farsi) Persian - German *Listen and Learn to speak in German words  with pronunciations *German - Persian , Persian- German Text translation* Text To Speech Support * Easy to use * Including over 200,000 words. * Examples* Intelligent relative words navigation * Designed for iPhone 5, 6, 7, X, Xs* Designed for iPad, iPod Touch* Optimized for Retina Display * Landscape & Portrait view mode support * Intelligent translation without need to set input language * Presents ""Word of A Day"" feature to help you memorize new words* Night Mode"
"1054842874","Xliff Editor","Xliff Editor - its fast to load, easy to use, and has a low memory footprint. Did we forget to mention Inline tag protection, Search & Replace, Regex search, Fuzzy search, intuitive shortcuts, multiple concurrent file editing and native spell checker. It also has some pretty nice customizations you can use to better suit your workflow.Not all Xliff editors have been created equally. We've custom built our own XML parser to read even the most complex Xliff v1.2 files. Xliff Editor effortlessly handles Segmentation, Inline tags and Alternate translations.*Whats an XLIFF file?An xliff file is a standardized file format based on XML, used to represent localization data. In its simplest form the original(source) string is stored as well as its translated(target) complement. Xliff files enable localization to be much more user friendly, and less error prone than manual translation. Xliff files can be identified by the extensions .xliff or .xlf. SDL Trados (.sdlxliff) also uses the xliff format, but includes some extra proprietry data.*Why XLIFF?Xcode 6 introduced the ability to export/import all your localisation data, taking away the need for sending various file formats to your localisers for translating. The XLIFF format makes translating a cinch, as it removes all the layout and formatting, and just provides a simple text-to-text translation mechanism for your translators.*Xliff Editor Features:-Search & Replace-Highlighted search-Fuzzy search-Spell checker-Easy recognition of un-translated strings-XLIFF, XLF, XLOC, XLZ file support-SDLXIFF read support with export to XLIFF-Support for alt-trans and seg-source nodes-inline tag protection-Support for editing Multiple files simultaneously-Support for opening files in tabs-Beautiful interface**Currently only XLIFF v1.2 files are supported."
"346996985","遠流字典通","【遠流字典通】產品特色 :  1.英漢(繁體中文)字典,包含26萬筆英漢詞條與25萬筆漢英索引,提供英漢/漢英雙向查詢。  2.完整內容解說,包含KK音標/解釋/例句/同義/反義/衍生/變化...等詞義。 3.六萬多個參考例句。 4.收錄常用動詞時態變化、名詞複數變化、形容詞/副詞之比較級與最高級變化。 5.針對最常用的1萬5千字，標示使用頻度，5顆星代表最常用，4顆星次之，依此類推 6.即時查詢,即時呈現查詢結果,鄰近字自動顯示。 7.書籤功能,建立自己的生字筆記,便於複習。 8.查詢記錄瀏覽,開啟過去查詢的資料。 9.整合In-app Purchase機制,可以在軟體內透過App Store購買升級版,取得全文翻譯與發音的功能。 10.支援iOS4多工,在iOS4以上的系統,程式可以在背景執行,以便下次可以快速啓動。如要購買升級版,請依下列步驟: (1)執行字典通,進入目錄頁面。 (2)確定在網路連線狀態下,點選""升級去""按鍵。 (3)畫面會出現是否確認購買的對話框。 (4)點選""購買""按鍵。 (5)稍微等待後,系統會帶出App Store購買畫面,如果系統詢問登入帳號的選單,請選擇""使用現有帳號"",接著再輸入您的iTunes帳號密碼。 (6)稍微等待後,如果購買成功,會出現完成升級的對話框。字典內容授權人:遠流/智慧藏軟體開發與發行:曉騰國際Features:1. English-Chinese(Traditional) dictionary, including more than 260,000 entries and 250,000 Chinese to English indexing entries. 2. Contains complete explanation of content, including vocabulary explanation,phonetic notation,synonym,antonym,derivative words and variation of words.3. Over 60,000 example sentences.4. Responsive query for each input character.5. Support bookmarks.6. Support browsing history.  7. Support in-app purchase mechanism to upgrade the software to enable the full text translation and the natural-sounding TTS features."
"804641004","Speak & Translate - Translator","Speak & Translate is an essential voice and text translator that allows you to communicate effectively anywhere in the world. Have you ever traveled abroad and struggled with language barriers? Worry no more! With Speak & Translate you'll be able to text and speak in over 100 languages - even in remote areas without data or wifi with our offline mode! And if you're in a restaurant, just use our Snap Mode to easily translate the whole menu with your phone's camera! It's that easy to act fluent in another language!FREE FEATURES:• Text Translation: Want to know a word, sentence or longer phrase in a different language? Simply type in the text and get the instant translation to 117 languages!• Voice Translation: Translate any spoken word or phrase into 54 languages!• Voice settings: choose male or female voice and its speed • Language Detection: Don't know the language of the source text? Let our app automatically detect and translate it for you!• iCloud integration: Your translation history gets automatically synchronized across all your Apple devices!• Color Themes: Easily change the color theme of the app's UI to match it to your style!PREMIUM FEATURES:• Snap Mode: Just snap a picture of any text or object you want translated!• Offline Mode: Avoid expensive roaming costs and translate offline!• Unlimited Translations: Get as many text and voice translations as you need!• No Ads: Use our app completely ad-free!Supported languages & dialects for translation:Afrikaans, Albanian, Amharic, Arabic, Armenian, Azerbaijani, Bashkir, Basque, Belarusian, Bengali, Bosnian, Bulgarian, Catalan, Cebuano, Chichewa, Traditional Chinese (Cantonese), Simplified Chinese (Mandarin), and Traditional Chinese (Mandarin), Corsican, Croatian, Czech, Danish, Dutch, English, Esperanto, Estonian, Filipino, Finnish, French, Friesian, Galician, Georgian, German, Greek, Gujarati, Haitian Creole, Hausa, Hebrew, Hindi, Hmong, Hungarian, Icelandic, Igbo, Indonesian, Irish, Italian, Japanese, Javanese, Kannada, Kazakh, Khmer, Korean, Lao, Latin, Latvian, Lithuanian, Macedonian, Malagasy, Malay, Malayalam, Maltese, Maori, Marathi, Moldavian, Mongolian, Myanmar (Burmese), Nepali, Norwegian, Pashto, Persian, Polish, Portuguese, Punjabi, Querétaro Otomi, Romanian, Russian, Samoan, Scottish Gaelic, Serbian, Sesotho, Shona, Sindhi, Sinhala, Slovak, Slovenian, Somali, Spanish, Sundanese, Swahili, Swedish, Tajik, Tamil, Tatar, Telugu, Thai, Turkish, Udmurt, Ukrainian, Urdu, Uzbek, Vietnamese, Welsh, Xhosa, Yiddish, Yoruba, Yucatec Maya, ZuluChoose from different subscription options:• 1-month Subscription• 1-year Subscription  ---Auto Renewable Subscription Terms:Subscriptions are billed monthly or annually at the rate selected depending on the subscription plan.The price corresponds to the same price segment, which are set in the ""Apple's App Store Matrix"" for other currencies.• Your free trial subscription will automatically renew to a paid subscription unless auto-renew is turned off at least 24 hours before the end of the free trial period. • Please note: any unused portion of a free trial period (if offered) will be forfeited when you purchase a premium subscription during the free trial period.• You can cancel a free trial or subscription anytime by turning off auto-renewal through your iTunes account settings. This must be done 24 hours before the end of a free trial or subscription period to avoid being charged. The cancellation will take effect the day after the last day of the current subscription period, and you will be downgraded to the free service.• Account will be charged for renewal within 24-hours prior to the end of the current period, and identify the cost of the renewal.Terms of Service:http://www.apalon.com/terms_of_use.htmlPrivacy Policy: http://apalon.com/privacy_policy.htmlAn internet connection is required to use the app. To use the offline mode, you need to download language packs."
