"application_id","title","description"
"1140777557","Newport Beach Tourism Guide","NEWPORT BEACH TOURISM GUIDE with attractions, museums, restaurants, bars, hotels, theaters and shops with, pictures, rich travel info, prices and opening hours. Discover what's on and places to visit in Newport Beach with our new cool app. Your guide to top attractions, shopping malls / locations, finding hotels, directions to hotels & Bars, Restaurants. An all-in-one app for all the local attractions. Our travel guide to Newport Beach, featuring up-to-date information on attractions, hotels, restaurants, shopping, nightlife, travel tips and more. Highlights : ◆ Newport Beach Info - Overview, Climate, Geography, History and Travel Information. ◆ Attractions - Ancient Sites, Beaches, Botanical Gardens, Coffee Farms, Museums, Scenic Drives, Towns, Waterfalls, Religious and Historical Sites Etc. ◆ Hotels - From Luxury Hotels to Budget Accommodations. Reviews, Price comparison, Gallery, Map, Search, Amenities, Address and more. ◆ Map - It is an interactive map and get turn by turn driving directions. Find traffic details, road conditions, street maps, Multi map, satellite photos, and aerial maps. Allow you to easily search and find local businesses with directions. ◆ Gallery - Picture galleries of Newport Beach's most beautiful sights, interesting events, unusual occasions and more.◆ POI Search - Search everything at Newport Beach. Airport, ATM, Bank, Bars, Beauty Salon, Bus Station, Cafe, Campground, Car Wash, Department Store, Doctor, Fire Station, Food, Gas Station, Hospital, Library,Lodging, Mosque, Movies, Museum, Park, Parking, Pharmacy, Pizza, Police, Shopping, Stadium, Taxi, Train Station, Travel Agency, University, Zoo. or Enter any keyword or name to search Find Name, address, distance, route map, call, directions to every business location. Sharing option available. ◆ Translator - Supports 52 languages, Large text Translation. ◆ World Clock - All major cities of the world (1000 Cities)."
"1479522315","ABCTrans","An app that supports multi-language conversation through speech translation with easy playback of recent translations.Text translations are also supported. You can also do real time note taking via voice and manage your voice notes later."
"1100597178","My Personal Secretary 2 – Live Text Translator","*** 50% OFF for limited time ***• A compact and easy to use live voice and text translator •My Personal Secretary 2 is a powerful and energetic app that will help to break down language boundaries. It is fun and easy way to translate your voice, and read aloud the translate results. This app is extremely smart; you can crack your language barrier by using it while traveling, communicating, social networking, studying, and many more places. You can learn languages quickly and easily, speak your language to translate written or spoken of in the language of your choice. Now you can instantly translate to and from 38+ different languages whenever you want. Simply select the source language and the language into which you want to translate, tap of the flag wait for the signal and start speaking. In the box below the text, the translation will be displayed and automatically speak as per the voice available. You can edit translation text by tapping on edit button. You can copy translation text to any other application, email, SMS, Whatsapp, Facebook or Twitter. ===== App Features =====• Advanced and accurate speech recognition technology• Translate words, phrases, and text between 38+ languages• Auto detect end of speech option • Recording start and end confirmation sound• Options for auto speak and shake to speak• See instant text translations• Text To Speech Conversion (Speech Synthesis)• Two-way automatic speech translation• Both voice and keyboard typing translation supported• Adjust the speed of the voice• Beautifully designed user interface• Fast language switcher support • Compatible with both iPhone and iPad• Required network connection (WiFi, 3G, 4G or LTE) to access the translation server• Simply share translation via email, SMS, Facebook, Twitter, and other apps• Copying text and use it with any other applicationSupported languages:Arabic, Arabic (Egypt), Arabic (Saudi Arabia), Arabic (International), Catalan, Czech, Danish, Dutch, English (Australia), English (GB), English (US), English (India), English (Ireland), English (South Africa), English (Scotland), Finnish,French (Canada), French (France), German, Greek, Hebrew, Hindi, Hungarian, Italian, Japanese, Korean, Norwegian, Polish, Portuguese (Brazil), Portuguese (Portugal), Romanian, Russian, Slovak, Spanish (Castilian), Spanish (Spain), Swedish, Thai, Turkish, Croatian, Malay, Spanish (LatAm), Ukrainian, Vietnamese."
"1021277663","Instant Translator Pro","Do you want to communicate with people who do not speak your language? With ""Instant Translator"", you can communicate in over 100 languages!Speak to the app in one language and instantly hear your words translated to another. Features------------Instantly Speak Another LanguageSpeak to the app to get your words instantly translated to another language.-User-friendly Text ModeType or copy text from emails, messages etc to get them instantly translated to more than 90 languages.-Speaks Out TranslationsWith the auto speak option the app will instantly speak out translations. You can also listen to translations by shaking the device or tapping the play button.-Supports Over 100 LanguagesSupports 112 languages for text-to-text translation, 37 languages for speech-to-speech translation and 41 languages for text-to-speech translation-Sharing OptionsShare translations via email,messages and social media-Communicate Using Two DevicesConnect devices using bluetooth or wifi and have a voice or text conversation.Speech to Speech Translations are supported between the following languages:Arabic(Egypt), Arabic(Saudi Arabia), Arabic (UAE), Catalan, Chinese(China), Chinese(Taiwan). Czech, Danish, Dutch, English(Australia),English(UK), English(US), English(India), Finnish, French(Canada), French (France),German, Greek, Hebrew, Hindi, Hungarian, Indonesian, Italian, Japanese, Korean, Norwegian, Polish, Portuguese (Brazil), Portuguese(Portugal), Romanian, Russian, Slovak, Spanish(Spain), Spanish(Mexico), Swedish, Thai,TurkishText to Text Translations are supported between the following languages:Afrikaans,Albanian,Amharic, Arabic(Egypt), Arabic(Saudi Arabia), Arabic (UAE), Armenian, Azerbaijani, Basque, Bengali, Belarusian,  Bosnian, Bulgarian, Burmese, Catalan, Cebuano, Chinese(China), Chinese(Taiwan), Corsican, Croatian, Czech, Danish, Dutch,English(Australia),English(UK), English(US), English(India), Esperanto, Estonian, Filipino, Finnish, French(Canada), French(Franch), Galician, Georgian, German, Greek, Gujarati, Haitian, Hausa, Hawaiian, Hebrew, Hindi, Hmong, Hungarian, Icelandic, Igbo,Indonesian, Irish, Italian, Japanese, Javanese, Kannada, Kazakh, Khmer, Korean,Kurdish, Kyrgyz, Lao, Latin, Latvian, Lithuanian,Luxembourgish, Macedonian, Malagasy, Malay, Malayalam, Maltese, Maori, Marathi, Mongolian,Nepali, Norwegian,Nyanja, Pashto, Persian, Polish, Portuguese (Brazil), Portuguese(Protugal), Punjabi, Romanian, Russian,Samoan, Scottish Gaelic,  Serbian, Shona, Sindhi, Sinhala, Slovak, Slovenian, Somali, Southern Sotho,  Spanish(Spain), Spanish(Mexico), Sundanese, Swahili, Swedish, Tajik, Tamil, Telugu, Thai,Turkish, Ukrainian, Urdu, Uzbek, Vietnamese, Welsh, Western Frisian, Xhosa, Yiddish, Yoruba, ZuluIf you like ""Instant Translator Pro"" please consider leaving a review as it would help us a lot . Thanks a lot for your support.What our users say-------------------Good tool - byChris_Jeph666I downloaded this app because of a friend in Indonesia. And using it while chatting with her is just amazing. We communicate better. I found it easy to use and it has a audio option which is pretty good. It's a really nice app-Great translator -byJax097 Awesome app with so many languages to translate. So helpful for communicating when abroad or with friends from abroad!-Recommended -byRachel SidneyVery useful app. Smart and quick. Like it!-Super! -byC.rocha1962 Accurate and easy to manage. 5 Stars!- Great app design - bynobita71 Thank you developers-Love the app. My friends are amazed at the ease of operation and the accuracy of the translation. -Leslie-App is fantastic, works a charm. -Vedic Rap -This is awesome! -Amy-Voice recognition is good and generally speaking the translations are considering the price of the app  very good. -RichardWe also have a FREE version http://bit.ly/instant_translator"
"1141674224","Từ Điển Anh Việt - VDict","Từ Điển Anh Việt - VDict phát âm chuẩn, sử dụng OFFLINE, có chức năng dịch văn bản hàng đầu Việt Nam, dịch sang tiếng Anh hoặc tiếng Việt đều được.Hệ thống từ điển được đội ngũ Từ Điển Việt tổng hợp, sưu tầm qua nhiều năm để đưa đến tay các bạn bộ từ điển chuẩn và tốt nhất với rất nhiều tính năng hay:* Đọc phát âm Tiếng Anh và Tiếng Việt chuẩn nhất hiện nay.* Gần 1 triệu từ Anh - Việt, Việt - Anh chuẩn nhất.* Dịch câu, dịch từ gợi ý ví dụ để hiểu sâu hơn về câu từ.* Cho phép tìm kiếm chéo các từ với nhau một cách thuận tiện nhất.* Tích hợp hệ thống tìm theo hình ảnh, wikipedia.* Từ đã search, từ được đánh dấu để học lại, từ gần đây.* Hệ thống Game Vip kiểm tra nhanh và luyện nghe cực kỳ hiệu quả.* Hơn 10k từ vựng quan trọng: Oxford, IELTS, TOEIC, TOEFL...* Động từ bất quy tắcMột vài ứng dụng học Tiếng Anh mà bạn nên sử dụng: VDict, Tflat, Elsa Speak, DictBox, Vietnames Dictionary,...Phần mềm được phát triển bởi TuDienViet.vn---Vietnamese English Dictionary - VDict has standard pronunciation, uses OFFLINE, has the leading text translation function in Vietnam, can be translated into English or Vietnamese.The dictionary system has been synthesized and collected by the Vietnamese Dictionary VDict team over the years to bring to you the standard and best dictionaries with many good features:* Read the most standard English and Vietnamese pronunciation today.* Nearly 1 million English - Vietnamese, Vietnamese - English words are the best.* Translate sentences, translate word suggestions for examples to better understand sentences.* Allows searching for words together in the most convenient way.* Integrated search system by image, wikipedia.* Searched word, bookmarked word for re-learning, recent word.* System Game Vip test quickly and practice listening extremely effectively.* More than 10k important vocabulary: Oxford, IELTS, TOEIC, TOEFL ...* Irregular verbsSome products that you learn Chinese should use: VDict, Tflat, Elsa Speak, DictBox, Vietnames Dictionary,...Software developed by TuDienViet.vn"
"1070482174","PROMT Agent","PROMT Agent for corporative solution PROMT Neural Translation Server. For corporate users only!PROMT Agent is a client application for PROMT Neural Translation Server, allowing you to make translations on your smartphone or tablet and featuring:•	Neural Machine Translation•	Text translation•	Website translation•	SMS translation•	Voice typing•	Dictionary with pronunciationIf you don’t have PROMT Neural Translation Server system, you can send a request by filling in a contact form at https://www.promt.com/translation_software/corporate/promt-translation-server-neural/ONE PASSWORD TO ACCESS PROMT FROM ANYWHERETo access PROMT Agent, use the same username and password that you use for PROMT Neural Translation Server on your workplace.You will also need to specify information about the corporate server where PROMT is installed. For this information, please contact the IT department of your company. THE SAME PROMT, MORE COMPACTIn your PROMT Agent you will find the same language pairs and translation profiles as on the PROMT translation server in your company.Main application features: •	Text translator. Text input is possible via keyboard, copying from the clipboard or voice typing.•	Dictionary entries with pronunciation and variants of translation.•	Share button for sending translation to other apps.•	Website translation.•	Translation history. To work with the application, INTERNET IS REQUIRED to connect to PROMT Neural Translation Server.If you enjoy using our PROMT Agent, please rate it and leave a comment in the app store! If you have any questions or suggestions regarding PROMT Agent, please contact us at support@promt.com.For more information visit our website:https://www.promt.com/translation_software/corporate/"
"1478155062","Speak Translator - Translate","TranslationBox eliminates foreign language barriers with the ability to translate more than 100 languages into text and voice. It is an amazing translation application where you can speak to the people you want, in their own language.Speak in your own language with the Chat feature conversations in your own language to understand the other party by face to face.TranslationBox App Features:+ Translate WhatsApp, Skype, Telegram voice records. (First in all translate applications)+ Translate over 100 languages+ Voice chat by face to face+ Speech mode & Text Translation+ Easily access your translation history where you want+ Make your favorite translation list and improve your language    educationSupported Languages for Translation:Afrikaans, Albanian, Amharic, Arabic, Armenian, Azerbaijani, Basque, Belarusian, Bengali, Bosnian, Bulgarian, Catalan ,Cebuano, Chichewa, Chinese (Simplified), Chinese (Traditional), Corsican, Croatian, Czech, Danish, Dutch, English, Esperanto, Estonian, Filipino, Finnish, French, Frisian, Galician, Georgian, German, Greek, Gujarati, Haitian Creole, Hausa, Hawaiian, Hebrew, Hindi, Hmong, Hungarian, Icelandic, Igbo, Indonesian, Irish, Italian, Japanese, Javanese, Kannada, Kazakh, Khmer, Korean, Kurdish(Kurmanji), Kyrgyz, Lao, Latin, Latvian, Lithuanian, Luxembourgish, Macedonian, Malagasy, Malay, Malayalam, Maltese, Maori, Marathi, Mongolian, Myanmar(Burmese), Nepali, Norwegian, Pashto, Persian, Polish, Portuguese, Punjabi, Romanian, Russian, Samoan, Scots Gaelic, Serbian, Sesotho, Shona, Sindhi, Sinhala, Slovak, Slovenian, Somali, Spanish, Sundanese, Swahili, Swedish, Tajik, Tamil, Telugu, Thai, Turkish, Ukrainian, Urdu, Uzbek, Vietnamese, Welsh, Xhosa, Yiddish, Yoruba, ZuluAbout  Subscriptions:After the 3 days trial period, weekly subscription automatically renews for $5.99 per week unless it is canceled at least 24 hours before the end of the trial period. Your Apple ID account will be charged for renewal within 24 hours before the end of the trial period. Monthly subscription automatically renews for $8.99 per month. Payment will be charged to your Apple ID account at the confirmation of purchase. Subscriptions will automatically renew unless canceled within 24-hours before the end of the current period. You can cancel anytime with your iTunes account settings. Any unused portion of a free trial will be forfeited if you purchase a subscription.You can be inform to cancel your subscription by entering the following address: https://support.apple.com/en-us/HT202039Privacy Policy: https://translationbox.esasmobile.com/privacy-policyTerms Of Services: https://translationbox.esasmobile.com/terms-of-service"
"713529205","In 24 Hours Learn Japanese","Our app provides an interactive audiovisual learning experience through scientifically proven, result oriented, tried and tested learning methods. Our app teaches you on what really matters so you can have a meaningful conversation in another language. We don't just use direct translations, our app provides users the right context translations as how native foreign speakers would express themselves in their own language. In addition, we have carefully curated the lessons to include topics which you care about to get you speaking and understanding as quick as possible.Doing business or on holiday in Japan? You can definitely get the best business or holiday if you can understand and speak the Japanese language! Perhaps you are an explorer travelling in Tokyo and found yourself lost in translation? No worries, you can now conquer the language barrier between you and a Japanese speaker with this app. Too busy to enrol on a proper Japanese language course or perhaps it is too expensive? Tell you what, you're not the only one and we now have a solution. This app is designed to work with your active lifestyle at your own pace! With the audio feature of this app, you can always learn while on the go. Whether you are driving, on the bus or train, jogging in the park or perhaps relaxing in bed, just plug in your earphones and start learning! This app gives you the easiest and most hassle free way to learn the Japanese language! Whether you are an academic student, tourist, explorer, adventurer or businessman, this app will make sure you speak Japanese in 24 hours! This app contains thousands of words in phrases to make sure you learn the easiest way! Thanks!________________________________________Learning with our app is for free with all the basic unlocked lessons and features. We do offer lots of helpful learning tools with our Silver Plus and Gold Plus set of features which can be unlocked using gold coins earned within the app or with an auto-renewing yearly subscription to help you learn even quicker while having more fun! If you choose to purchase Gold Plus or Silver Plus, payment will be charged to your iTunes account, and your account will be charged for renewal within 24-hours prior to the end of the current period. Auto-renewal may be turned off at any time by going to your settings in the iTunes Store after purchase. Please know that subscriptions automatically renews unless auto-renew is turned off at least 24-hours before the end of the current period. In addition, subscriptions may be managed by the user by going to the user's Account Settings after purchase. Any unused portion of a free trial period, if offered, wil be forfeited when the user purchases a suscription to that publication, where applicable. Current Silver+ and Gold+ subscription prices are displayed in the app.Terms of Use: http://www.snaconsulting.com.au/applegal/termsofuse.htm"
"715572933","arabdict Dictionary","The free Online dictionary from arabdict - with Text TranslationGet quick and reliable translations - with 6 arabdict Dictionaries and text translation for 6 languages.This Online Translator gives you a translation for all of your search terms.The app includes arabdict dictionaries for Arabic, German, English, French, Italian, Spanish and Turkish.Each dictionary works in both directions.smart searchType in or say your search term. To make your search quicker and more convenient,the system provides suggestions for words and phrases.If the app can‘t find a result in the arabdict dictionaries, the integrated text translation service offers an easy and quick translation alternatives.pronunciationListen to the correct pronunciation of your dictionary translation.favourite listSave your frequently searched or important entries in your favourites - you can use these offline, too.In your search history you can find your most recent searches.With the copy and paste function you can use your translations in other applications.ExamplesLanguage in context and information on language usage help you to find the correct translation."
"1371342290","NEC Translation","■ Use of the Application requires entry of an ID issued by NEC.■ NEC Translation Features　NEC Translation achieves seamless communication with a person who speaks a different language through the use of a high-accuracy translation engine.- Supports audio interpretation and text translation in 11 languages- Register terminology unique to the customer, such as product names (paid option)- Submit conversations and usage statuses via reports (paid option)　Verify a history of the last 30 cases in the application■ Languages Supported by Translation (11 Languages)　*Always includes Japanese.Japanese to English/Chinese (Simplified & Traditional)/Korean/ Indonesian/Thai/Vietnamese/Burmese/French/Spanish　■ Caution- Packet communication fees apply when downloading and updating the NEC Translation application.- Users are responsible for the payment of any communication fees incurred to use the NEC Translation application. Please note heavy communications fees may be charged for roaming services overseas.- Communication may be delayed or connection unstable due to network or server congestion.- NEC Translation functions may not be available for use due to system maintenance.- Languages that can be entered as text for sentences to translate are the languages above supported by the operating system keyboard. If the necessary font is not installed on the terminal, the text may not be displayed correctly."
"1481859221","EveryQuote: Quote Collector","ADD, CATEGORIZE, & SHARE QUOTES. EASILY FROM ANYWHERE.EveryQuote version 4, the latest version of the popular quote organizer, comes equipped with sleek new design and advanced features to inspire users like never before.DISCOVER. QUOTES DAILY.Get inspired every day with our app’s new and popular quotes updated daily. Whether you’re looking for motivation, wisdom, or just a little bit of humor, we have something for everyone. Looking for a specific quote? Search our database by keyword or phrase to find the perfect words to fit your mood. And when you find a quote you love, save it to one of your categories so you can easily access it later.BOOK QUOTES. REMEMBER INSIGHTS.Easily save and organize key quotes from your favorite books in a separate category. Never forget the most important insights from your favorite reads again! Your personal cliffnotes, designed to help you remember the most impactful points from the books you love. With our intuitive interface, you can quickly and easily find the quotes you’re looking for, so you can refer back to them whenever you need a reminder.CATEGORIZE. MEMORABLE QUOTES.Categorize your favorite quotes by books, people, and topics, so you can find the inspiration you’re looking for whenever you need it. Bookmark your favorite quotes for easy access, and never lose track of the insights that matter most to you. And with our inbox feature, newly added quotes are always waiting for you to categorize them. That means you never have to worry about losing track of an inspiring quote again.VIEW QUOTES QUICKLY. SHARE EVEN QUICKER.Quickly peruse all the quotes in a category, so you can find the inspiration you’re looking for in no time. And when you find a quote you love, sharing it is just a press-and-hold away. With our quick share menu, you can easily share your favorite quotes with anyone – whether you prefer to share the quote itself, or a beautiful image featuring the quote. But that’s not all – we’ve also included a live camera-to-text translation feature, which lets you instantly capture and translate quotes from any printed source, right on your phone. And with our powerful inbox feature, you can continue reading and adding quotes without interruption. Simply select a category to add the quote to, or leave it in the default inbox category for later categorization. It’s that simple.ADDING QUOTES. NEVER GOT EASIER.With our intuitive interface, you can quickly and easily enter your favorite quotes by typing them out, or simply speaking them aloud. And with our powerful image-to-text translation feature, you can even capture quotes from your favorite books or magazines just by taking a picture. Add quotes from anywhere – just select any text outside of the app, tap the share menu, and select “Save to EveryQuote” to instantly save the quote to the app without ever opening it.MAKE NOTES. MAKE MEMORIESAdd notes for any quote, so you can capture your thoughts and ideas right alongside your favorite quotes. And with our powerful chapter and page information feature, you’ll never lose track of where you found that inspiring quote."
