"application_id","title","description"
"663250755","In 24 Hours Learn Indonesian","Our app provides an interactive audiovisual learning experience through scientifically proven, result oriented, tried and tested learning methods. Our app teaches you on what really matters so you can have a meaningful conversation in another language. We don't just use direct translations, our app provides users the right context translations as how native foreign speakers would express themselves in their own language. In addition, we have carefully curated the lessons to include topics which you care about to get you speaking and understanding as quick as possible.Doing business or want to do business in Indonesia or get discounts when you are on a holiday in Bali? You can definitely get the best deals if you can understand and speak the Indonesian language! Perhaps you are an explorer travelling overseas and found yourself lost in translation? No worries, you can now conquer the language barrier between you and an Indonesian speaker with this app. Too busy to enrol on a proper Indonesian language course or perhaps it is too expensive? Tell you what, you're not the only one and we now have a solution. This app is designed to work with your active lifestyle at your own pace! With the audio feature of this app, you can always learn while on the go. Whether you are driving, on the bus or train, jogging in the park or perhaps relaxing in bed, just plug in your earphones and start learning! This app gives you the easiest and most hassle free way to learn the Indonesian language! Whether you are an academic student, tourist, explorer, adventurer or businessman, this app will make sure you speak Indonesian in 24 hours! This app contains thousands of words in phrases to make sure you learn the easiest way! Thanks!________________________________________Learning with our app is for free with all the basic unlocked lessons and features. We do offer lots of helpful learning tools with our Silver Plus and Gold Plus set of features which can be unlocked using gold coins earned within the app or with an auto-renewing yearly subscription to help you learn even quicker while having more fun! If you choose to purchase Gold Plus or Silver Plus, payment will be charged to your iTunes account, and your account will be charged for renewal within 24-hours prior to the end of the current period. Auto-renewal may be turned off at any time by going to your settings in the iTunes Store after purchase. Please know that subscriptions automatically renews unless auto-renew is turned off at least 24-hours before the end of the current period. In addition, subscriptions may be managed by the user by going to the user's Account Settings after purchase. Any unused portion of a free trial period, if offered, wil be forfeited when the user purchases a suscription to that publication, where applicable. Current Silver+ and Gold+ subscription prices are displayed in the app.Terms of Use: http://www.snaconsulting.com.au/applegal/termsofuse.htm"
"1454617747","Insta Translate-translator","Insta Translate for document translation, speech translation and text translation.Support 100 languages for translation, suitable for daily work, traveling abroad, communicating with foreigners, helping you to translate and solve language problems at any time. It will be like your private translator.【The main function】- Translation language: Support Chinese, English, Japanese, French, Spanish and other translations in hundreds of languages, covering the world's accurate translation.- SharePlay Translation: Support in the process of using FaceTime, through the SharePlay function to create a new session with friends in the application, real-time translation; iOS 15.1 and above support.- Voice translation: speech recognition dialogue translation, help you communicate with local people smoothly, language communication is no longer a problem- Text translation: input text can be translated, accurate and efficient* Document translation support languages: English, Simplified Chinese, Traditional Chinese, Japanese, Korean, French, Spanish, Thai, Arabic, Russian, Portuguese, German, Italian, Greek, Dutch, Polish, Bulgarian , Estonian, Danish, Finnish, Czech, Romanian, Slovenian, Swedish, Hungarian, VietnamesePremier Account：Don't like advertising? Want more features?Please upgrade your premier account.Premier Account Pricing and Terms1 month from $4.99*3 month from $12.99*1 year from $36.99** Prices displayed areUSD$. Actual charges mightbe converted to local currency depending on your country of residence.Payment will be charged to your iTunes account at confirmation of purchase.Subscription automatically renews unless auto-renew is turned off at least 24 hours before the end of the current period.Accountwill be charged for renewal within 24 hours by the end of the current period, and the cost of the renewal will be provided.Subscriptions may be managed by the user. Auto-renewal may be turned off in user’s Account Settings after purchase.No cancellation of the current subscription is allowed during active subscriptionperiod.Any unused portion of a free trial period, if offered, will be forfeited when the user subscribs that publication.For more information:Privacy Policy: https://ftrans.bubr.net/fanyi/policy.htmlEULA: https://ftrans.bubr.net/fanyi/eula.html"
"740974884","Translate.com","You don’t need a translator by your side. From now on you will have it in your pocket. Translate.com App is a top-notch translation service that will help you facilitate everyday communication, translate texts, documents, interpret casual conversations and so much more. OUTSTANDING APP FEATURES:94 languages available for translation40,000+ qualified experts ready to provide professional human translation servicesinnovative interpreter mode unlimited text, photo and voice translationssimple and easy-to-navigate interfaceTEXT TO TEXT TRANSLATIONSTranslate any text from 64 different languages within a second. Keyboard or handwriting input are available for your convenience. VOICE TO TEXT TRANSLATIONSFind a common language no matter where you are. Casual conversations will be interpreted in a blink of an eye. Your real-time chit chat with a foreigner will be interpreted from 30 different languages. PHOTO TO TEXT TRANSLATIONSImage to text translations  have never been faster and easier. Simply take a picture on your cell phone camera and this powerful app will instantly translate every single word on it. 17 languages available. HUMAN TRANSLATIONSProfessional assistance of 40,000+ accomplished translators are at your disposal. In case you need an impeccable translation our team of dedicated  experts will work on any type of content to provide outstanding results. Languages supported by our app include: Afrikaans, Albanian, Arabic, Armenian, Azerbaijani, Basque, Belarusian, Bengali, Bosnian (Latin), Bulgarian, Catalan, Cebuano, Chinese (Simplified), Chinese (Traditional), Croatian, Czech, Danish, Dutch, English, Esperanto, Estonian, Filipino, Finnish, French, Galician, Georgian, German, Greek, Gujarati, Haitian Creole, Hausa, Hebrew, Hindi, Hmong, Hungarian, Icelandic, Igbo, Indonesian, Irish, Italian, Japanese, Javanese, Kannada, Khmer, Korean, Lao, Latin, Latvian, Lithuanian, Macedonian, Malay, Maltese, Maori, Marathi, Mongolian, Nepali, Norwegian, Persian, Polish, Portuguese, Punjabi, Romanian, Russian, Serbian (Cyrillic), Slovak, Slovenian, Somali, Spanish, Swahili, Swedish, Tamil, Telugu, Thai, Turkish, Ukrainian, Urdu, Vietnamese, Welsh, Yiddish, Yoruba, Zulu, Hmong Daw, Klingon, Serbian (Latin).Terms of Use: https://www.translate.com/legal#terms"
"734518294","Easy Translation HD!...","Easy Translation HD!, as its name suggests, is an easy to use yet powerful full-text translation tool for iPad users. With support of around 32 languages, this top-of-the-line app, offers the best possible translation for your text.::MAIN FEATURES::- Translate your text into 32 foreign languages.- Input your text by typing or speaking.- Copy your text with one tap.- The app can read aloud both source and target texts.An Internet connection is required.::SUPPORTED LANGUAGES::- Arabic- Basque- Catalan- Chinese- Chinese (traditional)- Czech- Danish- Dutch- English- Filipino- Finnish- French- German- Greek- Hindi- Hungarian- Indonesian- Irish- Italian- Japanese- Korean- Malay- Norwegian- Polish- Portuguese- Romanian- Russian- Spanish- Swedish- Thai- Turkish- VietnameseMake your life easier and get your copy now."
"1483446533","Language Translator: Easy・Fast","Voice Translator app is an easy-to-use app that helps communicate around the world. Immediate interpretation into 50 and translation into more than 100 languages. Perfect translation process: - 50 languages for instant voice translation- More than 100 languages for text translation- Possibility to conduct a dialog- Support for Apple voice recognitionHow it works?- Dictate what you want to translate or type it- Let the app read out the translation, or read it on your screen Advanced features:- Selection of an appropriate pronunciation rate- Comfortable ways for sharing translations Travelling around the world, carrying on international business or studying abroad will be much easier and let you put away language barriers only with the help of just one app. Supported languages & dialects for translation:Arabic (International), Catalan, Czech , Danish, Dutch English (Australia),English (GB), English (US), Finnish, French (Canada), French (France), German, Greek, Hebrew, Hindi, Hungarian, Italian, Japanese, Korean, Mandarin (China / Simplified), Mandarin (Taiwan / Traditional), Norwegian, Polish, Portuguese (Brazil), Portuguese (Portugal), Romanian, Russian, Slovak, Spanish (Spain), Spanish (LatAm), Swedish, Thai, Turkish and more*********************Premium access:With Premium access you get unlimited access to all the features Voice Translator has in stock.The app contains the following subscription options:- 1 week ($4.99 USD) with a 3-days free trial period• Payment will be charged to iTunes Account at confirmation of purchase• Subscription automatically renews unless auto-renew is turned off at least 24-hours before the end of the current period• Account will be charged for renewal within 24-hours prior to the end of the current period, and identify the cost of the renewal• Subscriptions may be managed by the user and auto-renewal may be turned off by going to the user's Account Settings after purchase• Any unused portion of a free trial period, if offered, will be forfeited when the user purchases a subscription to that publication, where applicablePrivacy Policy: http://appsforlife.fun/privacy.htmlTerms of Use: http://appsforlife.fun/term_of_use.html"
"696566368","In 24 Hours Learn Korean","Our app provides an interactive audiovisual learning experience through scientifically proven, result oriented, tried and tested learning methods. Our app teaches you on what really matters so you can have a meaningful conversation in another language. We don't just use direct translations, our app provides users the right context translations as how native foreign speakers would express themselves in their own language. In addition, we have carefully curated the lessons to include topics which you care about to get you speaking and understanding as quick as possible.Doing business or on holiday in Korea? You can definitely get the best business or holiday if you can understand and speak the Korean language! Perhaps you are an explorer travelling overseas and found yourself lost in translation? No worries, you can now conquer the language barrier between you and a Korean speaker with this app. Too busy to enrol on a proper Korean language course or perhaps it is too expensive? Tell you what, you're not the only one and we now have a solution. This app is designed to work with your active lifestyle at your own pace! With the audio feature of this app, you can always learn while on the go. Whether you are driving, on the bus or train, jogging in the park or perhaps relaxing in bed, just plug in your earphones and start learning! This app gives you the easiest and most hassle free way to learn the Korean language! Whether you are an academic student, tourist, explorer, adventurer or businessman, this app will make sure you speak Korean in 24 hours! This app contains thousands of words in phrases to make sure you learn the easiest way! Thanks!________________________________________Learning with our app is for free with all the basic unlocked lessons and features. We do offer lots of helpful learning tools with our Silver Plus and Gold Plus set of features which can be unlocked using gold coins earned within the app or with an auto-renewing yearly subscription to help you learn even quicker while having more fun! If you choose to purchase Gold Plus or Silver Plus, payment will be charged to your iTunes account, and your account will be charged for renewal within 24-hours prior to the end of the current period. Auto-renewal may be turned off at any time by going to your settings in the iTunes Store after purchase. Please know that subscriptions automatically renews unless auto-renew is turned off at least 24-hours before the end of the current period. In addition, subscriptions may be managed by the user by going to the user's Account Settings after purchase. Any unused portion of a free trial period, if offered, wil be forfeited when the user purchases a suscription to that publication, where applicable. Current Silver+ and Gold+ subscription prices are displayed in the app.Terms of Use: http://www.snaconsulting.com.au/applegal/termsofuse.htm"
"1147644705","Qatari Phrasebook","This phrasebook/dictionary is equipped with relevant pronunciation that aims to ease communication with natives in Qatar in different daily life situations. This Interactive Qatari phrasebook is for traveler's & expatriates and features common Qatari words and phrases. This Phrasebook App was created and edited by the Arabic language program of Georgetown University in Qatar © (2015).In this Application:• 1500+ phrases and words categorised for fast access. • Native audio pronunciation of every phrase and word. • Arabic and phonetic text translations. • You can communicate with the Native Arabic speakers. • Option to adjust spoken audio speed. • Fast access for different situations.• Search over all phrases or in word in English and French. • Star favourites for quick access• Small app size can be installed over mobile network for free. • Once downloaded works offline."
"1452821482","Translator - Offline & Voice","Translate Now is a simple yet powerful tool to translate text, speech and even to have real-time translated conversations! Travel around the world and communicate easier than ever: at the airport, supermarket, hotel, during business trips or simply while traveling on vacation. Put your personal interpreter into a pocket and use it anytime and anywhere!• Language TranslatorJust speak to translate. Dictate what you want to translate. You can then have the translation read aloud or copy it with one click.• Camera translationTranslate pictures and texts with your camera.• Text translationTranslate texts in more than 110 languages.The following languages ​​are supported:Afrikaans, Albanian, Amharic, Arabic, Armenian, Azerbaijani, Basque, Bengali, Burmese, Bosnian, Bulgarian, Cebuano, Chichewa, Chinese (traditional), Chinese (simplified), Danish, German, English, Esperanto, Estonian, Filipino, Finnish, French, Frisian, Galician, Georgian, Greek, Gujarati, Haitian, Hausa, Hawaiian, Hebrew, Hindi, Hmong, Igbo, Indonesian, Irish, Icelandic, Italian, Japanese, Javanese, Yiddish, Kannada, Kazakh, Catalan, Khmer, Kyrgyz, Korean, Corsican, Croatian, Kurdish, Lao, Latin, Latvian, Lithuanian, Luxembourgish, Malagasy, Malayalam, Malay, Maltese, Maori, Marathi, Macedonian, Mongolian, Nepali, Dutch, Norwegian, Pashto, Persian, Polish, Portuguese , Punjabi, Romanian, Russian, Samoan, Scottish Gaelic, Swedish, Serbian, Sesotho, Shona, Sindhi, Sinhala, Slovak, Slovenian, Somali, Spanish, Swahili, Sundane English, Tajik, Tamil, Telugu, Thai, Czech, Turkish, Ukrainian, Hungarian, Urdu, Uzbek, Vietnamese, Welsh, Belarussian, Xhosa, Yoruba, Zulu* Some features are not available in all languages.** An internet connection is necessary.The premium features:• Unlimited translation• 100% ad-free• Camera translation (unlimited)Subscription options:1 month1 yearSubscription payment will be charged to iTunes Account at confirmation of purchase.Subscription automatically renews unless auto-renew is turned off at least 24-hours before the end of the current period. Account will be charged for renewal within 24-hours prior to the end of the current period. Subscriptions may be managed by you and auto-renewal may be turned off by going to iTunes Account Settings. For more information please visit the link https://support.apple.com/en-us/HT202039. No cancellation of the current subscription is allowed during the active subscription period. Any unused portion of a free trial period will be forfeited when a user decides to subscribe.Permissions Notice:• Microphone & Speech Recognition• CameraPrivacy Policy: https://www.iubenda.com/privacy-policy/60733628Terms of use: https://beant.de/terms-of-serviceSupport: hi@beant.app"
"1173497095","Texarkana Travel Guide","TEXARKANA TRAVEL GUIDE with attractions, museums, restaurants, bars, hotels, theaters and shops with, pictures, rich travel info, prices and opening hours. Discover what's on and places to visit in Texarkana with our new cool app. Your guide to top attractions, shopping malls / locations, finding hotels, directions to hotels & Bars, Restaurants. An all-in-one app for all the local attractions. Our travel guide to Texarkana, featuring up-to-date information on attractions, hotels, restaurants, shopping, nightlife, travel tips and more. Highlights : ◆ Texarkana Info - Overview, Climate, Geography, History and Travel Information. ◆ Attractions - Ancient Sites, Beaches, Botanical Gardens, Coffee Farms, Museums, Scenic Drives, Towns, Waterfalls, Religious and Historical Sites Etc. ◆ Hotels - From Luxury Hotels to Budget Accommodations. Reviews, Price comparison, Gallery, Map, Search, Amenities, Address and more. ◆ Map - It is an interactive map and get turn by turn driving directions. Find traffic details, road conditions, street maps, Multi map, satellite photos, and aerial maps. Allow you to easily search and find local businesses with directions. ◆ Gallery - Picture galleries of Texarkana's most beautiful sights, interesting events, unusual occasions and more.◆ POI Search - Search everything at Texarkana. Airport, ATM, Bank, Bars, Beauty Salon, Bus Station, Cafe, Campground, Car Wash, Department Store, Doctor, Fire Station, Food, Gas Station, Hospital, Library,Lodging, Mosque, Movies, Museum, Park, Parking, Pharmacy, Pizza, Police, Shopping, Stadium, Taxi, Train Station, Travel Agency, University, Zoo. or Enter any keyword or name to search Find Name, address, distance, route map, call, directions to every business location. Sharing option available. ◆ Translator - Supports 52 languages, Large text Translation. ◆ World Clock - All major cities of the world (1000 Cities)."
"1465687740","sayeYO Music Storage","Safely and securely store all of your music, audio, photos, and video files on sayeYO!The sayeYO app offers user friendly cloud storage specifically for music, audio, and video files. Store, access, and easily share your song and video files on sayeYO. Finally there is a cloud storage app specifically for music artists, music businesses, and music fans.The sayeYO app provides an opportunity for music artists to securely store their song and video files in one place and easily share their songs, photos, and videos through fully encrypted in-app text messaging or through external communications platforms like email or social media.Don’t let your songs or videos sit on cloud storage platforms and waste away! Put all your song, audio, photos, and video files on sayeYO! You can store your song files privately or you can make them public and allow app users the opportunity to hear your music. Connect, communicate, and collaborate with a global community on the sayeYO app.All  music artists and music businesses should download the sayeYO app and utilize the free music business directory. The sayeYO app offers a music business and services directory, which consist of categories like DJ’s, Music Genres (which includes a subcategory for producers), Musicians, Mixing and Mastering, Marketing and Promotion, Blogs/News, plus much more!! Make sure to add your music business or service to the sayeYO directory and get connected to a global music community. The sayeYO business directory is free to join.If you make music or have a music business, you will want to download this app!Features include:* In-app Voice and video calling, available with cellular plans or WiFi * Music player* Text messaging (one to one, group, or broadcast)* Text translation option in 186 languages * Photo messaging* Video messaging * Music messaging* Audio messaging* Save and share urls * Compress and import audio files * Import audio files 10mb and under * Compress one or multiple audio files at a time* Compress unlimited songs or audio files* Export audio files * Combine one audio file and one photo together into MP4 and export * Make videos using stored song/audio files* Unlimited text messaging* Music business directoryPremium features include all free features plus:* Remove advertisements* Unlimited video rendering* Option to upload multiple songs to the discover page* Option to sponsor/promote songs on the discover page* View analytics Remember if you have something to say, sayeYO!"
"1021277581","Instant Translator - Converse","Do you want to communicate with people who do not speak your language? With ""Instant Translator"", you can communicate in over 100 languages!Speak to the app in one language and instantly hear your words translated to another. Features------------Instantly Speak Another LanguageSpeak to the app to get your words instantly translated to another language.-User-friendly Text ModeType or copy text from emails, messages etc to get them instantly translated to more than 90 languages.-Speaks Out TranslationsWith the auto speak option the app will instantly speak out translations. You can also listen to translations by shaking the device or tapping the play button.-Supports Over 100 LanguagesSupports 112 languages for text-to-text translation, 37 languages for speech-to-speech translation and 41 languages for text-to-speech translation-Sharing OptionsShare translations via email,messages and social mediaPro Version Features-------------------------Communicate Using Two DevicesConnect devices using bluetooth or wifi and have a voice or text conversation.-No Daily Limits and AdsThere is no restriction on the number of translations and no advertisements are displayed.Speech to Speech Translations are supported between the following languages:Arabic(Egypt), Arabic(Saudi Arabia), Arabic (UAE), Catalan, Chinese(China), Chinese(Taiwan). Czech, Danish, Dutch, English(Australia),English(UK), English(US), English(India), Finnish, French(Canada), French (France),German, Greek, Hebrew, Hindi, Hungarian, Indonesian, Italian, Japanese, Korean, Norwegian, Polish, Portuguese (Brazil), Portuguese(Portugal), Romanian, Russian, Slovak, Spanish(Spain), Spanish(Mexico), Swedish, Thai,TurkishText to Text Translations are supported between the following languages:Afrikaans,Albanian,Amharic, Arabic(Egypt), Arabic(Saudi Arabia), Arabic (UAE), Armenian, Azerbaijani, Basque, Bengali, Belarusian,  Bosnian, Bulgarian, Burmese, Catalan, Cebuano, Chinese(China), Chinese(Taiwan), Corsican, Croatian, Czech, Danish, Dutch,English(Australia),English(UK), English(US), English(India), Esperanto, Estonian, Filipino, Finnish, French(Canada), French(Franch), Galician, Georgian, German, Greek, Gujarati, Haitian, Hausa, Hawaiian, Hebrew, Hindi, Hmong, Hungarian, Icelandic, Igbo,Indonesian, Irish, Italian, Japanese, Javanese, Kannada, Kazakh, Khmer, Korean,Kurdish, Kyrgyz, Lao, Latin, Latvian, Lithuanian,Luxembourgish, Macedonian, Malagasy, Malay, Malayalam, Maltese, Maori, Marathi, Mongolian,Nepali, Norwegian,Nyanja, Pashto, Persian, Polish, Portuguese (Brazil), Portuguese(Protugal), Punjabi, Romanian, Russian,Samoan, Scottish Gaelic,  Serbian, Shona, Sindhi, Sinhala, Slovak, Slovenian, Somali, Southern Sotho,  Spanish(Spain), Spanish(Mexico), Sundanese, Swahili, Swedish, Tajik, Tamil, Telugu, Thai,Turkish, Ukrainian, Urdu, Uzbek, Vietnamese, Welsh, Western Frisian, Xhosa, Yiddish, Yoruba, ZuluIf you like ""Instant Translator"" please consider leaving a review as it would help us a lot . Thanks a lot for your support.What our users say------------------Good tool - byChris_Jeph666I downloaded this app because of a friend in Indonesia. And using it while chatting with her is just amazing. We communicate better. I found it easy to use and it has a audio option which is pretty good. It's a really nice appGreat translator -byJax097 Awesome app with so many languages to translate. So helpful for communicating when abroad or with friends from abroad!Recommended -byRachel SidneyVery useful app. Smart and quick. Like it!LeslieLove the app. My friends are amazed at the ease of operation and the accuracy of the translation.Vedic RapApp is fantastic, works a charm.AmyThis is awesome!RichardVoice recognition is good and generally speaking the translations are considering the price of the app  very good."
