app_id,unified_app_id,app_name,app_category,worldwide_release,initial_release,app_size,app_lang,multihoming,paid,in_app_purchases,app_version,app_version_date,release_note
6474008786,0,Leroy Translate,Reference,2023-12-08,2023-12-08,32.34,1,0,0,0,1.0.5,2024-01-16,Shorten startup time Fixed crashes and bugs Optimize translation experience
6474008786,0,Leroy Translate,Reference,2023-12-08,2023-12-08,32.34,1,0,0,0,1.0.4,2024-01-04,Optimize UI display Add Quote widget for ios14 and above
6474008786,0,Leroy Translate,Reference,2023-12-08,2023-12-08,32.34,1,0,0,0,1.0.3,2023-12-27,Improve image translation accuracy
6474008786,0,Leroy Translate,Reference,2023-12-08,2023-12-08,32.34,1,0,0,0,1.0.2,2023-12-13,Fixed some bugs Translate into 200 languages free and accurate Translation of daily phrases for your reference!
6474008786,0,Leroy Translate,Reference,2023-12-08,2023-12-08,32.34,1,0,0,0,1.0.1,2023-12-11,Adjust the language of the photo translation list and sort it alphabetically Fixed some bugs and optimized the UI of some pages Translate into 200 languages free and accurate Translation of daily phrases for your reference!
6474008786,0,Leroy Translate,Reference,2023-12-08,2023-12-08,32.34,1,0,0,0,1.0,2023-12-09,
